Image Filename,Caption,Cleaned Caption
Posts_oceana_18_Apr_2024_17_Apr_2025_f49c_CLEANED_0.jpeg,Waddle you know its #WorldPenguinDay!   There are 18 known species of penguins in the world today. Some call snowy Antarctica home while others live further north in relatively warmer climates. But they all share a similar dark and light coloration distinctive waddle and special adaptations for life in the ocean!   Learn more about penguins with the #linkinbio!  #PenguinDay #Penguins #Seabirds #Ocean #MarineLife,waddle you know its #worldpenguinday there are 18 known species of penguins in the world today some call snowy antarctica home while others live further north in relatively warmer climates but they all share a similar dark and light coloration distinctive waddle and special adaptations for life in the ocean learn more about penguins with the #linkinbio #penguinday #penguins #seabirds #ocean #marinelife
Posts_oceana_18_Apr_2024_17_Apr_2025_f49c_CLEANED_1.jpeg,The ocean is full of incredible creatures  and some of them have the funniest faces! Swipe through for a close-up look at some of these wild ocean animals. Which one is your favorite?,the ocean is full of incredible creatures and some of them have the funniest faces swipe through for a closeup look at some of these wild ocean animals which one is your favorite
Posts_oceana_18_Apr_2024_17_Apr_2025_f49c_CLEANED_2.jpeg,#BREAKING: POTUS has just permanently protected the East Coast West Coast and eastern Gulf of Mexico from future offshore drilling. This is a major step to safeguard the United States coasts from dirty and dangerous oil and gas.Learn more about this historic action to #ProtectOurCoast with the #linkinbio.,#breaking potus has just permanently protected the east coast west coast and eastern gulf of mexico from future offshore drilling this is a major step to safeguard the united states coasts from dirty and dangerous oil and gaslearn more about this historic action to #protectourcoast with the #linkinbio
Posts_oceana_18_Apr_2024_17_Apr_2025_f49c_CLEANED_3.jpeg,HEARTBREAKING: A dwarf sperm whale calf washed ashore in September on a Florida beach. It was found to have a large plastic bag in its stomach and associated ulcers. Sadly this baby whale had to be euthanized due to its condition. Too many marine animals are harmed by plastic pollution. Add your name to call for urgent action to reduce single-use plastics at the source and protect wildlife today with the #linkinbio. #BreakFreeFromPlastic,heartbreaking a dwarf sperm whale calf washed ashore in september on a florida beach it was found to have a large plastic bag in its stomach and associated ulcers sadly this baby whale had to be euthanized due to its condition too many marine animals are harmed by plastic pollution add your name to call for urgent action to reduce singleuse plastics at the source and protect wildlife today with the #linkinbio #breakfreefromplastic
Posts_oceana_18_Apr_2024_17_Apr_2025_f49c_CLEANED_4.jpeg,We re taking the Trump administration to court to protect our oceans from dirty offshore drilling! Oceana and our allies are suing the Trump administration challenging an order that revokes ocean protections and opens vast areas to offshore drilling. The lawsuit seeks to reinstate safeguards for millions of acres of ocean along the Atlantic Pacific Gulf and Alaska coasts emphasizing the need to protect ocean wildlife marine habitat and coastal communities This legal action marks a significant stand against policies that prioritize fossil fuel expansion over environmental conservation. President Trump does not have the authority to destroy our oceans in this way and Oceana is fighting to ensure he does not. Read more with our full press release. Link in bio. #ProtectOurCoast EarthJustice lcvoters defendersofwildlife sierraclub nrdc_org centerforbiodiv thenortherncenter Greenpeace keepalaskawild surfrider healthygulf turtleislandrestorationnetwork,we re taking the trump administration to court to protect our oceans from dirty offshore drilling oceana and our allies are suing the trump administration challenging an order that revokes ocean protections and opens vast areas to offshore drilling the lawsuit seeks to reinstate safeguards for millions of acres of ocean along the atlantic pacific gulf and alaska coasts emphasizing the need to protect ocean wildlife marine habitat and coastal communities this legal action marks a significant stand against policies that prioritize fossil fuel expansion over environmental conservation president trump does not have the authority to destroy our oceans in this way and oceana is fighting to ensure he does not read more with our full press release link in bio #protectourcoast earthjustice lcvoters defendersofwildlife sierraclub nrdc_org centerforbiodiv thenortherncenter greenpeace keepalaskawild surfrider healthygulf turtleislandrestorationnetwork
Posts_oceana_18_Apr_2024_17_Apr_2025_f49c_CLEANED_5.jpeg,You OTTER believe it - #SeaOtterAwarenessWeek is here!  Unlike many marine mammals the sea otter doesnt have blubber to keep warm. Instead it has super super thick fur - some of the densest in the whole animal kingdom! The sea otters coat has two layers which traps air against the otters skin keeping it warm dry and buoyant. But this fur can also pose major challenges for sea otters. These mammals were nearly hunted to extinction for their pelts until the turn of the 20th century. And while their populations have seen some recovery sea otters still face serious threats including oil pollution and habitat loss. Stand up for sea otters with a symbolic adoption today! All donations help power Oceana s campaigns to protect these incredible animals from the threat of dirty offshore drilling while also helping preserve the habitat they and so many other creatures call home. Link in bio.  : Shutterstock,you otter believe it #seaotterawarenessweek is here unlike many marine mammals the sea otter doesnt have blubber to keep warm instead it has super super thick fur some of the densest in the whole animal kingdom the sea otters coat has two layers which traps air against the otters skin keeping it warm dry and buoyant but this fur can also pose major challenges for sea otters these mammals were nearly hunted to extinction for their pelts until the turn of the 20th century and while their populations have seen some recovery sea otters still face serious threats including oil pollution and habitat loss stand up for sea otters with a symbolic adoption today all donations help power oceana s campaigns to protect these incredible animals from the threat of dirty offshore drilling while also helping preserve the habitat they and so many other creatures call home link in bio shutterstock
Posts_oceana_18_Apr_2024_17_Apr_2025_f49c_CLEANED_6.jpeg,Today the Trump administration issued layoffs to NOAA employees. These roles are essential to maintaining a healthy ocean in the United States. They keep fisheries healthy protect endangered animals like whales and turtles and support critical scientific research. Without them America s oceans Great Lakes and coastal economies will suffer severe consequences. NOAA is a critical tool for protecting our oceans and its up to us to defend it. Contact your U.S. representatives to tell them to push back & stand up for NOAA today. Link in bio.,today the trump administration issued layoffs to noaa employees these roles are essential to maintaining a healthy ocean in the united states they keep fisheries healthy protect endangered animals like whales and turtles and support critical scientific research without them america s oceans great lakes and coastal economies will suffer severe consequences noaa is a critical tool for protecting our oceans and its up to us to defend it contact your us representatives to tell them to push back stand up for noaa today link in bio
Posts_oceana_18_Apr_2024_17_Apr_2025_f49c_CLEANED_7.jpeg,Happy #WorldTurtleDay!   Sea turtles roamed the planet back when dinosaurs were still alive!   Today there are seven species of sea turtles around the world six of which are found in U.S. waters.You can celebrate sea turtles with a symbolic adoption today! Your donation helps power our campaigns to protect these special creatures and others from threats like habitat loss destructive fishing practices and plastic pollution. Link in bio. #SeaTurtle #Turtles #Ocean #OceanWildlife #StandForOceans,happy #worldturtleday sea turtles roamed the planet back when dinosaurs were still alive today there are seven species of sea turtles around the world six of which are found in us watersyou can celebrate sea turtles with a symbolic adoption today your donation helps power our campaigns to protect these special creatures and others from threats like habitat loss destructive fishing practices and plastic pollution link in bio #seaturtle #turtles #ocean #oceanwildlife #standforoceans
Posts_oceana_18_Apr_2024_17_Apr_2025_f49c_CLEANED_8.jpeg,Happy #MothersDay to all mothers out there wherever you may be!   The oceans are home to some pretty dedicated animal moms. But these oceanic mothers need clean and healthy oceans to survive and raise their families! Join Oceana to help make oceans safer for marine moms & all ocean life with the #linkinbio.,happy #mothersday to all mothers out there wherever you may be the oceans are home to some pretty dedicated animal moms but these oceanic mothers need clean and healthy oceans to survive and raise their families join oceana to help make oceans safer for marine moms all ocean life with the #linkinbio
Posts_oceana_18_Apr_2024_17_Apr_2025_f49c_CLEANED_9.jpeg,The narwhal is so strikingly unique it almost seems like a mythical creature at times.  This excerpt from Katherine Rundell s new book  Vanishing Treasures: A Bestiary of Extraordinary Endangered Creatures  explores the extraordinary reality of the narwhal as well as the all-too-real threats it faces. Our oceans are full of fascinating and awe-inspiring creatures like the narwhal and it s up to us all to protect this wildlife and the waters they call home. Narrator: Lenny Henry,the narwhal is so strikingly unique it almost seems like a mythical creature at times this excerpt from katherine rundell s new book vanishing treasures a bestiary of extraordinary endangered creatures explores the extraordinary reality of the narwhal as well as the alltooreal threats it faces our oceans are full of fascinating and aweinspiring creatures like the narwhal and it s up to us all to protect this wildlife and the waters they call home narrator lenny henry
Posts_oceana_18_Apr_2024_17_Apr_2025_f49c_CLEANED_10.jpeg,We stand in support with all those affected by the horrific floods in Spain. Over 140 people have been killed dozens are missing and towns and roads across southern and eastern regions of the country remain flooded. While heavy rains are common on the Spanish Mediterranean coast this time of year this is the heaviest rainfall in decades. Extreme weather events like this are becoming more and more common as our climate changes and global temperatures rise. We cannot ignore what s all-too clear: the climate crisis is here now and it s bringing devastation to people around the world. We must take immediate action to tackle the climate crisis including stopping dirty offshore drilling. Our entire future depends on it.   :   Gabriel Gallo / Greenpeace,we stand in support with all those affected by the horrific floods in spain over 140 people have been killed dozens are missing and towns and roads across southern and eastern regions of the country remain flooded while heavy rains are common on the spanish mediterranean coast this time of year this is the heaviest rainfall in decades extreme weather events like this are becoming more and more common as our climate changes and global temperatures rise we cannot ignore what s alltoo clear the climate crisis is here now and it s bringing devastation to people around the world we must take immediate action to tackle the climate crisis including stopping dirty offshore drilling our entire future depends on it gabriel gallo greenpeace
Posts_oceana_18_Apr_2024_17_Apr_2025_f49c_CLEANED_11.jpeg,NOAA is under threat   and that probably impacts you more than you think. From providing weather forecasts to protecting marine wildlife NOAA s important work supports our oceans and our country. Recent efforts by the Trump administration to target federal agencies threaten NOAA s staff programs and mission. Join Oceana in calling for Congress to defend NOAA today. Link in bio.,noaa is under threat and that probably impacts you more than you think from providing weather forecasts to protecting marine wildlife noaa s important work supports our oceans and our country recent efforts by the trump administration to target federal agencies threaten noaa s staff programs and mission join oceana in calling for congress to defend noaa today link in bio
Posts_oceana_18_Apr_2024_17_Apr_2025_f49c_CLEANED_12.jpeg,It s #WorldSeaTurtleDay!     There are seven species of sea turtles found around the world today and six of them are currently endangered or threatened. These majestic animals face a vast array of threats including habitat loss ocean pollution entanglement in fishing gear and climate change. Join us in protecting sea turtles and our marvelous oceans today! Link in bio. #SeaTurtleWeek #SeaTurtleDay #SeaTurtle,it s #worldseaturtleday there are seven species of sea turtles found around the world today and six of them are currently endangered or threatened these majestic animals face a vast array of threats including habitat loss ocean pollution entanglement in fishing gear and climate change join us in protecting sea turtles and our marvelous oceans today link in bio #seaturtleweek #seaturtleday #seaturtle
Posts_oceana_18_Apr_2024_17_Apr_2025_f49c_CLEANED_13.jpeg,Dont sleep on #WorldWalrusDay!Recognizable by their prominent tusks the walrus is one of the most iconic animals in the Arctic! These titanic tusks are actually specialized canine teeth.  Walruses use their tusks in a variety of ways including fighting with other walruses defending against potential predators or even digging into ice to help the walrus haul itself out of the water.Learn more about the wonderful #walrus with the #linkinbio.,dont sleep on #worldwalrusdayrecognizable by their prominent tusks the walrus is one of the most iconic animals in the arctic these titanic tusks are actually specialized canine teeth walruses use their tusks in a variety of ways including fighting with other walruses defending against potential predators or even digging into ice to help the walrus haul itself out of the waterlearn more about the wonderful #walrus with the #linkinbio
Posts_oceana_18_Apr_2024_17_Apr_2025_f49c_CLEANED_14.jpeg,Time to seal-abrate   its #SealDay!  There are 18 species of true seals also called earless seals around the world today. One additional species the Caribbean monk seal is considered extinct as it has not been sighted since 1952.Seals can be found in waters around the world from the Arctic to Antarctica. Their flippers and streamlined bodies make them perfectly suited to spend most of their life in the waters they call home! Learn more about seals with the #linkinbio. #InternationalDayOfTheSeal,time to sealabrate its #sealday there are 18 species of true seals also called earless seals around the world today one additional species the caribbean monk seal is considered extinct as it has not been sighted since 1952seals can be found in waters around the world from the arctic to antarctica their flippers and streamlined bodies make them perfectly suited to spend most of their life in the waters they call home learn more about seals with the #linkinbio #internationaldayoftheseal
Posts_oceana_18_Apr_2024_17_Apr_2025_f49c_CLEANED_15.jpeg,ANOTHER TRAGEDY: A dead hawksbill sea turtle was found on a Florida beach this week. While its cause of death is undetermined the turtle had plastic both in its mouth and wound tightly around one of its front flipper. This sea turtle was found along the same beaches where a dwarf sperm whale calf washed ashore in September. The whale which did not survive had ingested a large plastic bag. Plastic pollution is injuring and killing far too many animals around the world. We need serious action to combat the plastic crisis and that involves reducing our production of single-use plastic at the source. Speak up to tackle plastic pollution and protect wildlife today with the #linkinbio. #BreakFreeFromPlastic   : Hawksbill photos credited to Oceana/Maggie Boselowitz/St. Johns County Habitat Conservation Team : Dwarf sperm whale photo credited to Oceana/Joseph Pellegrino & St. Johns County Office of Public Affairs.,another tragedy a dead hawksbill sea turtle was found on a florida beach this week while its cause of death is undetermined the turtle had plastic both in its mouth and wound tightly around one of its front flipper this sea turtle was found along the same beaches where a dwarf sperm whale calf washed ashore in september the whale which did not survive had ingested a large plastic bag plastic pollution is injuring and killing far too many animals around the world we need serious action to combat the plastic crisis and that involves reducing our production of singleuse plastic at the source speak up to tackle plastic pollution and protect wildlife today with the #linkinbio #breakfreefromplastic hawksbill photos credited to oceanamaggie boselowitzst johns county habitat conservation team dwarf sperm whale photo credited to oceanajoseph pellegrino st johns county office of public affairs
Posts_oceana_18_Apr_2024_17_Apr_2025_f49c_CLEANED_16.jpeg,Today we celebrate the LARGEST fish in the world: the graceful whale shark.   Though they reach the size of a school bus whale sharks eat tiny prey like plankton. A five-foot wide mouth with filtering pads inside allows these sharks to feed by sucking in mouthfuls of water and straining out the prey!This #InternationalWhaleSharkDay learn more about these gentle giants with the #linkinbio. : Shutterstock #WhaleShark #Shark #MarineLife #Ocean,today we celebrate the largest fish in the world the graceful whale shark though they reach the size of a school bus whale sharks eat tiny prey like plankton a fivefoot wide mouth with filtering pads inside allows these sharks to feed by sucking in mouthfuls of water and straining out the preythis #internationalwhalesharkday learn more about these gentle giants with the #linkinbio shutterstock #whaleshark #shark #marinelife #ocean
Posts_oceana_18_Apr_2024_17_Apr_2025_f49c_CLEANED_17.jpeg,Check out these turtle-y awesome facts for #SeaTurtleWeek!   This week is all about sea turtles both in shell-abrating how amazing they are and recognizing the threats they face. Habitat loss plastic pollution climate change and destructive fishing practices are just some of the numerous threats sea turtles are facing around the world. Learn more about these terrific turtles and what Oceana is doing to help protect them & their ocean home with the #linkinbio. #SeaTurtle #Turtle #Ocean #OceanAnimal #MarineLife #EndangeredSpecies #StandForOceans,check out these turtley awesome facts for #seaturtleweek this week is all about sea turtles both in shellabrating how amazing they are and recognizing the threats they face habitat loss plastic pollution climate change and destructive fishing practices are just some of the numerous threats sea turtles are facing around the world learn more about these terrific turtles and what oceana is doing to help protect them their ocean home with the #linkinbio #seaturtle #turtle #ocean #oceananimal #marinelife #endangeredspecies #standforoceans
Posts_oceana_18_Apr_2024_17_Apr_2025_f49c_CLEANED_18.jpeg,North Atlantic right whale calf alert! First-time mom  Accordion  was spotted with her newborn off the coast of New York   an unusual location as most right whale calves are born further south in warmer waters. Scientists aren t sure why this pair is so far north but their journey comes with risks. Right now they re swimming dangerously close to busy shipping lanes and boat strikes are one of the main causes of death for these critically endangered whales. With under 370 right whales left every calf matters! Speak up for stronger protections for the #RightWhaleToSave today. Link in bio.  : Photo by NOAA/Northeast Fisheries Science Center under NOAA permit 27066,north atlantic right whale calf alert firsttime mom accordion was spotted with her newborn off the coast of new york an unusual location as most right whale calves are born further south in warmer waters scientists aren t sure why this pair is so far north but their journey comes with risks right now they re swimming dangerously close to busy shipping lanes and boat strikes are one of the main causes of death for these critically endangered whales with under 370 right whales left every calf matters speak up for stronger protections for the #rightwhaletosave today link in bio photo by noaanortheast fisheries science center under noaa permit 27066
Posts_oceana_18_Apr_2024_17_Apr_2025_f49c_CLEANED_19.jpeg,What big teeth the wolffish has!  Its the wolffishs large canine-like teeth that earned them their ferocious name. These fish use their large chompers to crush hard-shelled prey like sea urchins scallops or large crabs.   Learn more about these fearsome fish with our Marine Life Encyclopedia. Link in bio. #SpookySeason : Shuttersstock,what big teeth the wolffish has its the wolffishs large caninelike teeth that earned them their ferocious name these fish use their large chompers to crush hardshelled prey like sea urchins scallops or large crabs learn more about these fearsome fish with our marine life encyclopedia link in bio #spookyseason shuttersstock
Posts_oceana_18_Apr_2024_17_Apr_2025_f49c_CLEANED_20.jpeg,Happy #WorldWildlifeConservationDay!     All these magnificent species were spotted during Oceanas on-the-water expeditions over the years. These voyages around the world allow us to document unique ocean habitats learn about the wildlife that live there and to bring them to life for policymakers and the public. This enables Oceana to win policy victories that protect these special places.  Since our first expedition we have led over 60 scientific expeditions and conducted thousands of ocean surveys. These expeditions have been instrumental in Oceana protecting over 10 million square kilometers (nearly 4 million square miles) of ocean habitat!  Help us keep the momentum going join us today to protect the ocean and its wildlife! Link in bio.,happy #worldwildlifeconservationday all these magnificent species were spotted during oceanas onthewater expeditions over the years these voyages around the world allow us to document unique ocean habitats learn about the wildlife that live there and to bring them to life for policymakers and the public this enables oceana to win policy victories that protect these special places since our first expedition we have led over 60 scientific expeditions and conducted thousands of ocean surveys these expeditions have been instrumental in oceana protecting over 10 million square kilometers nearly 4 million square miles of ocean habitat help us keep the momentum going join us today to protect the ocean and its wildlife link in bio
Posts_oceana_18_Apr_2024_17_Apr_2025_f49c_CLEANED_21.jpeg,Tell mom: there s no OTTER mom like her!   Celebrate both ocean moms & the mothers in your life by shopping our special #MothersDay collection. Theres no better gift than the gift that gives back! Link in bio.   :Manuel Balesteri / Shutterstock  #SeaOtter #SeaOtterPup #SeaOtterMom #MarineLife #MarineAnimal #Ocean #OceanAnimal #Cute #Mother #StandForOceans,tell mom there s no otter mom like her celebrate both ocean moms the mothers in your life by shopping our special #mothersday collection theres no better gift than the gift that gives back link in bio manuel balesteri shutterstock #seaotter #seaotterpup #seaottermom #marinelife #marineanimal #ocean #oceananimal #cute #mother #standforoceans
Posts_oceana_18_Apr_2024_17_Apr_2025_f49c_CLEANED_22.jpeg,To mark #LostSpeciesDay today take a glimpse at just a few of the many species that have gone extinct in recent centuries. Today over 46300 species around the world are threatened by extinction  that s 28% of all assessed species. If we don t take urgent action now we will see more and more species continue to disappear forever. Oceana campaigns to protect marine species threatened with extinction like sharks and North Atlantic right whale from their top threats. Join us to make a difference today! Source for all facts: IUCN Red List,to mark #lostspeciesday today take a glimpse at just a few of the many species that have gone extinct in recent centuries today over 46300 species around the world are threatened by extinction that s 28 of all assessed species if we don t take urgent action now we will see more and more species continue to disappear forever oceana campaigns to protect marine species threatened with extinction like sharks and north atlantic right whale from their top threats join us to make a difference today source for all facts iucn red list
Posts_oceana_18_Apr_2024_17_Apr_2025_f49c_CLEANED_23.jpeg,Today is #AntarcticaDay!   Antarctic waters may be frigid but they still support a variety of wildlife! Do you recognize these species that can be found down here?    Check the comments below for answers!   And learn more about Antarctic with our Marine Life Encyclopedia! Link in bio.,today is #antarcticaday antarctic waters may be frigid but they still support a variety of wildlife do you recognize these species that can be found down here check the comments below for answers and learn more about antarctic with our marine life encyclopedia link in bio
