Image Filename,Caption,Cleaned Caption
Posts_oceana_18_Apr_2024_17_Apr_2025_f49c_CLEANED_346.jpeg,Our oceans should not have to drown in oil to move toward a clean energy future but right now that s what s happening. Offshore drilling shouldn t be required for clean wind! Click the link in our bio to make your voice heard and speak up to #ProtectOurCoast.  : Matt Gertson / Shutterstock,our oceans should not have to drown in oil to move toward a clean energy future but right now that s what s happening offshore drilling shouldn t be required for clean wind click the link in our bio to make your voice heard and speak up to #protectourcoast matt gertson shutterstock
Posts_oceana_18_Apr_2024_17_Apr_2025_f49c_CLEANED_347.jpeg,HUGE NEWS: Your impact now TRIPLED! Our special #GivingTuesday match from biossance just went up! That means 3X the impact:  Protecting sea turtles from plastic pollution   Safeguarding marine habitats.   Saving critically endangered whales.   Securing a healthy future for our oceans.   Donate before midnight. Your gift can go three times as far don t miss this incredible opportunity!,huge news your impact now tripled our special #givingtuesday match from biossance just went up that means 3x the impact protecting sea turtles from plastic pollution safeguarding marine habitats saving critically endangered whales securing a healthy future for our oceans donate before midnight your gift can go three times as far don t miss this incredible opportunity
Posts_oceana_18_Apr_2024_17_Apr_2025_f49c_CLEANED_348.jpeg,On Tuesday we gathered in New York City for  An Evening of Jazz  presented by blancpain1735 to celebrate our oceans! We were thrilled to be joined by the talented rumerwillis & briannewmanny and honored that distinguished guests like TedDanson susanrockefeller and Sam Waterston all came together to support Oceana s mission to protect and restore the world s oceans!   In addition to celebrating recent ocean victories the event also helped raise funds for Oceana to expand our campaigns to Ghana Senegal and Malaysia   three coastal nations where many local communities rely on fish and the oceans to support their livelihoods and families. Learn more with the #linkinbio.   : BFA / Zach Hilty,on tuesday we gathered in new york city for an evening of jazz presented by blancpain1735 to celebrate our oceans we were thrilled to be joined by the talented rumerwillis briannewmanny and honored that distinguished guests like teddanson susanrockefeller and sam waterston all came together to support oceana s mission to protect and restore the world s oceans in addition to celebrating recent ocean victories the event also helped raise funds for oceana to expand our campaigns to ghana senegal and malaysia three coastal nations where many local communities rely on fish and the oceans to support their livelihoods and families learn more with the #linkinbio bfa zach hilty
Posts_oceana_18_Apr_2024_17_Apr_2025_f49c_CLEANED_349.jpeg,The U.S. is failing North Atlantic right whales which are on the brink of extinction with only around 370 whales left. Now due to the United States  inaction the Commission for Environmental Cooperation (cecnorthamerica) part of the United States-Mexico-Canada Agreement (USMCA) includes representatives from each country voted unanimously to investigate U.S. shortcomings to protect North Atlantic right whales. Oceana says: hold the U.S. accountable and protect the #RightWhaleToSave! Read more with the #linkinbio.,the us is failing north atlantic right whales which are on the brink of extinction with only around 370 whales left now due to the united states inaction the commission for environmental cooperation cecnorthamerica part of the united statesmexicocanada agreement usmca includes representatives from each country voted unanimously to investigate us shortcomings to protect north atlantic right whales oceana says hold the us accountable and protect the #rightwhaletosave read more with the #linkinbio
Posts_oceana_18_Apr_2024_17_Apr_2025_f49c_CLEANED_350.jpeg,In Canada seafood is harvested using a variety of different methods.    While some methods are more sustainable and species-selective others unintentionally harm other marine life and damage sensitive marine habitats. Oceana campaigns in Canada and around the world for science-based policies that stop overfishing promote responsible fisheries and help rebuild ocean abundance. Learn more about our work with the #linkinbio!,in canada seafood is harvested using a variety of different methods while some methods are more sustainable and speciesselective others unintentionally harm other marine life and damage sensitive marine habitats oceana campaigns in canada and around the world for sciencebased policies that stop overfishing promote responsible fisheries and help rebuild ocean abundance learn more about our work with the #linkinbio
Posts_oceana_18_Apr_2024_17_Apr_2025_f49c_CLEANED_351.jpeg,There might not be actual fireworks in the ocean but these sea urchins certainly put on a pretty spectacular display!   #IndependenceDay,there might not be actual fireworks in the ocean but these sea urchins certainly put on a pretty spectacular display #independenceday
Posts_oceana_18_Apr_2024_17_Apr_2025_f49c_CLEANED_352.jpeg,TIME IS RUNNING OUT  to make a difference for oceans in 2024! Our oceans need you   and they can t wait until next year! Donate to make TRIPLE the splash protecting our oceans today thanks to our partner blancpain1735!,time is running out to make a difference for oceans in 2024 our oceans need you and they can t wait until next year donate to make triple the splash protecting our oceans today thanks to our partner blancpain1735
Posts_oceana_18_Apr_2024_17_Apr_2025_f49c_CLEANED_353.jpeg,TEST YOUR KNOWLEDGE: Do you know what group each of these animals belongs to? #WildlifeWednesday,test your knowledge do you know what group each of these animals belongs to #wildlifewednesday
Posts_oceana_18_Apr_2024_17_Apr_2025_f49c_CLEANED_354.jpeg,On July 25 2024 an oil tanker holding 1.5 million liters (400000 gallons) of industrial fuel oil sank in the Philippines Manila Bay. Spills like this can have serious impacts for local ecosystems marine life and communities.   Swipe through to see what this spill means for life in Manila Bay and what must be done to address it.,on july 25 2024 an oil tanker holding 15 million liters 400000 gallons of industrial fuel oil sank in the philippines manila bay spills like this can have serious impacts for local ecosystems marine life and communities swipe through to see what this spill means for life in manila bay and what must be done to address it
Posts_oceana_18_Apr_2024_17_Apr_2025_f49c_CLEANED_355.jpeg,TAKE ACTION to protect the critically endangered North Atlantic right whale! North Atlantic right whales are in dire peril and collisions with boats are one of the leading causes of injury or death for the species. Tell POTUS to issue the updated vessel speed rule to protect the #RightWhaleToSave from speeding boats today with the #linkinbio.,take action to protect the critically endangered north atlantic right whale north atlantic right whales are in dire peril and collisions with boats are one of the leading causes of injury or death for the species tell potus to issue the updated vessel speed rule to protect the #rightwhaletosave from speeding boats today with the #linkinbio
Posts_oceana_18_Apr_2024_17_Apr_2025_f49c_CLEANED_356.jpeg,Ocean warming is impacting one of the smallest but most essential creatures in our oceans  plankton. New research reveals that as ocean temperatures rise plankton are struggling to thrive disrupting marine ecosystems that depend on them for food.   Want to help?   Share this post to raise awareness about the invisible impact of ocean warming   Sign Oceana s petition at the link in our bio,ocean warming is impacting one of the smallest but most essential creatures in our oceans plankton new research reveals that as ocean temperatures rise plankton are struggling to thrive disrupting marine ecosystems that depend on them for food want to help share this post to raise awareness about the invisible impact of ocean warming sign oceana s petition at the link in our bio
Posts_oceana_18_Apr_2024_17_Apr_2025_f49c_CLEANED_357.jpeg,Capelin are a forage fish whose importance far outweighs their small size!But despite their importance capelin are in trouble. Watch to see how we can recover capelin populations to healthy levels and benefit our oceans & local communities! Learn more about oceana_canadas campaign to protect capelin and restore their abundance with the #Linkinbio.,capelin are a forage fish whose importance far outweighs their small sizebut despite their importance capelin are in trouble watch to see how we can recover capelin populations to healthy levels and benefit our oceans local communities learn more about oceana_canadas campaign to protect capelin and restore their abundance with the #linkinbio
Posts_oceana_18_Apr_2024_17_Apr_2025_f49c_CLEANED_358.jpeg,These dolphins have STYLE!This #DolphinAwarenessMonth get to know the pantropical spotted dolphin and the hourglass dolphin!Learn more about these dapper dolphins with the #linkinbio.,these dolphins have stylethis #dolphinawarenessmonth get to know the pantropical spotted dolphin and the hourglass dolphinlearn more about these dapper dolphins with the #linkinbio
Posts_oceana_18_Apr_2024_17_Apr_2025_f49c_CLEANED_359.jpeg,Celebrate #NationalParksWeek by protecting Americas parks from single-use plastic! Our national parks deserve better than plastic pollution. Fortunately secdebhaaland has ordered the phase out of single-use plastics in all national parks but we want to make sure this happens as quickly as possible to reduce plastic s impact on our parks and planet! Join us in calling for nationalparkservice and usinterior to act more quickly to protect our national parks from plastic pollution today with the #linkinbio,celebrate #nationalparksweek by protecting americas parks from singleuse plastic our national parks deserve better than plastic pollution fortunately secdebhaaland has ordered the phase out of singleuse plastics in all national parks but we want to make sure this happens as quickly as possible to reduce plastic s impact on our parks and planet join us in calling for nationalparkservice and usinterior to act more quickly to protect our national parks from plastic pollution today with the #linkinbio
Posts_oceana_18_Apr_2024_17_Apr_2025_f49c_CLEANED_360.jpeg,On our last underwater expedition in the Paracas National Reserve we came across one of the six species of pufferfish in Peru!This species is most commonly seen from Baja California Mexico to the south of Piura. So how did it get to the south? Watch to find out!   peterniada,on our last underwater expedition in the paracas national reserve we came across one of the six species of pufferfish in peruthis species is most commonly seen from baja california mexico to the south of piura so how did it get to the south watch to find out peterniada
Posts_oceana_18_Apr_2024_17_Apr_2025_f49c_CLEANED_361.jpeg,Mangrove forests:   Capture and store carbon   Protect communities from heavy rains storms and erosion by being powerful coastal defenders  Provide nesting nursery and feeding grounds for a variety of species  Are a source of food water quality improvement and livelihood for local communitiesBut despite their critical importance mangroves remain undervalued and severely threatened. Thats why Oceana campaigns to #RestoreMangroveForests in the Philippines in 2022. Our goal is to secure the approval of a national law to facilitate the restoration and preservation of mangroves and beach forests to combat coastal erosion and mitigate the adverse effects of climate change. Learn more about our work with the #linkinbio! #WorldMangroveDay Oceana_ph,mangrove forests capture and store carbon protect communities from heavy rains storms and erosion by being powerful coastal defenders provide nesting nursery and feeding grounds for a variety of species are a source of food water quality improvement and livelihood for local communitiesbut despite their critical importance mangroves remain undervalued and severely threatened thats why oceana campaigns to #restoremangroveforests in the philippines in 2022 our goal is to secure the approval of a national law to facilitate the restoration and preservation of mangroves and beach forests to combat coastal erosion and mitigate the adverse effects of climate change learn more about our work with the #linkinbio #worldmangroveday oceana_ph
Posts_oceana_18_Apr_2024_17_Apr_2025_f49c_CLEANED_362.jpeg,Recycling will not solve the plastic pollution crisis our planet has found itself in. But there are ways we CAN combat this major issue - by reducing the amount of single-use plastic being produced at the source. Add your name to #BreakFreeFromPlastic with the #linkinbio today!,recycling will not solve the plastic pollution crisis our planet has found itself in but there are ways we can combat this major issue by reducing the amount of singleuse plastic being produced at the source add your name to #breakfreefromplastic with the #linkinbio today
Posts_oceana_18_Apr_2024_17_Apr_2025_f49c_CLEANED_363.jpeg,Today alone almost 1 billion disposable plastic items were produced in Brazil.Every second 15000 of these items are produced in Brazil. We continue to create single-use plastic items that are made from a material that can last centuries but are thrown away after just one use. Following this path is to keep polluting our oceans and harming our health and the environment.  As the largest producer of this material in Latin America it is urgent that Brazil leads the change and revises the way it produces and consumes plastic. Thats why were calling for Brazil to pass a bill focusing on the problem of plastic pollution at the root! If you live in Brazil add your name to support the Plastic-Free Ocean Bill with the #linkinbio!#PlasticFreeOcean #StopThePlasticTsunami OceanaBrasil #PlasticFreeJuly,today alone almost 1 billion disposable plastic items were produced in brazilevery second 15000 of these items are produced in brazil we continue to create singleuse plastic items that are made from a material that can last centuries but are thrown away after just one use following this path is to keep polluting our oceans and harming our health and the environment as the largest producer of this material in latin america it is urgent that brazil leads the change and revises the way it produces and consumes plastic thats why were calling for brazil to pass a bill focusing on the problem of plastic pollution at the root if you live in brazil add your name to support the plasticfree ocean bill with the #linkinbio#plasticfreeocean #stoptheplastictsunami oceanabrasil #plasticfreejuly
Posts_oceana_18_Apr_2024_17_Apr_2025_f49c_CLEANED_364.jpeg,The recovery of northern cod is under threat by a recent decision from Canadas Fisheries Minister. After a 32-year moratorium the Minister of Fisheries and Oceans has announced the reopening of the commercial northern cod fishery along with increasing the Canadian fishing quota by 38.5%.The decision made as the stock barely moved out of the critical zone poses significant risks to the future recovery of this iconic fish population and a centuries-old fishery that is vital for Newfoundland and Labrador ocean ecosystems and coastal communities. It ignores scientific advice and the urgent need to address the impacts of decades of overfishing and short-sighted fisheries management. We are deeply concerned with this short-sighted decision as opening the commercial fishery puts the stock at significant risk and undermines efforts to rebuild healthy oceans and coastal communities. Read oceana_canada s full press release with the #linkinbio.,the recovery of northern cod is under threat by a recent decision from canadas fisheries minister after a 32year moratorium the minister of fisheries and oceans has announced the reopening of the commercial northern cod fishery along with increasing the canadian fishing quota by 385the decision made as the stock barely moved out of the critical zone poses significant risks to the future recovery of this iconic fish population and a centuriesold fishery that is vital for newfoundland and labrador ocean ecosystems and coastal communities it ignores scientific advice and the urgent need to address the impacts of decades of overfishing and shortsighted fisheries management we are deeply concerned with this shortsighted decision as opening the commercial fishery puts the stock at significant risk and undermines efforts to rebuild healthy oceans and coastal communities read oceana_canada s full press release with the #linkinbio
Posts_oceana_18_Apr_2024_17_Apr_2025_f49c_CLEANED_365.jpeg,VICTORY: New England cod nursery protected from proposed scallop dredging! Weve won protection for an important cod nursery on Georges Bank in New England. With our allies Oceana beat back an attempt by the U.S. scallop fishery to open this protected area to the dragging of heavy dredges along the seafloor to catch scallops which would damage habitat and scoop up other non-target marine life. Oceana persuaded the New England Fishery Management Council that this type of fishing is in direct conflict with preserving the area for spawning growth and feeding of Atlantic cod American lobster and Atlantic herring. Learn more about our campaigns to stop overfishing and promote responsible fisheries with the #linkinbio.   #StandForOceans,victory new england cod nursery protected from proposed scallop dredging weve won protection for an important cod nursery on georges bank in new england with our allies oceana beat back an attempt by the us scallop fishery to open this protected area to the dragging of heavy dredges along the seafloor to catch scallops which would damage habitat and scoop up other nontarget marine life oceana persuaded the new england fishery management council that this type of fishing is in direct conflict with preserving the area for spawning growth and feeding of atlantic cod american lobster and atlantic herring learn more about our campaigns to stop overfishing and promote responsible fisheries with the #linkinbio #standforoceans
Posts_oceana_18_Apr_2024_17_Apr_2025_f49c_CLEANED_366.jpeg,IMAGINE THIS: If single-use plastics had been around during these times they could STILL be around today. Mass production of plastics began to rise in the 1950 s so it s true that they weren t hanging around at events like the signing of the Declaration of Independence. However scientists believe that these plastics may take centuries to fully degrade so if they HAD been there these same plastics could still be around today. And yet some of these plastics are only actually in use for a few minutes before they are discarded. It s clear: the concept of single-use plastics doesn t make sense! Add your name to help our planet #BreakFreeFromPlastic today with the #linkinbio.,imagine this if singleuse plastics had been around during these times they could still be around today mass production of plastics began to rise in the 1950 s so it s true that they weren t hanging around at events like the signing of the declaration of independence however scientists believe that these plastics may take centuries to fully degrade so if they had been there these same plastics could still be around today and yet some of these plastics are only actually in use for a few minutes before they are discarded it s clear the concept of singleuse plastics doesn t make sense add your name to help our planet #breakfreefromplastic today with the #linkinbio
Posts_oceana_18_Apr_2024_17_Apr_2025_f49c_CLEANED_367.jpeg,Plastics are one of the greatest threats facing our oceans today. But how did we get here?Today there isnt a place on Earth untouched by plastic. And plastic pollution harms not only our oceans but also our climate health and communities.To combat this crisis we must reduce the amount of single-use plastic being produced and used! Add your name to #BreakFreeFromPlastic with the #linkinbio. #PlasticFreeJuly,plastics are one of the greatest threats facing our oceans today but how did we get heretoday there isnt a place on earth untouched by plastic and plastic pollution harms not only our oceans but also our climate health and communitiesto combat this crisis we must reduce the amount of singleuse plastic being produced and used add your name to #breakfreefromplastic with the #linkinbio #plasticfreejuly
Posts_oceana_18_Apr_2024_17_Apr_2025_f49c_CLEANED_368.jpeg,ATTENTION OCEAN LOVERS  Our oceans need your help now more than ever. And now our match has been INCREASED so your gift can go 3X as far thanks to our generous partner blancpain1735. Join us in protecting critical ocean habitat and saving vulnerable ocean animals from threats like plastic pollution.     The power to protect and restore the world s oceans is in our hands!,attention ocean lovers our oceans need your help now more than ever and now our match has been increased so your gift can go 3x as far thanks to our generous partner blancpain1735 join us in protecting critical ocean habitat and saving vulnerable ocean animals from threats like plastic pollution the power to protect and restore the world s oceans is in our hands
Posts_oceana_18_Apr_2024_17_Apr_2025_f49c_CLEANED_369.jpeg,Have you been told that a disposable item is better because its made of cardboard or poly-paper?Many times cups and wrappers are made of poly-paper which makes them seem more environmentally friendly. However these products are still single-use plastics as they contain a plastic layer that makes them waterproof.Chiles Single-use Plastics Law aims to address this issue. Starting in 2026 reusable items will be required for on-site consumption in food establishments reducing the distribution of disposables that often end up as waste in cities and oceans.oceana_chile is part of a coalition with a variety of allies working to promote the Single-Use Plastics Law and support its implementation. Learn more about our work to #GetOverPlastics with the #linkinbio! #SuperaElPl stico,have you been told that a disposable item is better because its made of cardboard or polypapermany times cups and wrappers are made of polypaper which makes them seem more environmentally friendly however these products are still singleuse plastics as they contain a plastic layer that makes them waterproofchiles singleuse plastics law aims to address this issue starting in 2026 reusable items will be required for onsite consumption in food establishments reducing the distribution of disposables that often end up as waste in cities and oceansoceana_chile is part of a coalition with a variety of allies working to promote the singleuse plastics law and support its implementation learn more about our work to #getoverplastics with the #linkinbio #superaelpl stico
Posts_oceana_18_Apr_2024_17_Apr_2025_f49c_CLEANED_370.jpeg,#DYK water samples can unlock long-kept ocean secrets? On our Southern California expedition we re collecting samples on our expedition with Blancpain1735 to gather environmental DNA or eDNA that s found in the water. Through analyzing this eDNA we can learn more about all kinds of wildlife that inhabit or traverse Californias Channel Islands. These samples provide insights into the ecosystem beyond typical dives revealing microscopic organisms and creatures that have passed through! #Blancpain1735 #BlancpainOceanCommitment #FiftyFathoms #BlancpainFiftyFathoms,#dyk water samples can unlock longkept ocean secrets on our southern california expedition we re collecting samples on our expedition with blancpain1735 to gather environmental dna or edna that s found in the water through analyzing this edna we can learn more about all kinds of wildlife that inhabit or traverse californias channel islands these samples provide insights into the ecosystem beyond typical dives revealing microscopic organisms and creatures that have passed through #blancpain1735 #blancpainoceancommitment #fiftyfathoms #blancpainfiftyfathoms
Posts_oceana_18_Apr_2024_17_Apr_2025_f49c_CLEANED_371.jpeg,2024 is almost certainly going to be the hottest year on record.   We must drastically reduce greenhouse gas emissions and countries like the United States need to stop the expansion of dirty and dangerous offshore drilling and move towards clean energy. The climate crisis is real it s here and what we do now will decide both our planet s future and our own.,2024 is almost certainly going to be the hottest year on record we must drastically reduce greenhouse gas emissions and countries like the united states need to stop the expansion of dirty and dangerous offshore drilling and move towards clean energy the climate crisis is real it s here and what we do now will decide both our planet s future and our own
