Image Filename,Caption,Cleaned Caption
Posts_oceana_18_Apr_2024_17_Apr_2025_f49c_CLEANED_241.jpeg,Explore the the ocean shallows!The epipelagic zone is the area where most visible light in the ocean exists which is why it s also known as the sunlight zone! Swipe through to get to know some of the variety of wildlife found swimming in these waters  The theme of this year s #NationalOceansMonth is #AwakenNewDepths and we ll be diving deeper in our ocean each week to highlight some of the incredible wildlife that call our oceans home. Learn more about these ocean animals and more with our Marine Life Encyclopedia. Link in bio.#Clownfish #Manatee #Coral #SeaTurtle #GreenTurtle #Ocean #OceansMonth #OceanMonth #MarineLife #Wildlife #StandForOceans,explore the the ocean shallowsthe epipelagic zone is the area where most visible light in the ocean exists which is why it s also known as the sunlight zone swipe through to get to know some of the variety of wildlife found swimming in these waters the theme of this year s #nationaloceansmonth is #awakennewdepths and we ll be diving deeper in our ocean each week to highlight some of the incredible wildlife that call our oceans home learn more about these ocean animals and more with our marine life encyclopedia link in bio#clownfish #manatee #coral #seaturtle #greenturtle #ocean #oceansmonth #oceanmonth #marinelife #wildlife #standforoceans
Posts_oceana_18_Apr_2024_17_Apr_2025_f49c_CLEANED_242.jpeg,Did you know that the deep sea covers more than 65% of the Earths surface? Deep-sea ecosystems help regulate the climate contribute to the biological pump and are biodiversity hotspots.   The Mediterranean deep sea may host close to 3000 species out of a total of 17000 in the entire sea!  Swipe through to learn more about these fascinating and important ecosystems!#DeepSea #DefendTheDeep #OceanConservation #BiologicalPump #climate #ClimateChange #Biodiversity #Mediterranean #Oceana #OceanaEurope OceanaEurope,did you know that the deep sea covers more than 65 of the earths surface deepsea ecosystems help regulate the climate contribute to the biological pump and are biodiversity hotspots the mediterranean deep sea may host close to 3000 species out of a total of 17000 in the entire sea swipe through to learn more about these fascinating and important ecosystems#deepsea #defendthedeep #oceanconservation #biologicalpump #climate #climatechange #biodiversity #mediterranean #oceana #oceanaeurope oceanaeurope
Posts_oceana_18_Apr_2024_17_Apr_2025_f49c_CLEANED_243.jpeg,The epipelagic zone also known as the sunlight zone of the ocean is home to many well-known & beloved marine animals. Swipe through to get to know just a few of the many species that can be found in these relatively shallow waters!    The theme of this year s #NationalOceansMonth is #AwakenNewDepths and we ll be diving deeper in our ocean each week to highlight some of the incredible wildlife that call our oceans home. Learn more about these ocean animals and more with our Marine Life Encyclopedia. Link in bio.  #SeaOtter #BullShark #Otter #Shark #Cuttlefish #SeaLion #Ocean #OceansMonth #OceanMonth #MarineLife #Wildlife #StandForOceans,the epipelagic zone also known as the sunlight zone of the ocean is home to many wellknown beloved marine animals swipe through to get to know just a few of the many species that can be found in these relatively shallow waters the theme of this year s #nationaloceansmonth is #awakennewdepths and we ll be diving deeper in our ocean each week to highlight some of the incredible wildlife that call our oceans home learn more about these ocean animals and more with our marine life encyclopedia link in bio #seaotter #bullshark #otter #shark #cuttlefish #sealion #ocean #oceansmonth #oceanmonth #marinelife #wildlife #standforoceans
Posts_oceana_18_Apr_2024_17_Apr_2025_f49c_CLEANED_244.jpeg,A concerning study reveals that Chile leads in whale deaths caused by ship collisions with 50 cases in the last decade. The most affected species are the fin whale humpback whale sei whale and blue whale.The researchers recommend protecting areas like the Humboldt Archipelago where large whale populations are found and vessel traffic is still low. They also suggest reducing ship speed and adjusting navigation routes to prevent collisions.  Dr. Susannah Buchan (susiebuchan) oceanographer and co-author of the study explains more in this video.,a concerning study reveals that chile leads in whale deaths caused by ship collisions with 50 cases in the last decade the most affected species are the fin whale humpback whale sei whale and blue whalethe researchers recommend protecting areas like the humboldt archipelago where large whale populations are found and vessel traffic is still low they also suggest reducing ship speed and adjusting navigation routes to prevent collisions dr susannah buchan susiebuchan oceanographer and coauthor of the study explains more in this video
Posts_oceana_18_Apr_2024_17_Apr_2025_f49c_CLEANED_245.jpeg,What can we do to combat the major problem of illegal fishing in Mexico? oceanamexico s new report shines a light on the failings of the Mexican government to address illegal fishing which jeopardizes the future of threatened marine life the health of our oceans and the livelihoods of local communities. The Mexican government must create a public policy to combat overfishing and develop a strategy to address the variety of types of illegal fishing occurring in their waters!,what can we do to combat the major problem of illegal fishing in mexico oceanamexico s new report shines a light on the failings of the mexican government to address illegal fishing which jeopardizes the future of threatened marine life the health of our oceans and the livelihoods of local communities the mexican government must create a public policy to combat overfishing and develop a strategy to address the variety of types of illegal fishing occurring in their waters
Posts_oceana_18_Apr_2024_17_Apr_2025_f49c_CLEANED_246.jpeg,Valentine s Day is just around the reef   don t forget to shell out some love for the one you whale-y adore!  #ValentinesDay #Valentine,valentine s day is just around the reef don t forget to shell out some love for the one you whaley adore #valentinesday #valentine
Posts_oceana_18_Apr_2024_17_Apr_2025_f49c_CLEANED_247.jpeg,More and more U.S. states are taking action to combat the plastic crisis! As of July 2024 15 states as well as Washington D.C. have enacted a variety of state-wide single-use plastic bans whether that s a ban on single-use plastic bags plastic foam food ware offered at restaurants intentional balloon releases or all of the above! Oceana campaigns for federal state and local policies like these that reduce unnecessary single-use plastic. Help support our work to protect our oceans and marine life from the devastating effects of plastic pollution today! #PlasticFreeJuly,more and more us states are taking action to combat the plastic crisis as of july 2024 15 states as well as washington dc have enacted a variety of statewide singleuse plastic bans whether that s a ban on singleuse plastic bags plastic foam food ware offered at restaurants intentional balloon releases or all of the above oceana campaigns for federal state and local policies like these that reduce unnecessary singleuse plastic help support our work to protect our oceans and marine life from the devastating effects of plastic pollution today #plasticfreejuly
Posts_oceana_18_Apr_2024_17_Apr_2025_f49c_CLEANED_248.jpeg,It was a joy to celebrate with some amazing ocean advocates this weekend at our 17th annual SeaChange Summer Party! Hosted by Oceana Board Member TedDanson this event highlighted Oceana s more than 25 victories won alongside our allies over the past year including convincing Amazon to reduce its use of single-use plastics in North America and new habitat protections in Canada Mexico & Europe. We are so thankful to all the incredible advocates who support Oceana so that we can continue to protect and restore the world s ocean. As Ted Danson said:  We don t shy away from an important fight  we get things done!     : TedDanson lisaloeb oscarnunezla ochoachristinka blakemoynes pilot.rachel dennishaybert samtrammellofficial echriqui sallypr81 msladylux serratoandco thekellybrochu jeff.blasingame #OrangeCounty #LagunaBeach #California #SeaChangeSummerParty OceanaSeaChange #StandForOceans biossance,it was a joy to celebrate with some amazing ocean advocates this weekend at our 17th annual seachange summer party hosted by oceana board member teddanson this event highlighted oceana s more than 25 victories won alongside our allies over the past year including convincing amazon to reduce its use of singleuse plastics in north america and new habitat protections in canada mexico europe we are so thankful to all the incredible advocates who support oceana so that we can continue to protect and restore the world s ocean as ted danson said we don t shy away from an important fight we get things done teddanson lisaloeb oscarnunezla ochoachristinka blakemoynes pilotrachel dennishaybert samtrammellofficial echriqui sallypr81 msladylux serratoandco thekellybrochu jeffblasingame #orangecounty #lagunabeach #california #seachangesummerparty oceanaseachange #standforoceans biossance
Posts_oceana_18_Apr_2024_17_Apr_2025_f49c_CLEANED_249.jpeg,Weve completed the first part of our expedition to the Canary Islands for scientific research on ocean restoration!For 10 days we studied this area making a total of 55 dives with a remotely operated vehicle to better evaluate the health of the ecosystem and discover the biodiversity that call it home. Later this year well embark on the second part of this project to continue our research in this region.So far we have gathered invaluable data that promises to lead to fascinating results and were excited to learn more about how we can best protect this marine ecosystem!,weve completed the first part of our expedition to the canary islands for scientific research on ocean restorationfor 10 days we studied this area making a total of 55 dives with a remotely operated vehicle to better evaluate the health of the ecosystem and discover the biodiversity that call it home later this year well embark on the second part of this project to continue our research in this regionso far we have gathered invaluable data that promises to lead to fascinating results and were excited to learn more about how we can best protect this marine ecosystem
Posts_oceana_18_Apr_2024_17_Apr_2025_f49c_CLEANED_250.jpeg,Have you ever heard of marine snow?    It may look like fluffy white snowflakes falling beneath the surface of the ocean but it s actually a shower of dead plankton waste and organic matter drifting down to the ocean s depths. This  snowfall  sustains deep-sea life and plays a crucial role in the planet s carbon cycle.   Learn more with oceana_canada s recent blog - link in bio!,have you ever heard of marine snow it may look like fluffy white snowflakes falling beneath the surface of the ocean but it s actually a shower of dead plankton waste and organic matter drifting down to the ocean s depths this snowfall sustains deepsea life and plays a crucial role in the planet s carbon cycle learn more with oceana_canada s recent blog link in bio
Posts_oceana_18_Apr_2024_17_Apr_2025_f49c_CLEANED_251.jpeg,Last November a beaked whale calf died a heartbreaking death after ingesting a plastic balloon.Far too many marine animals are suffering from the impacts of plastic flooding our oceans. Thats why Oceana campaigns to stop plastic pollution at the source advocating for and getting legislation like balloon bans enacted. And just a few weeks ago Florida passed a new law banning the intentional release of balloons helping to protect Floridas shorelines and ocean wildlife from balloon pollution!  Learn more about our work for #PlasticFreeSeas with the #linkinbio.,last november a beaked whale calf died a heartbreaking death after ingesting a plastic balloonfar too many marine animals are suffering from the impacts of plastic flooding our oceans thats why oceana campaigns to stop plastic pollution at the source advocating for and getting legislation like balloon bans enacted and just a few weeks ago florida passed a new law banning the intentional release of balloons helping to protect floridas shorelines and ocean wildlife from balloon pollution learn more about our work for #plasticfreeseas with the #linkinbio
Posts_oceana_18_Apr_2024_17_Apr_2025_f49c_CLEANED_252.jpeg,Hawksbill turtles are super snackers!Just by eating these sea turtles help keep their coral reef homes healthy. While they have a varied diet the hawksbills primary food is sponges. In some areas turtles feeding on these sponges help keep the sponge population under control allowing reef-building corals to have enough space to grow.   Learn more about these terrific turtles in our Marine Life Encyclopedia link in bio!#SeaTurtle #HawksbillTurtle #Turtle #Ocean #OceanAnimal #MarineLife #AnimalsAtoZ,hawksbill turtles are super snackersjust by eating these sea turtles help keep their coral reef homes healthy while they have a varied diet the hawksbills primary food is sponges in some areas turtles feeding on these sponges help keep the sponge population under control allowing reefbuilding corals to have enough space to grow learn more about these terrific turtles in our marine life encyclopedia link in bio#seaturtle #hawksbillturtle #turtle #ocean #oceananimal #marinelife #animalsatoz
Posts_oceana_18_Apr_2024_17_Apr_2025_f49c_CLEANED_253.jpeg,A splash of color beneath the waves! Healthy reefs are full of life. Let s safeguard these vibrant places and keep them that way.   #StandForOceans,a splash of color beneath the waves healthy reefs are full of life let s safeguard these vibrant places and keep them that way #standforoceans
Posts_oceana_18_Apr_2024_17_Apr_2025_f49c_CLEANED_254.jpeg,WATCH: Five ways deep-sea mining is harming our oceans. The deep sea may be mysterious but its actually a thriving hub of biodiversity  and extremely vulnerable to human disturbances like deep-sea mining. Add your name now to #DefendTheDeep! Link in bio.,watch five ways deepsea mining is harming our oceans the deep sea may be mysterious but its actually a thriving hub of biodiversity and extremely vulnerable to human disturbances like deepsea mining add your name now to #defendthedeep link in bio
Posts_oceana_18_Apr_2024_17_Apr_2025_f49c_CLEANED_255.jpeg,Celebrate seabirds this #NationalBirdDay! Birds might not always be the first animals you think of when it comes to our oceans but that doesnt mean theyre not important! From the emperor penguin to the blue-footed booby seabirds come in all shapes & sizes and play a vital role in ocean ecosystems.  Take a moment to celebrate these marine animals by learning more about seabirds today. Link in bio. #BirdDay #Seabirds,celebrate seabirds this #nationalbirdday birds might not always be the first animals you think of when it comes to our oceans but that doesnt mean theyre not important from the emperor penguin to the bluefooted booby seabirds come in all shapes sizes and play a vital role in ocean ecosystems take a moment to celebrate these marine animals by learning more about seabirds today link in bio #birdday #seabirds
Posts_oceana_18_Apr_2024_17_Apr_2025_f49c_CLEANED_256.jpeg,ADD YOUR NAME: Offshore drilling leads to dangerous oil spills that hurt people animals and our oceans. It s crucial that we #ProtectOurCoast from further devastation! Call for POTUS to permanently protect the U.S. East Coast from future offshore drilling today. Link in bio.  : ohrim / Shutterstock,add your name offshore drilling leads to dangerous oil spills that hurt people animals and our oceans it s crucial that we #protectourcoast from further devastation call for potus to permanently protect the us east coast from future offshore drilling today link in bio ohrim shutterstock
Posts_oceana_18_Apr_2024_17_Apr_2025_f49c_CLEANED_257.jpeg,Despite being the least-explored habitat on Earth the deep sea is home to millions of species and plays a vital role in sustaining life on our planet. It helps regulate global temperatures and supports complex ocean food webs. We cant risk this through deep-sea mining! Tell world leaders to #DefendTheDeep today with the #linkinbio. #NationalOceansMonth #OceansMonth,despite being the leastexplored habitat on earth the deep sea is home to millions of species and plays a vital role in sustaining life on our planet it helps regulate global temperatures and supports complex ocean food webs we cant risk this through deepsea mining tell world leaders to #defendthedeep today with the #linkinbio #nationaloceansmonth #oceansmonth
Posts_oceana_18_Apr_2024_17_Apr_2025_f49c_CLEANED_258.jpeg,TEST YOUR KNOWLEDGE: Do you know how much of all the plastic waste ever produced has been recycled?  Swipe for the answer!  Unfortunately most of the plastic we use is not recycled. This Earth Month help us tackle the plastic pollution problem at the source! Donate to support our campaigns urging the government and companies to make the shift from unnecessary single-use plastic to sustainable alternatives today. #PlanetVsPlastic,test your knowledge do you know how much of all the plastic waste ever produced has been recycled swipe for the answer unfortunately most of the plastic we use is not recycled this earth month help us tackle the plastic pollution problem at the source donate to support our campaigns urging the government and companies to make the shift from unnecessary singleuse plastic to sustainable alternatives today #planetvsplastic
Posts_oceana_18_Apr_2024_17_Apr_2025_f49c_CLEANED_259.jpeg,A day in the life of a sperm whale  From deep dives to power naps these ocean giants are full of surprises!  Learn more with the #linkinbio.,a day in the life of a sperm whale from deep dives to power naps these ocean giants are full of surprises learn more with the #linkinbio
Posts_oceana_18_Apr_2024_17_Apr_2025_f49c_CLEANED_260.jpeg,Were down to the Fin-al Four!The battle for the 2025 Marine Champion title is down to the final four! Only four incredible ocean animals remain who will bring home the trophy?Voting kicks off tomorrow so take a moment to meet the finalists and get ready to support your favorite. Every vote counts!  Who s your pick to win it all? Let us know and cast your vote tomorrow! #MarineMadness,were down to the final fourthe battle for the 2025 marine champion title is down to the final four only four incredible ocean animals remain who will bring home the trophyvoting kicks off tomorrow so take a moment to meet the finalists and get ready to support your favorite every vote counts who s your pick to win it all let us know and cast your vote tomorrow #marinemadness
Posts_oceana_18_Apr_2024_17_Apr_2025_f49c_CLEANED_261.jpeg,The ocean needs us today more than ever.   Today on #GivingTuesday join Oceana in protecting marine life and our oceans from their biggest threats.  : Entangled whale photographed by mekanphotography,the ocean needs us today more than ever today on #givingtuesday join oceana in protecting marine life and our oceans from their biggest threats entangled whale photographed by mekanphotography
Posts_oceana_18_Apr_2024_17_Apr_2025_f49c_CLEANED_262.jpeg,A plastic ocean isn t what our planet needs. But every year an estimated 33 BILLION pounds of plastic enter the marine environment choking marine life and damaging marine ecosystems. Enough is enough! Make your #EarthDay gift for oceans today and have double the impact combatting this plastic crisis thanks to MoroccanOil.  #BluePlanet #EarthDay2024 #EarthMonth #PlasticPollution #Plastic #SingleUsePlastic #Ocean #Beach #Nature #Earth #Wildlife #OceanWildlife #Biodiversity #StandForOceans,a plastic ocean isn t what our planet needs but every year an estimated 33 billion pounds of plastic enter the marine environment choking marine life and damaging marine ecosystems enough is enough make your #earthday gift for oceans today and have double the impact combatting this plastic crisis thanks to moroccanoil #blueplanet #earthday2024 #earthmonth #plasticpollution #plastic #singleuseplastic #ocean #beach #nature #earth #wildlife #oceanwildlife #biodiversity #standforoceans
Posts_oceana_18_Apr_2024_17_Apr_2025_f49c_CLEANED_263.jpeg,Our time on the water with Blancpain1735 studying #ocean #biodiversity off Southern California is coming to an end - but our work here is just beginning! We now embark on the next chapter of analyzing our samples processing what we ve learned and putting all this research into action to protect this special place. Stay tuned for more updates and to see how you can join us in protecting California s ocean waters!,our time on the water with blancpain1735 studying #ocean #biodiversity off southern california is coming to an end but our work here is just beginning we now embark on the next chapter of analyzing our samples processing what we ve learned and putting all this research into action to protect this special place stay tuned for more updates and to see how you can join us in protecting california s ocean waters
Posts_oceana_18_Apr_2024_17_Apr_2025_f49c_CLEANED_264.jpeg,2024 marks the 10 year anniversary that Oceana began our campaigns in Brazil to protect and restore our oceans!   Watch to see some of the major milestones and victories that weve accomplished since we started our work here in 2014. oceanabrasil,2024 marks the 10 year anniversary that oceana began our campaigns in brazil to protect and restore our oceans watch to see some of the major milestones and victories that weve accomplished since we started our work here in 2014 oceanabrasil
Posts_oceana_18_Apr_2024_17_Apr_2025_f49c_CLEANED_265.jpeg,A MAJORITY OF U.S. VOTERS AGREE: It s time to reduce single-use plastic foam and the amount of plastic being produced! The path forward is clear: we need to move away from creating more single-use plastic and toward refillable and reusable systems. Now it s time to turn this public support into action! Tell your elected officials to act for #PlasticFreeSeas with the #linkinbio,a majority of us voters agree it s time to reduce singleuse plastic foam and the amount of plastic being produced the path forward is clear we need to move away from creating more singleuse plastic and toward refillable and reusable systems now it s time to turn this public support into action tell your elected officials to act for #plasticfreeseas with the #linkinbio
Posts_oceana_18_Apr_2024_17_Apr_2025_f49c_CLEANED_266.jpeg,The 2025 Marine Madness Champion is... the hawksbill turtle!  Thank you to everyone who voted and cheered on their favorite ocean animals throughout the tournament! Did you have the hawksbill turtle coming out on top in your bracket?,the 2025 marine madness champion is the hawksbill turtle thank you to everyone who voted and cheered on their favorite ocean animals throughout the tournament did you have the hawksbill turtle coming out on top in your bracket
Posts_oceana_18_Apr_2024_17_Apr_2025_f49c_CLEANED_267.jpeg,Did you know that plastic isn t just polluting our oceans it s in our brains too?   A shocking new study found microplastics in human brain tissue. The most common type? Polyethylene AKA the plastic in food packaging and bags. It all seems pretty clear   if we want to stop finding plastic in disturbing places we need a world with less plastic!Add your name to protect our planet and our health today. Link in bio. #BreakFreeFromPlastic : Nihart A.J. Garcia M.A. El Hayek E. et al. Bioaccumulation of microplastics in decedent human brains. Nat Med (2025). https://doi.org/10.1038/s41591-024-03453-1nature_the_journal,did you know that plastic isn t just polluting our oceans it s in our brains too a shocking new study found microplastics in human brain tissue the most common type polyethylene aka the plastic in food packaging and bags it all seems pretty clear if we want to stop finding plastic in disturbing places we need a world with less plasticadd your name to protect our planet and our health today link in bio #breakfreefromplastic nihart aj garcia ma el hayek e et al bioaccumulation of microplastics in decedent human brains nat med 2025
Posts_oceana_18_Apr_2024_17_Apr_2025_f49c_CLEANED_268.jpeg,Magellanic penguins are picky eaters for a good reason! Learning more about our oceans and the animals that call them home is key to getting them the protections they need. Thats why Oceana conducts on-the-water expeditions throughout the world s oceans. Through documenting unique habitats and marine life we can take our research and use that evidence to conduct campaigns to influence government policy to protect these exceptional places.,magellanic penguins are picky eaters for a good reason learning more about our oceans and the animals that call them home is key to getting them the protections they need thats why oceana conducts onthewater expeditions throughout the world s oceans through documenting unique habitats and marine life we can take our research and use that evidence to conduct campaigns to influence government policy to protect these exceptional places
