Image Filename,Caption,Cleaned Caption
Posts_oceana_18_Apr_2024_17_Apr_2025_f49c_CLEANED_124.jpeg,#BREAKING: Amazon is cutting its plastic use in North America following campaigning by Oceana.  Today Amazon announced that it has has replaced 95% of the plastic air pillows from delivery packaging in North America with 100% recycled paper filler   a move they say is expected to  avoid nearly 15 billion plastic air pillows annually. As the world s dominant e-commerce company Amazon s action to reduce plastic packaging is welcome news for the oceans and the company s customers said Matt Littlejohn Oceanas Senior Vice President of Strategic Initiatives. While this is a significant step forward for the company Amazon needs to build on this momentum and fulfill its multiyear commitment to transition its North America fulfillment centers away from plastic.Read more with the #linkinbio. #PlasticFreeAmazon,#breaking amazon is cutting its plastic use in north america following campaigning by oceana today amazon announced that it has has replaced 95 of the plastic air pillows from delivery packaging in north america with 100 recycled paper filler a move they say is expected to avoid nearly 15 billion plastic air pillows annually as the world s dominant ecommerce company amazon s action to reduce plastic packaging is welcome news for the oceans and the company s customers said matt littlejohn oceanas senior vice president of strategic initiatives while this is a significant step forward for the company amazon needs to build on this momentum and fulfill its multiyear commitment to transition its north america fulfillment centers away from plasticread more with the #linkinbio #plasticfreeamazon
Posts_oceana_18_Apr_2024_17_Apr_2025_f49c_CLEANED_125.jpeg,Today is #EarthDay!   This year s theme is  Planet vs. Plastic  and it s true that plastic has unfortunately become a major part of our Earth. Today plastic pervades every corner of the world.   But together we can tackle the plastic pollution crisis at the source.   Donate to protect our blue planet today and your gift will matched by our friends at Moroccanoil to make double the impact! #PlanetVsPlastic  #BluePlanet #EarthDay2024 #EarthMonth #SeaTurtles #Ocean #Beach #Nature #Earth #Wildlife #OceanWildlife #Biodiversity #StandForOceans,today is #earthday this year s theme is planet vs plastic and it s true that plastic has unfortunately become a major part of our earth today plastic pervades every corner of the world but together we can tackle the plastic pollution crisis at the source donate to protect our blue planet today and your gift will matched by our friends at moroccanoil to make double the impact #planetvsplastic #blueplanet #earthday2024 #earthmonth #seaturtles #ocean #beach #nature #earth #wildlife #oceanwildlife #biodiversity #standforoceans
Posts_oceana_18_Apr_2024_17_Apr_2025_f49c_CLEANED_126.jpeg,Today is #EndangeredSpeciesDay.  The Endangered Species Act is one of the United States most important successful and popular laws. But despite this the Endangered Species Act is currently under threat from members of Congress trying to roll back key parts of this law with dozens of bills being introduced to weaken protections or undermine the ESA. Join us in defending this landmark law and safeguarding the future of ocean biodiversity with the #linkinbio today. #EndangeredSpecies #ESA #EndangeredSpeciesAct #SeaTurtle #Manate #SeaOtter #Ocean #Biodiversity #OceanAnimals #Wildlife #StandForOceans,today is #endangeredspeciesday the endangered species act is one of the united states most important successful and popular laws but despite this the endangered species act is currently under threat from members of congress trying to roll back key parts of this law with dozens of bills being introduced to weaken protections or undermine the esa join us in defending this landmark law and safeguarding the future of ocean biodiversity with the #linkinbio today #endangeredspecies #esa #endangeredspeciesact #seaturtle #manate #seaotter #ocean #biodiversity #oceananimals #wildlife #standforoceans
Posts_oceana_18_Apr_2024_17_Apr_2025_f49c_CLEANED_127.jpeg,STUNNING: The biodiversity of Spains waters!      Discover some of the wonders of Mar de las Calmas off El Hierro island in Spain. This spectacular area is set to become Spains first exclusively marine national park in 2025!During our expedition to Mar de las Calmas OceanaEurope extensively documented its unique underwater habitats as well as the many species that live there. The knowledge and data we gathered allows us to advocate for the protection of these rich waters.,stunning the biodiversity of spains waters discover some of the wonders of mar de las calmas off el hierro island in spain this spectacular area is set to become spains first exclusively marine national park in 2025during our expedition to mar de las calmas oceanaeurope extensively documented its unique underwater habitats as well as the many species that live there the knowledge and data we gathered allows us to advocate for the protection of these rich waters
Posts_oceana_18_Apr_2024_17_Apr_2025_f49c_CLEANED_128.jpeg,These ocean animals would certainly be able to take home the gold at #Paris2024! #Olympics #Olympics2024,these ocean animals would certainly be able to take home the gold at #paris2024 #olympics #olympics2024
Posts_oceana_18_Apr_2024_17_Apr_2025_f49c_CLEANED_129.jpeg,Today is #WorldEnvironmentDay!   The oceans connect us all. They cover two-thirds of our blue planet and contain most of the life on Earth. They are as important to us as they are vast. But the oceans face many threats   from overfishing habitat destruction oil and plastic pollution and the killing of threatened species like turtles whales and sharks. Thats why Oceana campaigns internationally to achieve policy-oriented & science-based victories to protect and restore our worlds oceans. And while we have won over 300 victories and protected nearly 4 million square miles of ocean theres still much more work that needs to be done for our planet! Join us to #StandForOceans today with the #linkinbio.   #GenerationRestoration,today is #worldenvironmentday the oceans connect us all they cover twothirds of our blue planet and contain most of the life on earth they are as important to us as they are vast but the oceans face many threats from overfishing habitat destruction oil and plastic pollution and the killing of threatened species like turtles whales and sharks thats why oceana campaigns internationally to achieve policyoriented sciencebased victories to protect and restore our worlds oceans and while we have won over 300 victories and protected nearly 4 million square miles of ocean theres still much more work that needs to be done for our planet join us to #standforoceans today with the #linkinbio #generationrestoration
Posts_oceana_18_Apr_2024_17_Apr_2025_f49c_CLEANED_130.jpeg,Do you recognize the dugong?At first glance they may look like manatees but dugongs are a creature all their own! One easy way to tell them apart? Their distinctive fluke-like tails - different than the round paddle-like tails of manatees.Found in the warm shallow waters of the Indian and Pacific oceans these gentle marine mammals often called  sea cows graze on seagrass meadows helping to keep these vital ecosystems healthy.  Dive deeper into the world of dugongs with our Marine Life Encyclopedia. Link in bio!#AnimalsAtoZ #MarineLife #OceanAnimals #Dugong #SeaCow #MarineMammal,do you recognize the dugongat first glance they may look like manatees but dugongs are a creature all their own one easy way to tell them apart their distinctive flukelike tails different than the round paddlelike tails of manateesfound in the warm shallow waters of the indian and pacific oceans these gentle marine mammals often called sea cows graze on seagrass meadows helping to keep these vital ecosystems healthy dive deeper into the world of dugongs with our marine life encyclopedia link in bio#animalsatoz #marinelife #oceananimals #dugong #seacow #marinemammal
Posts_oceana_18_Apr_2024_17_Apr_2025_f49c_CLEANED_131.jpeg,SPEAK UP: Since taking office on Monday POTUS has already issued sweeping attacks that will affect our oceans. This includes:  Attempting to undo President Biden s recent protections for U.S. coastlines from offshore oil and gas drilling  Exploiting loopholes to override and undermine key laws like the Endangered Species Act Marine Mammal Protection Act and Clean Water Act in pursuit of polluting fossil fuel extraction  Undermining federal scientists and experts who help manage and protect our oceans Our oceans are not a chess piece to play with. Now more than ever we need your support in the days ahead to fight back and hold our elected leaders accountable. Join us to defend our oceans today with the #linkinbio.,speak up since taking office on monday potus has already issued sweeping attacks that will affect our oceans this includes attempting to undo president biden s recent protections for us coastlines from offshore oil and gas drilling exploiting loopholes to override and undermine key laws like the endangered species act marine mammal protection act and clean water act in pursuit of polluting fossil fuel extraction undermining federal scientists and experts who help manage and protect our oceans our oceans are not a chess piece to play with now more than ever we need your support in the days ahead to fight back and hold our elected leaders accountable join us to defend our oceans today with the #linkinbio
Posts_oceana_18_Apr_2024_17_Apr_2025_f49c_CLEANED_132.jpeg,North Atlantic right whales need your support.   These highly endangered whales are on the brink of extinction. Only around 372 remain. Speak up to protect these whales from one of their biggest threats - speeding boats - before its too late. Link in bio.  : NOAA/NMFS NOAA News,north atlantic right whales need your support these highly endangered whales are on the brink of extinction only around 372 remain speak up to protect these whales from one of their biggest threats speeding boats before its too late link in bio noaanmfs noaa news
Posts_oceana_18_Apr_2024_17_Apr_2025_f49c_CLEANED_133.jpeg,Some seahorses have their own way of romance! Courtship for these little fish starts with dancing and a show of color by the male along with  wooing  in the form of clicking sounds. If the female fancies him the two will entwine their tails and take a little romantic float together across the seafloor. The happy couple will pair for life! This #ValentinesDay share the love with both your valentine and for the oceans with a symbolic seahorse adoption. All donations support Oceana s campaigns to protect and restore the abundance of the world s ocean! Link in bio. #Seahorse #ValentinesDay #Valentine #Cute #Animal #Fish #Ocean #Nature #Environment #Conservation #OceanConservation #Wildlife #SeaCreature #StandForOceans  : Carolina Marcias / Shutterstock,some seahorses have their own way of romance courtship for these little fish starts with dancing and a show of color by the male along with wooing in the form of clicking sounds if the female fancies him the two will entwine their tails and take a little romantic float together across the seafloor the happy couple will pair for life this #valentinesday share the love with both your valentine and for the oceans with a symbolic seahorse adoption all donations support oceana s campaigns to protect and restore the abundance of the world s ocean link in bio #seahorse #valentinesday #valentine #cute #animal #fish #ocean #nature #environment #conservation #oceanconservation #wildlife #seacreature #standforoceans carolina marcias shutterstock
Posts_oceana_18_Apr_2024_17_Apr_2025_f49c_CLEANED_134.jpeg,Ghost gear haunts our oceans   and it can deal some seriously spooky damage to ocean ecosystems and marine life.Learn more about this all-too-real ghost story with the #linkinbio.#Halloween #SpookySeason,ghost gear haunts our oceans and it can deal some seriously spooky damage to ocean ecosystems and marine lifelearn more about this alltooreal ghost story with the #linkinbio#halloween #spookyseason
Posts_oceana_18_Apr_2024_17_Apr_2025_f49c_CLEANED_135.jpeg,A new study has found that some large fishes use sharks to remove parasites. Research revealed that large open-ocean fish like tuna sometimes scrape against sharks to get rid of parasites and seem to prefer scraping against them even than other fish of the same species.These findings reveal new ways that species can be connected beneath the waves   which is both fascinating and highlights threats to ocean wildlife. Global shark populations are declining which the authors suggest may eventually lead to these fish having a harder time ridding themselves of parasites and threatening their overall health. Our oceans are an interconnected web of biodiversity. When one species declines many others can suffer as well. We must safeguard vulnerable marine species and promote biodiversity so that all ocean wildlife can thrive.,a new study has found that some large fishes use sharks to remove parasites research revealed that large openocean fish like tuna sometimes scrape against sharks to get rid of parasites and seem to prefer scraping against them even than other fish of the same speciesthese findings reveal new ways that species can be connected beneath the waves which is both fascinating and highlights threats to ocean wildlife global shark populations are declining which the authors suggest may eventually lead to these fish having a harder time ridding themselves of parasites and threatening their overall health our oceans are an interconnected web of biodiversity when one species declines many others can suffer as well we must safeguard vulnerable marine species and promote biodiversity so that all ocean wildlife can thrive
Posts_oceana_18_Apr_2024_17_Apr_2025_f49c_CLEANED_136.jpeg,MARINE MADNESS RETURNS! Get ready to dive into the ultimate ocean showdown! 16 incredible marine animals are battling for the title of Marine Champion but only one will reign supreme. Starting Thursday cast your votes in our Instagram Stories every day to help your favorite contenders advance through the rounds. Who will make it to the top? It s up to you!   Want to play along? Download a blank bracket from the link in our bio and choose your own champion!,marine madness returns get ready to dive into the ultimate ocean showdown 16 incredible marine animals are battling for the title of marine champion but only one will reign supreme starting thursday cast your votes in our instagram stories every day to help your favorite contenders advance through the rounds who will make it to the top it s up to you want to play along download a blank bracket from the link in our bio and choose your own champion
Posts_oceana_18_Apr_2024_17_Apr_2025_f49c_CLEANED_137.jpeg,Take a moment and relax to the sound of the ocean today!     #NationalRelaxationDay,take a moment and relax to the sound of the ocean today #nationalrelaxationday
Posts_oceana_18_Apr_2024_17_Apr_2025_f49c_CLEANED_138.jpeg,GREAT NEWS for Chile s waters! Chiles Committee of Ministers have unanimously rejected the Dominga Project! This controversial mining and port project has now been rejected for the third time. This is great news for the Humboldt Archipelago Marine Protected Area which is home to the iconic Humboldt penguin and many other marine species. For over a decade extensive scientific evidence has highlighted the risks the Dominga Project poses to Chile s waters communities and biodiversity. The project has also been linked to well-known cases of conflicts of interest. With this third rejection the #Archipi lagoHumboldt has received much-needed continued protection thanks to years of work from Oceana_Chile the communities of La Higuera artisanal fishers and many more who fought tirelessly to protect this pristine ecosystem. #NoADominga,great news for chile s waters chiles committee of ministers have unanimously rejected the dominga project this controversial mining and port project has now been rejected for the third time this is great news for the humboldt archipelago marine protected area which is home to the iconic humboldt penguin and many other marine species for over a decade extensive scientific evidence has highlighted the risks the dominga project poses to chile s waters communities and biodiversity the project has also been linked to wellknown cases of conflicts of interest with this third rejection the #archipi lagohumboldt has received muchneeded continued protection thanks to years of work from oceana_chile the communities of la higuera artisanal fishers and many more who fought tirelessly to protect this pristine ecosystem #noadominga
Posts_oceana_18_Apr_2024_17_Apr_2025_f49c_CLEANED_139.jpeg,ANOTHER BABY: Congrats to mom #4540 on her first calf! This is the third North Atlantic right whale baby identified so far this calving season. Mom and calf were seen off the coast off southern Virginia.   But these new mother-calf pairs face threats every day from speeding boats which can cause injury or death something #4540 s family knows all too well. You may remember her mother Juno. Last calving season Juno s calf died after being hit by a vessel. This critically endangered species needs urgent protections. Speak up for North Atlantic right whales today. Link in bio.,another baby congrats to mom #4540 on her first calf this is the third north atlantic right whale baby identified so far this calving season mom and calf were seen off the coast off southern virginia but these new mothercalf pairs face threats every day from speeding boats which can cause injury or death something #4540 s family knows all too well you may remember her mother juno last calving season juno s calf died after being hit by a vessel this critically endangered species needs urgent protections speak up for north atlantic right whales today link in bio
Posts_oceana_18_Apr_2024_17_Apr_2025_f49c_CLEANED_140.jpeg,Happy #WorldOrcaDay!  Orcas can be found swimming in every ocean from the Arctic to the Antarctic. Most orcas live in pods of up to around 50 members and are highly social. Despite commonly being called  killer whales  orcas are actually the largest species in the dolphin family!Learn more about these majestic mammals with the #linkinbio!,happy #worldorcaday orcas can be found swimming in every ocean from the arctic to the antarctic most orcas live in pods of up to around 50 members and are highly social despite commonly being called killer whales orcas are actually the largest species in the dolphin familylearn more about these majestic mammals with the #linkinbio
Posts_oceana_18_Apr_2024_17_Apr_2025_f49c_CLEANED_141.jpeg,Right now our ocean is under attack. Plastic pollution. Climate change. And renewed threats to offshore drilling protections.  But we re fighting back   and winning. This #EarthMonth every dollar you donate will be matched doubling your impact. The ocean needs you. Donate today at the link in bio.,right now our ocean is under attack plastic pollution climate change and renewed threats to offshore drilling protections but we re fighting back and winning this #earthmonth every dollar you donate will be matched doubling your impact the ocean needs you donate today at the link in bio
Posts_oceana_18_Apr_2024_17_Apr_2025_f49c_CLEANED_142.jpeg,Hey! Did you know today is #AfricanPenguinAwarenessDay?  African penguins live on the rocky coastlines of southwest Africa the only penguin species on the continent.  The colonies they live in can be huge: up to 22655 breeding pairs! To communicate in such a crowded space these penguins call out to each other and these calls have earned them a special nickname: jackass penguins.African penguins will bray haw and yell vocalizations that bear a striking resemblance to those of donkeys. Each of these different sounds can be used for attracting potential partners or defending territory from rival encroachment!Learn more about these penguins - and the threats they face - with the #linkinbio.  : Quality Master / Shutterstock,hey did you know today is #africanpenguinawarenessday african penguins live on the rocky coastlines of southwest africa the only penguin species on the continent the colonies they live in can be huge up to 22655 breeding pairs to communicate in such a crowded space these penguins call out to each other and these calls have earned them a special nickname jackass penguinsafrican penguins will bray haw and yell vocalizations that bear a striking resemblance to those of donkeys each of these different sounds can be used for attracting potential partners or defending territory from rival encroachmentlearn more about these penguins and the threats they face with the #linkinbio quality master shutterstock
Posts_oceana_18_Apr_2024_17_Apr_2025_f49c_CLEANED_143.jpeg,Overfishing is pushing our ocean to the brink.Four years past the UKs deadline to end overfishing it s time for real government action NOW. Ending overfishing is integral to a healthy ocean which in turn is essential for both communities and planet.  Our seas can t wait any longer. We must #EndOverfishing. Visit the #linkinbio to see our roadmap to turn the tide on overfishing in the UK.   Oceana_UK,overfishing is pushing our ocean to the brinkfour years past the uks deadline to end overfishing it s time for real government action now ending overfishing is integral to a healthy ocean which in turn is essential for both communities and planet our seas can t wait any longer we must #endoverfishing visit the #linkinbio to see our roadmap to turn the tide on overfishing in the uk oceana_uk
Posts_oceana_18_Apr_2024_17_Apr_2025_f49c_CLEANED_144.jpeg,Tomorrow is #EarthDay the perfect day to celebrate our blue planet!   The threats our planet are facing are serious and one of the biggest challenges for Earth right now is the amount of single-use plastic being produced. But you can help and you don t need to wait for tomorrow to make a splash! Donate to help to protect our planet from the perils of plastic pollution today. #PlanetVsPlastic,tomorrow is #earthday the perfect day to celebrate our blue planet the threats our planet are facing are serious and one of the biggest challenges for earth right now is the amount of singleuse plastic being produced but you can help and you don t need to wait for tomorrow to make a splash donate to help to protect our planet from the perils of plastic pollution today #planetvsplastic
Posts_oceana_18_Apr_2024_17_Apr_2025_f49c_CLEANED_145.jpeg,Lunchtime! Loggerhead sea turtles eat a wide variety of food including plants & algae squishy jellyfish and hard-shelled prey like conchs and horseshoe crabs!   Learn more with the #linkinbio. #SeaTurtleWeek #LoggerheadDay   : Charlie Reaney / Shutterstock,lunchtime loggerhead sea turtles eat a wide variety of food including plants algae squishy jellyfish and hardshelled prey like conchs and horseshoe crabs learn more with the #linkinbio #seaturtleweek #loggerheadday charlie reaney shutterstock
Posts_oceana_18_Apr_2024_17_Apr_2025_f49c_CLEANED_146.jpeg,NEWS FROM CALIFORNIA: The largest and most successful trial of pop-up fishing gear ever conducted on U.S. West Coast proves profitable for fishermen and safe for whales!   The California Dungeness crab fishery and whales are both in a state of crisis due to wildlife entanglements in fishing gear. Pop-up fishing gear is a gateway to keeping fishermen on the water in the spring when waters are closed to conventional crabbing gear.   The gear which was tested by 19 commercial California Dungeness crab fishermen brought in $1.6M of crab in spring 2024 during a time when fishers otherwise would not have been able to operate due to the risk of entangling endangered whales. These results prove this gear is successful profitable enforceable whale-safe and ready to restore a vibrant spring crab fishery! Learn more with the #linkinbio.   : Credit wildestanimal / Shutterstock  : Credit Sub Sea Sonics and Guardian Ropeless Systems,news from california the largest and most successful trial of popup fishing gear ever conducted on us west coast proves profitable for fishermen and safe for whales the california dungeness crab fishery and whales are both in a state of crisis due to wildlife entanglements in fishing gear popup fishing gear is a gateway to keeping fishermen on the water in the spring when waters are closed to conventional crabbing gear the gear which was tested by 19 commercial california dungeness crab fishermen brought in 16m of crab in spring 2024 during a time when fishers otherwise would not have been able to operate due to the risk of entangling endangered whales these results prove this gear is successful profitable enforceable whalesafe and ready to restore a vibrant spring crab fishery learn more with the #linkinbio credit wildestanimal shutterstock credit sub sea sonics and guardian ropeless systems
Posts_oceana_18_Apr_2024_17_Apr_2025_f49c_CLEANED_147.jpeg,Humpback whales are known for their hauntingly beautiful songs   but there might be more to those melodies than you think. #WorldWhaleDay : Inbal Arnon et al. Whale song shows language-like statistical structure.Science387649-653(2025).DOI:10.1126/science.adq7055,humpback whales are known for their hauntingly beautiful songs but there might be more to those melodies than you think #worldwhaleday inbal arnon et al whale song shows languagelike statistical structurescience3876496532025doi101126scienceadq7055
