The annual Global Energy Monitor (GEM) survey Boom and Bust Coal has found that coal-fired operating capacity worldwide rose by two percent last year   the highest annual increase since 2016  China was responsible for two-thirds of the expansion with a small amount of growth in other parts of the globe. Beyond the additions in China new capacity coming online in India Indonesia Vietnam Pakistan Japan Bangladesh South Korea Zimbabwe and Greece drove the increase.According to Global Coal Plant Tracker data 69.5 gigawatts (GW) of coal capacity were commissioned in 2023 while 21.1 GW were retired   a net yearly increase of 48.4 GW and a total capacity worldwide of 2130 GW.Outside of China a total of 22.1 GW were commissioned with 17.4 GW retired   a net increase of 4.7 GW. Since the 2015 Paris Agreement 25 countries have reduced their coal-fired capacity while 35 have increased it.Last year marked the lowest retirement of coal capacity of any year in over a decade.Lower coal plant retirements last year in Europe and the United States contributed to the uptick in operating capacity. Nearly half of retirements in 2023 were in the U.S.   9.7 GW   down from the country s record high of 21.7 GW in 2015.While most global coal operating capacity is currently under some sort of net zero or similar pledge 1626 GW   75 percent   continues to be without a closure commitment.  Link in bio.  cristenhemingwayjaynes.A coal-fired power plant in Shanghai China.   owngarden / E+ / Getty Images .#ecowatchers #climatenews #climatechange #globalwarming #coal #coalcapacity #coalfired #worldwide,https://imgs.socialinsider.io/instagram/2024/04/ecowatch_18436651807004170.jpeg,0.10101,2024-04-24 14:43:00,IMAGE,Posts_ecowatch_18_Apr_2024_17_Apr_2025_d967_CLEANED_147.jpeg
The holidays can be a time of great celebration but also one of great stress. We here at ecowatch invite all of you to make sure that you are taking time over the next few weeks to connect with nature. Whether it be a quiet moment alone a walk in a nearby park with your friends or a new holiday tradition with your family  get outside! The outdoor world has so many calming and restorative benefits that we can all agree are often needed during this time of year. What is your favorite thing to do in nature during the holidays? Comment down below!.  editor: brynnerardin .#ecowatchers #climatenews #climatechange #nature #outdoors #getoutside #getoutdoors #holiday #selfcafe,https://imgs.socialinsider.io/instagram/2024/11/ecowatch_18055686841924870.jpeg,0.10101,2024-11-25 22:11:00,reel,Posts_ecowatch_18_Apr_2024_17_Apr_2025_d967_CLEANED_148.jpeg
Chief Executive Officer of the United Nations COP29 Climate Change Conference Elnur Soltanov has been recorded by Global Witness apparently agreeing to help facilitate fossil fuel industry deals at the summit. A member of the campaign organization posed as a fake oil and gas representative offering to sponsor the event in exchange for assistance with the deals.Soltanov who is also Azerbaijan s deputy energy minister promised  to create a contact between yourself and [SOCAR]  so that they can start discussions. Soltanov suggested that Global Witness  fake investment group EC Capital  incorporate your activities with SOCAR s activity during COP so that you can  talk business to them and also participate in the COP29 process. The UN Framework Convention on Climate Change (UNFCCC) expects officials to act  without self-interest  and says they should not use their official roles  to seek private gain Global Witness recorded Soltanov telling the imposter oil and gas group that SOCAR was  trading oil and gas all over the world including in Asia.  Link in bio.  cristenhemingwayjaynes.Elnur Soltanov speaks at the Baku Climate Action Week in Heydar Aliyev Center in Baku Azerbaijan on Sept. 30 2024.   Aziz Karimov / Getty Images .#ecowatchers #climatenews #climatechange #globalwarming  #cop29#globalwitness #fossilfuelindustry #oilandgas,https://imgs.socialinsider.io/instagram/2024/11/ecowatch_18012645920423863.jpeg,0.10101,2024-11-19 18:30:00,IMAGE,Posts_ecowatch_18_Apr_2024_17_Apr_2025_d967_CLEANED_149.jpeg
Electricity in the United Kingdom was the cleanest ever in 2024 with solar and wind generating all-time highs. A new report has found that per unit carbon dioxide emissions have fallen by over two-thirds in a decade within the UK. The analysis attributed this to the phasing out of coal in the UK which now generates less than half the amount of electricity from fossil fuels than it did a decade ago. Meanwhile the generation of power from renewable sources has more than doubled.Fossil fuels made up 29 percent of electricity generation in the UK last year   the lowest level ever recorded   with renewables accounting for a record 45 percent nuclear and biomass each generating roughly 13 percent imports 11 percent and solar producing four percent.This resulted in each unit of electricity generating an average of 124 grams of carbon compared with 419 grams of  carbon intensity  for each kilowatt hour in 2014.The analysis said wind was  expected to form the backbone of the nation s electricity system by 2030 . The Labour government has pledged to decarbonize electricity in the UK by then with ambitious plans to ramp up solar and wind.  Link in bio.  cristenhemingwayjaynes.Solar panels are installed on the roof of York Minster cathedral in York England on Oct. 31 2024.   Ian Forsyth / Getty Images.#ecowatchers #climatenews #climatechange #globalwarming #unitedkingdom #uk #solar #wind #renewableenergy #emissions,https://imgs.socialinsider.io/instagram/2025/01/ecowatch_18082009996598738.jpeg,0.0991,2025-01-10 18:30:00,IMAGE,Posts_ecowatch_18_Apr_2024_17_Apr_2025_d967_CLEANED_150.jpeg
600+ miles of catastrophic destruction and unprecedented flooding struck the Southeast U.S. when #HurricaneHelene made landfall as a Category 4 storm. The path of devastation reached from Florida s Gulf Coast up to Tennessee. In some cases entire communities were wiped out. To date there have been 130+ confirmed fatalities with nearly 600 unaccounted for.  Sergio_Lacueva_Photography_GlobalNewsArt / Envato.#ecowatchers #climatenews #climatechange #globalwarming #hurricane #helene #hurricanehelene #severeweather,https://imgs.socialinsider.io/instagram/2024/10/ecowatch_17980780553742679.jpeg,0.0991,2024-10-04 18:30:00,IMAGE,Posts_ecowatch_18_Apr_2024_17_Apr_2025_d967_CLEANED_151.jpeg
In a new study scientists analyzed UK crops and how the country s agriculture could be affected by climate change and predicted what could be the top crops by 2080.Led by the UK Centre for Ecology & Hydrology (UKCEH) in collaboration with the University of East Anglia (UEA) the study determined that a changing climate could mean that the UK will become more suitable for growing crops like soy chickpeas grapes oranges and okra.At the same time the region could become less suitable to growing its current crops including oats wheat onions and strawberries meaning agriculture could face significant challenges and high costs to adapt to growing different crops.Scientists explored how suitable 160 different crops   both currently grown in the UK and ones that would be new to the area   could be under two different scenarios: 2 degrees Celsius warming and 4 degrees Celsius warming compared to pre-industrial levels.As the study pointed out introducing more crops and diversifying local agriculture could improve soil health and lead to improved natural pest and disease control plus high suitability for proteins like soy beans and chickpeas could reduce meat consumption and related emissions.  Link in bio.  Paige Bennett.Orange trees in Portugal.   ValentynVolkov / iStock / Getty Images Plus.#ecowatchers #climatenews #climatechange #globalwarming #climatecrisis #unitedkingdom #uk #plants #agriculture #crops,https://imgs.socialinsider.io/instagram/2025/01/ecowatch_18088221388493149.jpeg,0.0972,2025-01-29 18:30:00,IMAGE,Posts_ecowatch_18_Apr_2024_17_Apr_2025_d967_CLEANED_152.jpeg
What s all the buzz about?  Scientists have studied the nutritional profiles of 57 varieties of pollen and discovered that in order to have a balanced diet of essential amino and fatty acids bees must forage from a wide array of plants.The world s agricultural systems are dependent on bees as essential pollinators. At the same time bees and plants are interdependent   bees need pollen from plants for sustenance and many plants reproduce by bees spreading their pollen. Nectar provides bees with carbohydrates while pollen gives them critical nutrients like proteins and lipids. Human-caused environmental changes that alter pollen s natural properties and availability risk causing malnourishment in bees.Bees need high-quality foods that contain fatty acids like omega-3 and omega-6 that are non-esterified. Without them bees don t live as long are less able to deal with environmental stressors and have weaker immune systems. Consuming nutrients in the wrong ratio can lead to cognitive issues. Amino acids are necessary for reproduction and cognitive health in bees but eating too many of them can make them more susceptible to some parasites.Results from the scientific study indicated that foraging for food from a wide variety of flowers is healthiest for most bees and that endemic plant species offer no nutritional advantage over non-native plants. Most pollen species provide the majority of needed nutrients but for optimal dietary needs bees need to visit several different plant species.  Link in bio.  cristenhemingwayjaynes.A honeybee collects pollen from a clover plant. proxyminder / E+ / Getty Images.#ecowatchers #climatenews #climatechange #globalwarming #bees #pollen #pollinator #plants #agrciulture,https://imgs.socialinsider.io/instagram/2024/07/ecowatch_18054904726722605.jpeg,0.0972,2024-07-05 18:30:00,IMAGE,Posts_ecowatch_18_Apr_2024_17_Apr_2025_d967_CLEANED_153.jpeg
Ecowatch s roving reporter tiffmakeswaves found herself in an ecological wonderland at theecologycenter in San Juan Capistrano CA. This regenerative farm farm stand and ecology school is actually a vibrant community center that models creative solutions for thriving on Planet Earth   Here you can learn from the farmers who tend the land eat something made from the food grown there create art enjoy bread and everything in-between. For the first time ever I learned how kale is grown! Before this visit I d only seen kale   at the grocery store or in food never growing! Now I love that I know how it grows and I will never look at it the same way again!  Tiff gloats. As extreme weather and the climate crisis take a toll on our food and the planet that grows it it s more important than ever to support and learn from community groups first nations indigenous and native peoples who know that we are nothing without nature.Special thanks to veronicakimreyes The Ecology Center s incredible baker   for this behind the scenes tour!  editor: _patrickfilm_.#ecowatchers #climatenews #climatechange #globalwarming #ecology #theecologycenter #sustainability #knowyourfarmer #food,https://imgs.socialinsider.io/instagram/2025/02/ecowatch_18265400899284322.jpeg,0.0972,2025-02-04 22:05:00,reel,Posts_ecowatch_18_Apr_2024_17_Apr_2025_d967_CLEANED_154.jpeg
With global average temperatures expected to continue to rise in the coming decades scientists have projected that warming will significantly harm global agriculture as it weakens crop yields and disrupts food production. Now new research finds that warming will disrupt many of Earth s major crops and harm global crop diversity.The study conducted by researchers at Aalto University in Finland analyzed 30 of the world s most important crops and modeled how climate change is likely to affect their safe climatic space under different potential global warming scenarios.The researchers found that crops growing at lower latitudes or closer to the equator will be hardest hit as those areas continue to get hotter and more arid.For each of the 30 crops the researchers established their  safe climatic space  which can be likened to a Goldilocks zone of optimal growth using average precipitation aridity and temperature. As warming increases the researchers found the safe climatic space for crops tends to move farther and farther away from the equator and if warming goes beyond 1.5 degrees it could threaten  up to half  of the world s crops at lower latitudes.  Link in bio.  Michael Riojas.A farmer surveys his maize crop damaged by flooding in Rongai Nakuru County Kenya on May 3 2024.   James Wakibia / SOPA Images / LightRocket via Getty Images .#ecowatchers #climatenews #climatechange #globalwarming #climatecrisis #globalheating #crops #growth #diversity #food #foodsecurity,https://imgs.socialinsider.io/instagram/2025/03/ecowatch_18334650256084510.jpeg,0.09711,2025-03-15 17:30:00,IMAGE,Posts_ecowatch_18_Apr_2024_17_Apr_2025_d967_CLEANED_155.jpeg
Stronger water management efforts will be essential to overcoming the gap between supply and demand as the planet continues to warm according to a new analysis by Lorenzo Rosa principal investigator at Carnegie Science and Matteo Sangiorgio a researcher at the Polytechnic University of Milan.For the study the pair of researchers quantified issues of water scarcity under 1.5 and three degrees Celsius of global heating above pre-industrial levels.When water consumption is greater than the natural availability of water at any time during a month it is referred to as a  water gap.  As time goes on this kind of unsustainable use leads to depleted rivers lakes aquifers groundwater and other natural water reserves.Sangiorgio and Rosa quantified water gaps for scenarios under baseline 1.5 and 3 degrees Celsius of warming accounting for factors such as surface and groundwater depletion and water requirements for aquatic ecosystems.The findings showed that there are already almost 458 billion cubic meters in water gaps annually. They are predicted to grow by 6% under a 1.5 degrees Celsius warming scenario and by 15% if the planet warms by 3 degrees Celsius.  Link in bio.  cristenhemingwayjaynes.Drought at Alibeyk y dam   Istanbul Turkey s largest dam   on Nov. 12 2024.   Berkman Ulutin / dia images via Getty Images..#ecowatchers #climatenews #climatechange #globalwarming #climatecrisis #globalheating #water #watergap #waterscarcity #aquatic #ecosystem,https://imgs.socialinsider.io/instagram/2025/02/ecowatch_18047144036249851.jpeg,0.0952,2025-02-26 18:30:00,IMAGE,Posts_ecowatch_18_Apr_2024_17_Apr_2025_d967_CLEANED_156.jpeg
PROTEUS  is being designed as the International Space Station of the ocean. As aquanaut and team lead Fabien Cousteau fcousteau shared with EcoWatch s Tiffany Duong tiffmakeswaves  this undersea research laboratory and habitat will include training capacities for extreme living research facilitation for ocean science and a virtual component to help the people of Cura ao and of the world to interface with the cutting edge science taking place beneath the waves. EcoWatch joined the visionaries at Proteus Ocean Group proteusoceangroup in Cura ao for an exclusive diving and research trip at the potential project site. Here s a first inside look! Stay tuned ecowatch for more exclusive coverage of this groundbreaking project and follow along at proteusoceangroup for more hope and innovation.  editor: ianpowell_714.#aquanaut #astronaut #explorers #curacao #proteus #oceanexploration #spaceexploration,https://imgs.socialinsider.io/instagram/2025/02/ecowatch_18041533256096612.jpeg,0.0952,2025-02-18 18:30:00,reel,Posts_ecowatch_18_Apr_2024_17_Apr_2025_d967_CLEANED_157.jpeg
Prices may soon increase at the pump due to tariffs on gas imported from Mexico and Canada enacted by President Donald Trump.President of Mexico Claudia Sheinbaum has reached a deal with the Trump administration to delay the tariffs for a month while import duties on Canadian and Chinese goods will go into effect early February. The impact of the tariffs could harm oil companies and increase gas prices. As a reason for imposing the tariffs Trump cited a national emergency related to undocumented immigrants coming into the U.S. as well as the flow of the drug fentanyl into the country reported CNN. Trump has said he will use the tariffs to raise revenue bring other nations to the negotiating table and balance trade.But economists have warned the tariffs would have a negative impact on U.S. consumers and businesses. The U.S. Chamber of Commerce on Saturday said the duties would not solve border issues but would instead threaten supply chains while raising prices for Americans.About a third of American imports come from Mexico Canada and China including fruits and vegetables electronics meat clothing toys gas lumber beer and spirits.  Link in bio.  cristenhemingwayjaynes.Trucks cross the Ambassador Bridge as they carry cargo between Canada and the U.S. in Detroit Michigan on Feb. 3 2025.   Scott Olson / Getty Images.#ecowatchers #climatenews #climatechange #globalwarming #climatecrisis #canada #mexico #china #trump #tariffs,https://imgs.socialinsider.io/instagram/2025/02/ecowatch_18086773729505902.jpeg,0.0952,2025-02-09 18:30:00,IMAGE,Posts_ecowatch_18_Apr_2024_17_Apr_2025_d967_CLEANED_158.jpeg
Nearly half a billion children live in areas of the globe where there are twice as many or more  extremely hot days  each year than there were six decades ago according to a new UNICEF analysis. The report A Threat to Progress: Confronting the effects of climate change on child health and well-being found that 466 million children   one in five children in the world   are exposed to this unprecedented level of excessive heat.The researchers compared average temperatures in the 1960s to those from 2020 to 2024   with extremely hot days being those that were more than 95 degrees Fahrenheit   and found that they had increased for nearly half a billion children around the world many of whom did not have the services or infrastructure to cope.The analysis looked at data by country and found that in 16 nations children today are subjected to an additional month-plus of extremely hot days in comparison with six decades ago. Excessive heat stress can contribute to non-communicable diseases like heat-related illnesses malnutrition in children and can make children more susceptible to infectious diseases like malaria and dengue that spread easily in high temperatures. Extreme heat also impacts mental health neurodevelopment and overall wellbeing.When extreme heat goes on for longer periods its effects are compounded. Children in more than half of the 100 countries surveyed were found to experience twice the number of heat waves now than 60 years ago and these extremely hot temperatures are increasing in every country around the world.   Link in bio.  cristenhemingwayjaynes.A boy carries a pot of water in sweltering heat in Dhaka Bangladesh.   Sultan Mahmud Mukut / SOPA Images / LightRocket via Getty Images.#ecowatchers #climatenews #climatechange #globalwarming #temperature #heat #extremeheat #UNICEF,https://imgs.socialinsider.io/instagram/2024/08/ecowatch_18035437690919326.jpeg,0.09529,2024-08-21 18:30:00,IMAGE,Posts_ecowatch_18_Apr_2024_17_Apr_2025_d967_CLEANED_159.jpeg
The death toll from Hurricane Helene has rose to at least 200. Helicopters searched for survivors above washed-out bridges while rescuers hiked through the wilderness.After pummeling Florida s Gulf Coast the powerful Category 4 storm dumped over 40 trillion gallons of rainfall   enough to fill up Lake Tahoe   throughout the southern United States. The deluge created a catastrophic mixture of flooding mudslides and disruptions to power internet and water supplies.The death toll in North Carolina was at least 74 while South Carolina reported 39 fatalities. In Georgia the death toll reached 33 according to Gov. Brian Kemp. 14 deaths were reported in Florida two in Virginia and four in Tennessee local authorities and reports from media compiled by AFP said.  Link in bio. cristenhemingwayjaynes.Workers community members and business owners clean up debris in the aftermath of Hurricane Helene in Marshall North Carolina on Monday Sept. 30 2024. Jabin Botsford / The Washington Post via Getty Images.#ecowatchers #climatenews #climatechange #globalwarming #huricane #helene #flooding #mudslides,https://imgs.socialinsider.io/instagram/2024/10/ecowatch_17892617961093637.jpeg,0.09529,2024-10-09 18:03:00,IMAGE,Posts_ecowatch_18_Apr_2024_17_Apr_2025_d967_CLEANED_160.jpeg
Over the last century urbanization and industrialization combined with poor waste management has led to an alarming rise in the amount of pollution in our soils waterways groundwater and air. Heavy metal toxins from industrial production chemicals from the agriculture sector untreated wastewater plastic pollution crude oil leaks and spills toxins from the increasing wildfires and other pollutants need systems-level change. However natural processes in the environment do offer solutions.Bioremediation is a process by which plants and microbes that are already present in the environment   like fungi algae and bacteria   have the power to remove or reduce environmental pollution   even plastic pollution. While natural bioremediation has been around since the dawn of time (microbes were the earliest known life forms) modern bioremediation offers techniques that stimulate and augment these processes. While there are numerous bioremediation types there are also several processes that have been utilized and are either done in situ (at the place of contamination) or ex situ (off-site of the contamination).Head on over to the link in our bio to learn more! . Libby Leonard.Sunflower fields near Primorskye village Ukraine on July 7 2023. Sunflowers are phytoremediators and were used after the Chernobyl nuclear disaster in 1986 to help remove radioactive materials from contaminated soil. Amadeusz Swierk / SOPA Images / LightRocket via Getty Images.#ecowatchers #climatenews #climatechange #globalwarming #urbanization #industrialization #bioremediation #pollution #agriculture,https://imgs.socialinsider.io/instagram/2024/06/ecowatch_18045958864667363.jpeg,0.09339,2024-06-27 18:30:00,IMAGE,Posts_ecowatch_18_Apr_2024_17_Apr_2025_d967_CLEANED_161.jpeg
Construction has started in the UK on two of four new bison bridges that will enable the animals to cross through forested areas while allowing human visitors to observe the wildlife from the bridges above.The project totaling  1 million (about $1.33 million) includes four bridges that people can use to safely observe the UK s first wild bison herd in thousands of years according to Kent Wildlife Trust which alongside Wildwood Trust has been a leader of the wild bison restoration project in the UK.Kent Wildlife Trust reported that bison are labeled as dangerous under the Dangerous Wild Animals Act 1976. This prevents bison from sharing the same spaces as humans. By installing pedestrian bridges the bison can have a greater range while the humans can watch and learn more about these creatures.With the bridges the bison will expand their roaming area from 50 hectares to around 200 hectares. Currently the bison are restricted to fenced regions because of the official dangerous wildlife designation.While the bridges help expand the range for the bison conservationists are hoping to push UK officials to update rewilding laws to allow for bison preservation and expansion projects that won t require expensive steel fencing.Two of the bridges are expected to be complete before the end of 2024.  Link in bio.  Paige Bennett.Free-roaming European bison released into woodland in Canterbury UK on July 18 2022.   Kent Wildlife Trust / YouTube screenshot.#ecowatchers #climatenews #climatechange #globalwarming #uk #bison #migration #conservation #conservationists,https://imgs.socialinsider.io/instagram/2024/09/ecowatch_18042879635057301.jpeg,0.09339,2024-09-29 18:30:00,IMAGE,Posts_ecowatch_18_Apr_2024_17_Apr_2025_d967_CLEANED_162.jpeg
Have you ever heard of  cli-fi  before? Climate fiction is a genre of fiction that emerged in the first decades of the 21st century in response to growing awareness of the climate crisis caused primarily by the burning of fossil fuels. As the term  cli-fi  suggests climate fiction was originally highly associated with science fiction and often features scientist protagonists or the latest climate science to offer imaginings or warnings of what the near or far future might look like if humans do or do not act to reduce greenhouse gas emissions. However as the impacts of climate change have intruded ever more into daily life the genre has evolved to include many works set in the present or near-present as well. Climate fiction is a diverse gathering of works that ranges from Hollywood disaster thrillers like The Day After Tomorrow to hard science fiction focused on technological and political change such as the works of Kim Stanley Robinson to introspective literary novels like Jenny Offill s Weather. Many writers and critics who engage with climate fiction see it as a way to alter our climate reality by offering a warning of a future to avoid or providing a roadmap toward a more just and sustainable society. Some argue that because people have a hard time empathizing with their future selves reading about and caring for characters contending with the climate crisis can help them make that imaginative leap and take action today.  Interested in learning more? Head on over to the link in our bio to find more information on climate fiction.. : Olivia Rosane : brynnerardin.#ecowatchers #climatenews #climatechange #globalwarming #climatefiction #clifi #climatecrisis,https://imgs.socialinsider.io/instagram/2024/09/ecowatch_18000762965653364.jpeg,0.09339,2024-09-16 16:04:00,reel,Posts_ecowatch_18_Apr_2024_17_Apr_2025_d967_CLEANED_163.jpeg
