Renewable energy projects are rapidly expanding in China so much so that the country has double the amount of renewable capacity under construction compared to all other countries combined a new analysis from the non-governmental organization Global Energy Monitor.According to the analysis China currently has 180 gigawatts of utility-scale solar power and 159 gigawatts of wind power under construction. By comparison the U.S. has 40 gigawatts of renewable energy capacity currently under construction followed by Brazil with 13 gigawatts the UK with 10 gigawatts and Spain with 9 gigawatts.In total the amount of utility-scale solar and wind capacity under construction in China make up nearly two-thirds of the solar and wind capacity under construction worldwide.The report follows the China Electricity Council (CEC) s predictions from early 2024 that solar and wind capacity would outpace coal in China this year. According to the CEC report solar and wind capacity in China could make up about 40% of installed energy capacity in the country by the end of 2024 while coal could make up around 37%.  Link in bio.  Paige Bennett.Solar panels at the construction site of a photothermal power plant in Jiuquan Gansu Province of China on Jan. 23 2024.   Zhou Xingliang / VCG via Getty Images.#ecowatchers #climatenews #climatechange #globalwarming #solarenergy #windenergy #renewableenergy #china,https://imgs.socialinsider.io/instagram/2024/07/ecowatch_17886931221075108.jpeg,0.23061,2024-07-28 18:30:00,IMAGE,Posts_ecowatch_18_Apr_2024_17_Apr_2025_d967_CLEANED_44.jpeg
At United States Environmental Protection Agency (EPA) headquarters in Washington Democratic Senator Edward J. Markey U.S. Representative for Arizona Yassamin Ansari and New York Representative Paul Tonko requested a meeting with EPA Administrator Lee Zeldin to discuss why funding for environmental programs was being  unconstitutionally cut off  a press release from the Office of Ed Markey said.The Trump administration has disregarded multiple court orders requiring that the funds be restarted.The three Democratic members of Congress had also planned  to demand that the funding that has already been authorized and appropriated by Congress be rightfully unfrozen  the press release said.In the lobby of the EPA the legislators faced a cold reception. The three legislators were escorted outside and stood in the building s entryway. A security officer told them they were waiting for a representative to come and speak with them.Following the attempted meeting other members of Congress as well as advocates and leaders of several unions and environmental groups including Green New Deal Network Hip Hop Caucus WE ACT for Environmental Justice Climate Action Campaign Union of Concerned Scientists National Council of Churches and Natural Resources Defense Council joined the lawmakers outside EPA headquarters for a press conference.They accused the newly appointed leaders of the EPA of defying court orders issued by the federal government to enforce legally mandated environmental protections.  Link in bio.  cristenhemingwayjaynes.Sen. Edward Markey (D-MA) speaks during a demonstration after being blocked from entering the U.S. Environmental Protection Agency in Washington DC on Feb. 6 2025.   Al Drago / Getty Images.#ecowatchers #climatenews #climatechange #globalwarming #climatecrisis #epa #environment #congress #washington #trump,https://imgs.socialinsider.io/instagram/2025/02/ecowatch_17992914917773265.jpeg,0.23039,2025-02-16 18:30:00,IMAGE,Posts_ecowatch_18_Apr_2024_17_Apr_2025_d967_CLEANED_45.jpeg
Studies have recently detected microplastics in human lungs and blood and previous research shows humans ingest and inhale many microplastics even at home. In 2020 scientists uncovered microplastics in human organs for the first time. Now researchers are making sense of how microplastics that are ingested can make their way from the gut to other organs.Researchers studied mice that were exposed to and ingested microplastics over a four-week period and found those microplastics moved to organ tissues of the brain liver and kidney. The team also noted metabolic differences in the colon liver and brain after the microplastic exposure.Scientists estimate that humans consume about 5 grams of microplastics per week or about enough to fill a soup spoon. Estimates suggest humans consume about 21 grams of microplastics per month and 250 grams per year. Over a lifetime of about 79 years humans may consume 20 kilograms of microplastics.The scientists plan to further their research by examining whether different diets such as a high-fat diet compared to a high-fiber diet can impact microplastic exposure and ingestion  Link in bio.  Paige Bennett.Scientists estimate that humans consume about 5 grams of microplastics per week or about enough to fill a soup spoon.   Svetlozar Hristov / iStock / Getty Images Plus .#ecowatchers #climatenews #climatechange #globalwarming #plastics #microplastics #consumption,https://imgs.socialinsider.io/instagram/2024/05/ecowatch_17910093695950301.jpeg,0.2287,2024-05-29 15:51:00,IMAGE,Posts_ecowatch_18_Apr_2024_17_Apr_2025_d967_CLEANED_46.jpeg
Thousands of firefighters in California are battling the Park Fire in northern California after it doubled in size within 24 hours. The massive wildfire is the sixth-largest in the state s history having burned 370000 acres since it started. It had also destroyed more than 100 structures and threatened thousands more.The fire was 12 percent contained but evacuation orders or warnings remained for Butte Plumas Tehama and Shasta counties. Included in the evacuations was the town of Paradise devastated by the Camp Fire in 2018 which killed 84 people and was the deadliest in California history.According to the National Interagency Fire Center the Park Fire is one of dozens of wildfires that have burned in excess of two million acres across the country. Experts have said the Park Fire could keep spreading and Daniel Swain a University of California Los Angeles climate scientist said the enormous fire could burn for weeks or even months.  Link in bio.  cristenhemingwayjaynes.Firefighters set a backfire on the eastern front of the Park Fire spanning 360141 acres and 12% contained on July 28 2024 near Chico California.   David McNew / Getty Images .#ecowatchers #climatenews #climatechange #globalwarming #california #parkfire #wildfire #fire #evacuation,https://imgs.socialinsider.io/instagram/2024/08/ecowatch_17874230559135927.jpeg,0.2268,2024-08-09 18:30:00,IMAGE,Posts_ecowatch_18_Apr_2024_17_Apr_2025_d967_CLEANED_47.jpeg
Photos of wildlife on social media have the power to boost conservation by depicting predators not only as beautiful but as similar to domestic pets.A new study has found that through their millions of followers Instagram and Facebook can steer public engagement and awareness toward support for predators like wildcats who are sometimes shot and poisoned by farmers.The research was based on the caracal wildcat   a native of Africa with prominent tufted ears   whose similarity to house cats has brought thousands of followers to internet streams about conserving the elegant felines a press release from Taylor & Francis said.The researchers point out that  charismatic  smaller mammals like the caracal can be  flagship species  for getting the word out about the purposes of scientific research in areas that are rapidly urbanizing.The findings suggest the graceful carnivore s online appeal is connected with viral images memes and videos of cats.  Link in bio.  cristenhemingwayjaynes.A caracal looks out from behind bushes near Miller s Point in the southern section of the Cape Peninsula South Africa.   John Hishin.#ecowatchers #climatenews #climatechange #globalwarming #wildlife #conservation #socialmedia #caracal #wildcat #africa,https://imgs.socialinsider.io/instagram/2024/11/ecowatch_18054057730745985.jpeg,0.2268,2024-11-20 18:30:00,IMAGE,Posts_ecowatch_18_Apr_2024_17_Apr_2025_d967_CLEANED_48.jpeg
The Australian Marine Conservation Society (AMCS) has released video footage showing that the southern portion of the Great Barrier Reef is suffering from deep-sea coral bleaching. The footage shows that the bleaching extends at least as far down as 59.1 feet   the deepest reported during this mass bleaching event a press release from AMCS said. Some of the corals have begun to die in the face of record marine heat waves.Last week aerial survey data showed that 75 percent of the reef had experienced bleaching during the current bleaching event with much of it classed as  high to extreme bleaching. During climate change-driven marine heat waves extended periods of warmer ocean temperatures cause corals to become stressed which leads them to expel the algae that live in a symbiotic relationship with them. These algae not only give corals their colorful appearance but they are also their main source of energy so long periods without them can lead to starvation.Some southern reef areas have seen elevated water temperatures lasting for a record 14.57 weeks smashing the previous 11.8-week record set in April of 2020 according to National Oceanic and Atmospheric Administration data.The Great Barrier Reef s plight is directly related to human-caused climate change and no time must be lost in addressing and mitigating the source of the crisis  Link in bio.  cristenhemingwayjaynes.New video footage released on April 11 2024 shows that bleached corals on the southern part of the Great Barrier Reef extend to greater depths than has been reported during the current mass bleaching event.   Australian Marine Conservation Society / Facebook screenshot.#ecowatchers #climatenews #climatechange #globalwarming #australia #greatbarrierreef #coral #coralreef #coralbleaching,https://imgs.socialinsider.io/instagram/2024/04/ecowatch_18131845459336862.jpeg,0.22298,2024-04-22 18:07:00,IMAGE,Posts_ecowatch_18_Apr_2024_17_Apr_2025_d967_CLEANED_49.jpeg
10000+ survivors of climate disasters and their loved ones delivered an open letter to thejusticedept asking them to investigate the fossil fuel industry for its knowing contribution to destructive and deadly  climate-related crimes.  These include everything from floods to wildfires from unbreathable air to disastrous droughts. Furthermore decades of disinformation campaigns and socioeconoic disparities in the distribution of environmental hazards (targeting minority and underserved neighborhoods) has led to much pain and suffering. roishetta_ozane from vessel.project shares her perspective as one of these #ClimateSurvivors. Follow public_citizen ChesapeakeClimate Vessel.Project to stay up to date about this campaign for the climate.   Link in bio for more info.  Michael Riojas  editor: brynnerardin,https://imgs.socialinsider.io/instagram/2024/09/ecowatch_17954817221714616.jpeg,0.22108,2024-09-28 21:04:00,reel,Posts_ecowatch_18_Apr_2024_17_Apr_2025_d967_CLEANED_50.jpeg
The global average temperature for the period June 2023 to May 2024   12 consecutive months   was 1.63 degrees Celsius above the pre-industrial average making it the hottest on record according to new data from the Copernicus Climate Change Service (C3S). It was also the longest stretch above the 1.5-degree threshold of the Paris Agreement.In May the average ocean surface temperature was 69.6 degrees Fahrenheit the warmest ever recorded for the month. It was the fourteenth record-setting month in a row for sea surface temperatures. The findings do not necessarily mean the Paris Agreement goal of global heating not exceeding 1.5 degrees Celsius above the average for pre-industrial times has been breached as this target is measured by averages over decades rather than single years. However the trend does mean more extreme heat and climate-fueled weather events as well as the risk of disastrous tipping points.The data suggest this year could be hotter than 2023 which was the hottest on record.  Link in bio.  cristenhemingwayjaynes.A highway billboard displays a temperature of 106 F in Phoenix Arizona on June 5 2024.   Justin Sullivan / Getty Images.#ecowatchers #climatenews #climatechange #globalwarming #globaltemperature #temperature #parisagreement #globalheating,https://imgs.socialinsider.io/instagram/2024/07/ecowatch_18034494812021312.jpeg,0.22108,2024-07-20 18:30:00,IMAGE,Posts_ecowatch_18_Apr_2024_17_Apr_2025_d967_CLEANED_51.jpeg
ecowatch loved chatting with National Geographic photographer and producer brianskerry about his new documentary series  Sea Change: the Gulf Of Maine . We learned so much about #ClimateChange and its effect on the Gulf of Maine. Hint: it s bad! The series highlights what s happening in one of the U.S.  most iconic waterways and what we can do about it. Watch Sea Change: the Gulf of Maine now on PBS the PBS App and NOVA on YouTube!  : brianskerry   editor: brynnerardin  : Craig Thompson . #ecowatchers #climatenews #climatechange #globalwarming #seachange #gulfofmaine #maine #brianskerry #pbs,https://imgs.socialinsider.io/instagram/2024/08/ecowatch_18450892696011841.jpeg,0.20964,2024-08-07 18:18:00,reel,Posts_ecowatch_18_Apr_2024_17_Apr_2025_d967_CLEANED_52.jpeg
Love is in the air ... and the grass ... and the sea ... and the flowers .... and ... and ... and ...With February 14th right around the corner we have one big question to ask Mother Nature: Will you be our Valentine?  This planet   and all the wild things that call it home bring us joy peace and serenity we love getting to share that magic   with our fellow EcoWatchers. For their Valentine s Day we challenge each of us to send a love letter to Mother Nature: pick up some trash take a walk in the sun adopt -a-coral   leave it all a little better than you found it. With hugs and hope Your EcoWatch team  editor: brynnerardin .#ecowatchers #climatenews #climatechange #globalwarming #nature #conservation #mothernature #valentinesday,https://imgs.socialinsider.io/instagram/2025/02/ecowatch_18060842914771206.jpeg,0.20945,2025-02-10 20:16:00,reel,Posts_ecowatch_18_Apr_2024_17_Apr_2025_d967_CLEANED_53.jpeg
#Finland is charting the leaderboards on the race to #cleanenergy.  Helsinki-owned energy group Helen took a big step towards a cleaner #Earth by shutting down their last coal-powered energy plant on April 1  . Power Magazine reports that #coal power now makes LESS than 1% of Finland s total energy. It s being replaced with #wind #hydropower #nuclear and #solar power which is actually saving money for its residents. Coal generated power is planned to be entirely banned   in Finland by 2029 which will bring Helen s #emission levels in 2030 to a measly 5% of what they were in 1990. Olli Sirkka CEO of Helen said this:  Our success is an excellent indication that at best the clean transition cost efficiency and Finland s security of supply can go hand in hand.    Paige Bennett  The Salmisaari power plant in the Ruoholahti quarter of the L nsisatama neighborhood of Helsinki Finland. Antonio Lopez Garcia / iStock / Getty Images Plus,https://imgs.socialinsider.io/instagram/2025/04/ecowatch_18125305183427328.jpeg,0.20945,2025-04-09 16:37:00,IMAGE,Posts_ecowatch_18_Apr_2024_17_Apr_2025_d967_CLEANED_54.jpeg
Deep in Canada s remote Brevoort Island in the Nunavut territory a radar technician was killed last week in a rare polar bear attack. Days earlier a polar bear was spotted in Rankin Inlet a remote but fairly populated Inuit settlement in the same territory. Experts warn that similar encounters with polar bears will likely become more common as climate change destroys their habitats and makes it more difficult to find food.According to a 2017 study published in the Wildlife Society Bulletin polar bears are more likely to attack humans when they re  nutritionally stressed  and are in  below-average body condition. Unlike other species polar bears can see humans as a potential food source making them extremely dangerous. In case of an encounter it s recommended to carry deterrents such as an air horn or bear spray and playing dead is not effective. Instead it s recommended to back away slowly and prepare to stand your ground by making loud noises and prepare for a potential fight aiming for the nose and head.As climate change worsens polar bear populations will decline as they need sea ice for habitation and for capturing seals according to a 2020 research article published in the journal Nature Climate Change.  Link in bio.  Michael Riojas.Polar bear cubs with a backpack in Alaska.   sarkophoto / iStock / Getty Images Plus..#ecowatchers #climatenews #climatechange #globalwarming #polarbears #canada #bearattack #bearpopulations,https://imgs.socialinsider.io/instagram/2024/08/ecowatch_17993147309680558.jpeg,0.20583,2024-08-29 18:30:00,IMAGE,Posts_ecowatch_18_Apr_2024_17_Apr_2025_d967_CLEANED_55.jpeg
The greatest threat to our planet is the belief that someone else will save it.  - Robert Swan Polar Explorer & Environmental Advocate  James Duncan Davidson/TED,https://imgs.socialinsider.io/instagram/2025/04/ecowatch_17932975827012390.jpeg,0.20374,2025-04-14 02:37:00,IMAGE,Posts_ecowatch_18_Apr_2024_17_Apr_2025_d967_CLEANED_56.jpeg
Planet vs. Plastics is the theme of the 54th annual Earth Day. .This year marks the 54th year of Earth Day! What better way to celebrate than to explore opportunities to join others in helping combat the climate crisis and make our planet cleaner greener and more sustainable? Here are a few suggestions to get you started..  Link in bio.Fridays for Future activists holds a globe during a climate protest demonstration on April 19 2024 in Turin Italy.   Stefano Guidi / Getty Images.#ecowatchers #earthday #earthday #earthday2024 #earth #plasticpollution #environment #plasticfree,https://imgs.socialinsider.io/instagram/2024/04/ecowatch_17926307630776883.jpeg,0.20202,2024-04-19 17:48:00,IMAGE,Posts_ecowatch_18_Apr_2024_17_Apr_2025_d967_CLEANED_57.jpeg
Japan has its sights set on renewable energy producing 40 to 50 percent of its electricity by 2040 with another 20 percent coming from nuclear power according to a new draft of its basic energy policy.Japan is the second-largest liquefied natural gas (LNG) importer in the world as well as a big consumer of oil from the Middle East so its energy plans are of interest to gas oil and coal producers. The country s use of thermal power   particularly from coal-fired power plants   is on course to fall to 30 to 40 percent by 2040. Last year thermal energy made up 68.6 percent of the energy mix.Tokyo said nuclear power will play a major role in helping the country meet the growing energy demand from microchip factories and artificial intelligence. Japan s government had previously set a goal of becoming carbon-neutral by mid-century as well as reducing emissions by nearly 50 percent from 2013 levels by 2030.The new plans expect renewables like wind and solar to make up 40 to 50 percent of power generation by 2040. That s up from 23 percent last year and an earlier target of 38 percent by 2030.  Link in bio.  cristenhemingwayjaynes.Setana Osato wind farms on seaside cliffs in Setana town Hokkaido Japan on July 31 2024.   Noriko Hayashi / for The Washington Post via Getty Images.#ecowatchers #climatenews #climatechange #globalwarming #japan #renewable #energy #renewableenergy #wind #solar,https://imgs.socialinsider.io/instagram/2024/12/ecowatch_18194025688306657.jpeg,0.20202,2024-12-27 18:30:00,IMAGE,Posts_ecowatch_18_Apr_2024_17_Apr_2025_d967_CLEANED_58.jpeg
Halloween is right around the corner! But have you ever stopped to consider the impact that this one night has on our planet?When we think about Halloween ethical and sustainable practices don t exactly spring to mind. But the amount of waste that this holiday can generate is mind-boggling: from flimsy single-use costumes to plastic candy wrappers to mass-produced decorations.We here at ecowatch wanted to show you how to make your upcoming spooktacular celebrations more eco-friendly so you can spend the night scaring sustainably! Which of these 5 tips are you planning to use next Thursday? Are there any that we missed that you think we should add? Comment down below!.  editor: brynnerardin .#ecowatchers #climatenews #climatechange #globalwarming #halloween #ecofriendly #plastic #waste,https://imgs.socialinsider.io/instagram/2024/10/ecowatch_18361939882112857.jpeg,0.19821,2024-10-25 00:13:00,reel,Posts_ecowatch_18_Apr_2024_17_Apr_2025_d967_CLEANED_59.jpeg
The International Union for Conservation of Nature (IUCN) has recently found that about half of all mangrove ecosystems in the world are at risk of collapsing meaning they are considered vulnerable endangered or critically endangered by the organization s Red List of Ecosystem standards  The IUCN Red List of Ecosystems measures the health and risks of specific ecosystems but this is the first time the standards have been used to assess an ecosystem at a global scale.IUCN reported that mangrove ecosystems face an increasing number of threats particularly from the effects of climate change. Frequent and severe weather events threaten the mangroves but they are particularly vulnerable to sea level rise.Mangrove ecosystems which require tropical humid environments are expanding into temperate areas because of climate change. According to IUCN agricultural use of freshwater has also limited the amount of freshwater that can reach coastal areas where mangroves typically thrive limiting the mangroves  ability to survive in their natural habitats.In a business-as-usual scenario about 25% of the global area covered by mangroves currently could be submerged over the next 50 years and about 33% of global mangrove ecosystems will be severely impacted.At the current rate the predicted mangrove losses would lead to a loss of 1.8 billion metric tons of stored carbon emissions equating to a cost to society of about $336 billion. Losing these mangrove ecosystems could also expose 2.1 million people to coastal flooding.  Link in bio.  Paige Bennett.A local resident and conservationist removes plastic waste stuck in mangrove plants at Dupa Beach Palu City Central Sulawesi Province Indonesia on May 13 2022.   Basri Marzuki / NurPhoto via Getty Images.#ecowatchers #climatenews #climatechange #globalwarming #iucn #mangrove #ecosystem #sealevelrise,https://imgs.socialinsider.io/instagram/2024/06/ecowatch_17849098416217235.jpeg,0.19821,2024-06-10 18:30:00,IMAGE,Posts_ecowatch_18_Apr_2024_17_Apr_2025_d967_CLEANED_60.jpeg
WE HAVE BABIES!!! In April 2024 ecowatch media team tiffmakeswaves brynnerardin and thecoralqween joined familiesinnature and telacoral in #Honduras for a coral #expedition on #TheRebelReef and there was a major breakthrough! We found coral babies!! Aren t they   cute  ?!Coral recruits on terra cotta tiles prove this Caribbean reef is still healthy and productive   a rarity in the modern day. #TelaCoral president juliberwald explains why this matters  . The #communityscience team will return to #Tela in August and September this year so stay tuned for more updates from the field.   brynnerardin#ecowatchers #climatenews #fieldscience #coralreefs #ecowatchers #ecowatchonexpedition #coralrecruits #citizenscience #scuba #inthefield,https://imgs.socialinsider.io/instagram/2024/08/ecowatch_18068341885569894.jpeg,0.19821,2024-08-08 21:57:00,reel,Posts_ecowatch_18_Apr_2024_17_Apr_2025_d967_CLEANED_61.jpeg
According to the European Union s Copernicus Climate Change Service (C3S) 2024 is highly likely to be the warmest year on record and to breach the 1.5 degree Celsius limit outlined in the Paris Agreement.The Paris Agreement s 1.5 degree Celsius target refers to limiting global warming to no more than 1.5 degrees Celsius higher than the global average temperature in pre-industrial times. This target was established by scientists to limit catastrophic impacts of climate change.Many countries have set climate targets including net-zero emissions goals to reduce emissions by 2050 as outlined by the Paris Agreement. But scientists now warn we are on track to breach the 1.5 degree Celsius limit for 2024 the first time this has happened for a calendar year. However Earth has already experienced a global average temperature of 1.5 degrees Celsius higher than pre-industrial times for 12 consecutive months. From February 2023 through Jan 2024 the temperature was 1.52 degrees Celsius higher than the global average temperature from 1850 to 1900.Now 2024 could be the first calendar year meaning from January 1 to December 31 to surpass 1.5 degrees Celsius of warming compared to pre-industrial global temperatures and it s set to be the hottest on record based on data from January through October of this year.  Link in bio.  Paige Bennett.Smoke over downtown Bogot  Colombia seen from the El Paraiso neighborhood during extremely high temperatures and wildfires on Jan. 26 2024.   Diego Cuevas / Getty Images .#ecowatchers #climatenews #climatechange #globalwarming #parisagreement #emissions #globaltemperature,https://imgs.socialinsider.io/instagram/2024/11/ecowatch_17937427364944274.jpeg,0.1963,2024-11-18 18:30:00,IMAGE,Posts_ecowatch_18_Apr_2024_17_Apr_2025_d967_CLEANED_62.jpeg
