Image Filename,Caption,Cleaned Caption
Posts_nature_org_18_Apr_2024_17_Apr_2025_7883_CLEANED_0.jpeg,When we use our voices we can help preserve oceans lands communities and climate. And there s never been a more urgent time to protect our planet. Speak up for nature.,when we use our voices we can help preserve oceans lands communities and climate and there s never been a more urgent time to protect our planet speak up for nature
Posts_nature_org_18_Apr_2024_17_Apr_2025_7883_CLEANED_1.jpeg,Its not every day you see an octopus hitching a ride on a dolphin!   #WorldOctopusDay : Jodie Lowe/TNC Photo Contest 2021 (jodie_lowe88),its not every day you see an octopus hitching a ride on a dolphin #worldoctopusday jodie lowetnc photo contest 2021 jodie_lowe88
Posts_nature_org_18_Apr_2024_17_Apr_2025_7883_CLEANED_2.jpeg,What dives deeper than a submarine swims across oceans is covered in polka-dots and has a mouth straight out of a horror movie?  Swipe to find the answer. Well wait... Those teeth!  Leatherback sea turtles are one of natures deep-diving superstars and can stay submerged for around 90 minutes on a single breath. But lets talk about their TEETH!! Take a peak down a leatherback s throat and youll be greeted with a scene straight out of a horror movie. Their esophagus is coated with backward-curved spines called esophageal papillae. Leatherback turtles swallow a lot of seawater as they chomp down on jellyfish and the pallipae help hold their prey in place as the turtles expel that extra seawater back out of their mouths. Tap the link in our bio to learn more about these wild and wonderful creatures! : Rach Devlin/iNaturalistazure27014/iNaturalist,what dives deeper than a submarine swims across oceans is covered in polkadots and has a mouth straight out of a horror movie swipe to find the answer well wait those teeth leatherback sea turtles are one of natures deepdiving superstars and can stay submerged for around 90 minutes on a single breath but lets talk about their teeth take a peak down a leatherback s throat and youll be greeted with a scene straight out of a horror movie their esophagus is coated with backwardcurved spines called esophageal papillae leatherback turtles swallow a lot of seawater as they chomp down on jellyfish and the pallipae help hold their prey in place as the turtles expel that extra seawater back out of their mouths tap the link in our bio to learn more about these wild and wonderful creatures rach devlininaturalistazure27014inaturalist
Posts_nature_org_18_Apr_2024_17_Apr_2025_7883_CLEANED_3.jpeg,As you finalize your New Year s resolutions vision boards and bingo cards we ask that you make nature one of your top priorities. Our planet is facing enormous challenges but together we have the power (and the responsibility!) to take action and protect our environment. How will you make a difference for nature this year? Swipe to read some of our suggestions and share your ideas in the comments!,as you finalize your new year s resolutions vision boards and bingo cards we ask that you make nature one of your top priorities our planet is facing enormous challenges but together we have the power and the responsibility to take action and protect our environment how will you make a difference for nature this year swipe to read some of our suggestions and share your ideas in the comments
Posts_nature_org_18_Apr_2024_17_Apr_2025_7883_CLEANED_4.jpeg,Happy Earth Day!!  Today we are filled with hope   thanks to the dedication of so many people like you who are shaping a brighter future for our beautiful planet. This year we re especially inspired by the young changemakers who are turning their words into actions and finding new ways to help. There s an environmental leader in all of us!If you re feeling inspired this #EarthDay join the movement with actions you can take right now via the link in our bio. :1. Teguh Tofik Hidayat/TNC Photo Contest 20232. Cerro Eram n Chalatenango El Salvador. 7 de Julio de 20193. Jordan Robins /TNC Photo Contest 20194. Jonathan Morris/TNC Photo Contest 20225.    /Lei Bo /TNC Photo Contest 20236. Karine Aigner,happy earth day today we are filled with hope thanks to the dedication of so many people like you who are shaping a brighter future for our beautiful planet this year we re especially inspired by the young changemakers who are turning their words into actions and finding new ways to help there s an environmental leader in all of usif you re feeling inspired this #earthday join the movement with actions you can take right now via the link in our bio 1 teguh tofik hidayattnc photo contest 20232 cerro eram n chalatenango el salvador 7 de julio de 20193 jordan robins tnc photo contest 20194 jonathan morristnc photo contest 20225 lei bo tnc photo contest 20236 karine aigner
Posts_nature_org_18_Apr_2024_17_Apr_2025_7883_CLEANED_5.jpeg,Oh the weather outside is frightful. But nature is so delightful.  Heading out into the snow? Make sure to bundle up! And take a moment to appreciate how nature and wildlife thrive in a winter wonderland.  : 1. Great grey owl. rogerandjennyphotography/TNC Photo Contest 20222. Eibsee Germany. c.ronald.photo/TNC Photo Contest 20193. Blue jay. Jessica Kirste/TNC Photo Contest 20154. Hollow Rock Minnesota. justinrogers/TNC Photo Contest 20195. Bison. Gage Graus6. Cascada del Estrecho Spain. Roberto Bueno/TNC Photo Contest 20217. Vancouver Island. Anna Anderson/TNC Photo Contest 2021,oh the weather outside is frightful but nature is so delightful heading out into the snow make sure to bundle up and take a moment to appreciate how nature and wildlife thrive in a winter wonderland 1 great grey owl rogerandjennyphotographytnc photo contest 20222 eibsee germany cronaldphototnc photo contest 20193 blue jay jessica kirstetnc photo contest 20154 hollow rock minnesota justinrogerstnc photo contest 20195 bison gage graus6 cascada del estrecho spain roberto buenotnc photo contest 20217 vancouver island anna andersontnc photo contest 2021
Posts_nature_org_18_Apr_2024_17_Apr_2025_7883_CLEANED_6.jpeg,Suspect thinks hes a rough and tumble guy when we all know his purpose in life is to be the cuddly friend.  : Shane Morrison/TNC Photo Contest 2022,suspect thinks hes a rough and tumble guy when we all know his purpose in life is to be the cuddly friend shane morrisontnc photo contest 2022
Posts_nature_org_18_Apr_2024_17_Apr_2025_7883_CLEANED_7.jpeg,Every act of generosity   big or small   helps us protect our planet and all the creatures who call it home. This holiday season we re asking you to help protect nature any way you can. Participate in a local river cleanup. Speak up for nature at your city council meetings. Or become a member of The Nature Conservancy at the link in our bio.,every act of generosity big or small helps us protect our planet and all the creatures who call it home this holiday season we re asking you to help protect nature any way you can participate in a local river cleanup speak up for nature at your city council meetings or become a member of the nature conservancy at the link in our bio
Posts_nature_org_18_Apr_2024_17_Apr_2025_7883_CLEANED_8.jpeg,It s time to celebrate! The U.S. Foundation for International Conservation Act was just passed by Congress.   TNC has been championing this bill for over a year. Here s why it s a big deal.  It will invest up to $100 million in public funding a year to accelerate conservation efforts in wildlife rich yet vulnerable parts of the world.  The funding will support Indigenous Peoples and local communities helping them better manage their conserved and protected areas.  It will boost U.S. national security and promote regional stability worldwide because political stability depends on the stability to the natural world.So yeah it s a huge win for people and the planet!Learn more with the link in our bio! :1. Lakshitha Karunarathna/TNC Photo Contest 20232. Sarah Waiswa (lafrohemien)3. Robert L. Keyser/TNC Photo Contest 20164. Bayar Balgantseren5. Nick Hall,it s time to celebrate the us foundation for international conservation act was just passed by congress tnc has been championing this bill for over a year here s why it s a big deal it will invest up to 100 million in public funding a year to accelerate conservation efforts in wildlife rich yet vulnerable parts of the world the funding will support indigenous peoples and local communities helping them better manage their conserved and protected areas it will boost us national security and promote regional stability worldwide because political stability depends on the stability to the natural worldso yeah it s a huge win for people and the planetlearn more with the link in our bio 1 lakshitha karunarathnatnc photo contest 20232 sarah waiswa lafrohemien3 robert l keysertnc photo contest 20164 bayar balgantseren5 nick hall
Posts_nature_org_18_Apr_2024_17_Apr_2025_7883_CLEANED_9.jpeg,The Guam kingfisher native to the island of Guam became extinct in the wild in 1988 following the introduction of the invasive brown snake. For decades the species has survived only in conservation zoos and other wildlife facilities. But this summer nine Guam kingfishers were relocated to The Nature Conservancy s Palmyra Atoll Preserve within the Palmyra Atoll National Wildlife Refuge where they are being rewilded. They re not  home  yet but this marks a hopeful new step for their eventual return to their native landscape. Head to the link in our bio to learn more about this remarkable species and their road to recovery.,the guam kingfisher native to the island of guam became extinct in the wild in 1988 following the introduction of the invasive brown snake for decades the species has survived only in conservation zoos and other wildlife facilities but this summer nine guam kingfishers were relocated to the nature conservancy s palmyra atoll preserve within the palmyra atoll national wildlife refuge where they are being rewilded they re not home yet but this marks a hopeful new step for their eventual return to their native landscape head to the link in our bio to learn more about this remarkable species and their road to recovery
Posts_nature_org_18_Apr_2024_17_Apr_2025_7883_CLEANED_10.jpeg,Sometimes protecting nature means preserving vast forests and scenic landscapes. Other times it means planting native trees and nurturing existing ones in your own backyard.Which trees or urban forests have made an impact on your life?  : Mikhaila Markham / TNC,sometimes protecting nature means preserving vast forests and scenic landscapes other times it means planting native trees and nurturing existing ones in your own backyardwhich trees or urban forests have made an impact on your life mikhaila markham tnc
Posts_nature_org_18_Apr_2024_17_Apr_2025_7883_CLEANED_11.jpeg,Meet the adorable island spotted skunk! Despite being one of North America s lesser-known skunks this tiny cutie is just a quarter the size of a striped skunk and full of surprises. Thanks to a monitoring program using camera traps on California s Channel Islands we get a peek into their quirky habits. Watch as this little skunk does a handstand to ward off intruders more cute than threatening! And check out the rare footage of the skunk meeting a fox while foraging. Nature never ceases to amaze! :1. L. Brenner2. TNC3. Mike Watling (foxtracker805)4. John Stuelpnagel5. TNC6. L. Brenner,meet the adorable island spotted skunk despite being one of north america s lesserknown skunks this tiny cutie is just a quarter the size of a striped skunk and full of surprises thanks to a monitoring program using camera traps on california s channel islands we get a peek into their quirky habits watch as this little skunk does a handstand to ward off intruders more cute than threatening and check out the rare footage of the skunk meeting a fox while foraging nature never ceases to amaze 1 l brenner2 tnc3 mike watling foxtracker8054 john stuelpnagel5 tnc6 l brenner
Posts_nature_org_18_Apr_2024_17_Apr_2025_7883_CLEANED_12.jpeg,A little hope can go a long way.,a little hope can go a long way
Posts_nature_org_18_Apr_2024_17_Apr_2025_7883_CLEANED_13.jpeg,Its #SuperbOwl Sunday and these owls are serving face. There are more than 200 species of owls dispersed around the world so theres no better time to get together with family and friends cozy up with your favorite snacks and reflect on how these majestic species keep their ecosystems in check. And some people even play a little football game to celebrate. Hoot hoot!,its #superbowl sunday and these owls are serving face there are more than 200 species of owls dispersed around the world so theres no better time to get together with family and friends cozy up with your favorite snacks and reflect on how these majestic species keep their ecosystems in check and some people even play a little football game to celebrate hoot hoot
Posts_nature_org_18_Apr_2024_17_Apr_2025_7883_CLEANED_14.jpeg,Soaking in each peaceful winter moment.  : 1. Mark Peters/TNC Photo Contest 20222. Megan Lorenz/TNC Photo Contest 2021 (mlorenzphotography)3. Jenny Powell/TNC Photo Contest 2022 (jennyp_photography)4. Liam Conroy/TNC Photo Contest 2021 (seal_and_sky),soaking in each peaceful winter moment 1 mark peterstnc photo contest 20222 megan lorenztnc photo contest 2021 mlorenzphotography3 jenny powelltnc photo contest 2022 jennyp_photography4 liam conroytnc photo contest 2021 seal_and_sky
Posts_nature_org_18_Apr_2024_17_Apr_2025_7883_CLEANED_15.jpeg,Our out-of-office message is up.   #happyholidays JK JK nature needs us! Our mission needs YOU! We cant rest on our laurels if we want to tackle climate change and solve biodiversity loss! Find ways you can get involved on our website: nature.org.  : A moose sticks out its tongue.   USFWS/Public Domain,our outofoffice message is up #happyholidays jk jk nature needs us our mission needs you we cant rest on our laurels if we want to tackle climate change and solve biodiversity loss find ways you can get involved on our website natureorg a moose sticks out its tongue usfwspublic domain
Posts_nature_org_18_Apr_2024_17_Apr_2025_7883_CLEANED_16.jpeg,Acting as our planet s lungs by cleaning our air regulating temperature with a natural cooling effect filtering and purifying water to ensure we have clean water to drink and being home to countless species that support rich biodiversity. These are the incredible benefits of our guardians our allies our life sources forests! Our connection to them is profound so when they thrive we thrive. But trees are disappearing at alarming rates. Approximately 41 million are being cut down every day much faster than they can regrow. That s why TNC is working with governments corporations Indigenous Peoples and thousands of partners around the world to protect restore and sustainably manage forests. Join us in making a difference! Click the link in our bio to learn more about our global efforts to safeguard these precious ecosystems.  : 1. Ian Shive (person on forest trail) 2. Robert Ross/TNC Photo Contest 2019 (rjrossphoto) 3. Douglas Croft /TNC Photo Contest 2019 (douglascroftimages) 4. Cristiano Xavier/TNC Photo Contest 2022 (cristianoxavier01) 5. Kevin Wells /TNC Photo Contest 2019 (bird) 6. Steven Gnam (hammok) 7. Ethan Daniels (blue water mangrove) 8. Lalith Ekanayake/TNC Photo Contest 2021 (orangutan) 9. Nick Hall (cloudy forest) 10. Donny Sophandi/TNC Photo Contest 2021 (donnysophandi),acting as our planet s lungs by cleaning our air regulating temperature with a natural cooling effect filtering and purifying water to ensure we have clean water to drink and being home to countless species that support rich biodiversity these are the incredible benefits of our guardians our allies our life sources forests our connection to them is profound so when they thrive we thrive but trees are disappearing at alarming rates approximately 41 million are being cut down every day much faster than they can regrow that s why tnc is working with governments corporations indigenous peoples and thousands of partners around the world to protect restore and sustainably manage forests join us in making a difference click the link in our bio to learn more about our global efforts to safeguard these precious ecosystems 1 ian shive person on forest trail 2 robert rosstnc photo contest 2019 rjrossphoto 3 douglas croft tnc photo contest 2019 douglascroftimages 4 cristiano xaviertnc photo contest 2022 cristianoxavier01 5 kevin wells tnc photo contest 2019 bird 6 steven gnam hammok 7 ethan daniels blue water mangrove 8 lalith ekanayaketnc photo contest 2021 orangutan 9 nick hall cloudy forest 10 donny sophanditnc photo contest 2021 donnysophandi
Posts_nature_org_18_Apr_2024_17_Apr_2025_7883_CLEANED_17.jpeg,In honor of Valentines Day here are some of our favorite moments capturing love in the wild. From pufferfishes drafting art in the sand to spiders dancing to woo their sweeties we can take a note from nature when it comes to romance. Heres to celebrating the love in our lives whatever form it takes.  :Red foxes. Duke Coonrad /TNC Photo Contest 2019Turtles. Paula Gomes Vianna/TNC Photo Contest 2019Horses. Darlene Smith/TNC Photo Contest 2019Moose. Scott Suriano/TNC Photo Contest 2019Owls. Michiel Oversteegen/TNC Photo Contest 2019Leopards. Jason Zacarias/TNC Photo Contest 2023,in honor of valentines day here are some of our favorite moments capturing love in the wild from pufferfishes drafting art in the sand to spiders dancing to woo their sweeties we can take a note from nature when it comes to romance heres to celebrating the love in our lives whatever form it takes red foxes duke coonrad tnc photo contest 2019turtles paula gomes viannatnc photo contest 2019horses darlene smithtnc photo contest 2019moose scott surianotnc photo contest 2019owls michiel oversteegentnc photo contest 2019leopards jason zacariastnc photo contest 2023
Posts_nature_org_18_Apr_2024_17_Apr_2025_7883_CLEANED_18.jpeg,Nature s diversity is our lifeline. From the food on our plates to the air we breathe and the stability of our climate everything relies on the rich tapestry of life on Earth. Yet biodiversity loss is accelerating rapidly primarily due to human activities.We must act swiftly to address the root causes of biodiversity loss by:  Drastically lowering carbon emissions  Protecting diverse habitats at a grand scale  Committing to methods of food production that help nature regenerateIf we can work with nature and not against it natural systems and the life-giving services they provide can bounce back too. By taking on the interconnected crises of climate change and biodiversity loss we aren t merely removing problems and returning to business as usual. We are creating a sustainable future where both people and nature can thrive.Learn more about biodiversity and how you can take action with the link in our bio. :1. Christian Ziegler2. Parth Shiras/TNC Photo Contest 20233. Arindam Saha/TNC Photo Contest 20234. Elize Labuschagne /TNC Photo Contest 20195. Hallie Cowan/TNC Photo Contest 20236. Christian Ziegler7. Nick Hall8. Megan Lorenz /TNC Photo Contest 20189. Peter Knapp,nature s diversity is our lifeline from the food on our plates to the air we breathe and the stability of our climate everything relies on the rich tapestry of life on earth yet biodiversity loss is accelerating rapidly primarily due to human activitieswe must act swiftly to address the root causes of biodiversity loss by drastically lowering carbon emissions protecting diverse habitats at a grand scale committing to methods of food production that help nature regenerateif we can work with nature and not against it natural systems and the lifegiving services they provide can bounce back too by taking on the interconnected crises of climate change and biodiversity loss we aren t merely removing problems and returning to business as usual we are creating a sustainable future where both people and nature can thrivelearn more about biodiversity and how you can take action with the link in our bio 1 christian ziegler2 parth shirastnc photo contest 20233 arindam sahatnc photo contest 20234 elize labuschagne tnc photo contest 20195 hallie cowantnc photo contest 20236 christian ziegler7 nick hall8 megan lorenz tnc photo contest 20189 peter knapp
Posts_nature_org_18_Apr_2024_17_Apr_2025_7883_CLEANED_19.jpeg,If I vote nowIf I just vote nowWould you vote with meAnd just protect the world?  Use your voice to help protect our oceans lands communities and climate. Speak up for nature.  :1. nb_fotografie/TNC Photo Contest 20192. eliewolfphotography/TNC Photo Contest 20193. Yong Miao/TNC Photo Contest 20224. Mark Godfrey/TNC5. walchjohnc/TNC Photo Contest 20216. ninamayerritchie/TNC Photo Contest 20217. Vanessa Ballard/TNC Photo Contest 2019,if i vote nowif i just vote nowwould you vote with meand just protect the world use your voice to help protect our oceans lands communities and climate speak up for nature 1 nb_fotografietnc photo contest 20192 eliewolfphotographytnc photo contest 20193 yong miaotnc photo contest 20224 mark godfreytnc5 walchjohnctnc photo contest 20216 ninamayerritchietnc photo contest 20217 vanessa ballardtnc photo contest 2019
Posts_nature_org_18_Apr_2024_17_Apr_2025_7883_CLEANED_20.jpeg,The more we learn about trees the less real they seem.  : David Ike,the more we learn about trees the less real they seem david ike
Posts_nature_org_18_Apr_2024_17_Apr_2025_7883_CLEANED_21.jpeg,Legal team: You cant force people into supporting nature.Me: Got it. I cant. But owls can.   Whoos headed to the polls this November? Speak up for the future you want! Our link in bio has ideas on how to get started.   :1. Scott Anderson/TNC Photo Contest 20092. azevedofernandapaulo/TNC Photo Contest 20223. ngatmow_prawierow/TNC Photo Contest 20194-5. Thomas Unger/TNC Photo Contest 20196. dukecoonrad/TNC Photo Contest 2019,legal team you cant force people into supporting natureme got it i cant but owls can whoos headed to the polls this november speak up for the future you want our link in bio has ideas on how to get started 1 scott andersontnc photo contest 20092 azevedofernandapaulotnc photo contest 20223 ngatmow_prawierowtnc photo contest 201945 thomas ungertnc photo contest 20196 dukecoonradtnc photo contest 2019
Posts_nature_org_18_Apr_2024_17_Apr_2025_7883_CLEANED_22.jpeg,Birds of a feather we should stick together  Heres to the friendships that make life sweeter!  : Bears: Kathleen Patricia Turner/TNC Photo Contest 2011Buffalo and Bird: McDonald Temba/TNC Photo Contest 2022Lions: Yaron Schmid/TNC Photo Contest 2022Elephants: Clifford Rosenberg /TNC Photo Contest 2019Parrots: Judy Hawkes/TNC Photo Contest 2019Foxes: Robert McRae/TNC Photo Contest 2019,birds of a feather we should stick together heres to the friendships that make life sweeter bears kathleen patricia turnertnc photo contest 2011buffalo and bird mcdonald tembatnc photo contest 2022lions yaron schmidtnc photo contest 2022elephants clifford rosenberg tnc photo contest 2019parrots judy hawkestnc photo contest 2019foxes robert mcraetnc photo contest 2019
Posts_nature_org_18_Apr_2024_17_Apr_2025_7883_CLEANED_23.jpeg,Reindeer are famous for their holiday heroics but did you know theyre even more spectacular in real life? Their hooves make clicking sounds to help them stick together in harsh foggy weather and they cool their breath by 70 F before exhaling to conserve heat. Plus they can see ultraviolet light making them true winter navigators. Reindeer are truly magical creatures thriving in the harshest conditions with their incredible adaptations.  : 1. Matt Todd/TNC Photo Contest 20192. Margaret Strickland 3. Christopher Nolte,reindeer are famous for their holiday heroics but did you know theyre even more spectacular in real life their hooves make clicking sounds to help them stick together in harsh foggy weather and they cool their breath by 70 f before exhaling to conserve heat plus they can see ultraviolet light making them true winter navigators reindeer are truly magical creatures thriving in the harshest conditions with their incredible adaptations 1 matt toddtnc photo contest 20192 margaret strickland 3 christopher nolte
Posts_nature_org_18_Apr_2024_17_Apr_2025_7883_CLEANED_24.jpeg,Social media manager: Hey boss. Do you think posting vaguely intimidating photos of wildlife would make people wanna help protect nature?Boss: Not reallySocial media manager: Oh. So they should be very intimidating.  : Osprey. Scott Harris/TNC Photo Contest 2022Burrowing Owlet. mlorenzphotography/TNC Photo Contest 2019Tinker Reed Frog. Nico Hattingh/TNC Photo Contest 2021Lioness. Kiko Janneman/TNC Photo Contest 2019,social media manager hey boss do you think posting vaguely intimidating photos of wildlife would make people wanna help protect natureboss not reallysocial media manager oh so they should be very intimidating osprey scott harristnc photo contest 2022burrowing owlet mlorenzphotographytnc photo contest 2019tinker reed frog nico hattinghtnc photo contest 2021lioness kiko jannemantnc photo contest 2019
