Image Filename,Caption,Cleaned Caption
Posts_nature_org_18_Apr_2024_17_Apr_2025_7883_CLEANED_178.jpeg,While snapping a photo of these magnificent animals shivtrasi recalled an old saying   each time you see a tiger it s already seen you a thousand times. Let s wish these clever creatures a Happy International Tiger Day!    : 1. Nick Dale/TNC Photo Contest 2021(nickdalephotography)2. Carmen Yau Hing Chan /TNC Photo Contest 20193. Kim Sullivan/TNC Photo Contest 2019 (ksulli16)4. Faizan Khan/TNC Photo Contest 2019 (faizan.indore)5. Shivsharan Trasi/TNC Photo Contest 2019 (shivtrasi),while snapping a photo of these magnificent animals shivtrasi recalled an old saying each time you see a tiger it s already seen you a thousand times let s wish these clever creatures a happy international tiger day 1 nick daletnc photo contest 2021nickdalephotography2 carmen yau hing chan tnc photo contest 20193 kim sullivantnc photo contest 2019 ksulli164 faizan khantnc photo contest 2019 faizanindore5 shivsharan trasitnc photo contest 2019 shivtrasi
Posts_nature_org_18_Apr_2024_17_Apr_2025_7883_CLEANED_179.jpeg,You ve got questions about the climate crisis and we ve got answers. - Should we call it climate change global warming or the climate crisis? - Is climate change caused by humans? - What are the biggest ways climate change is altering our planet?- How is climate change affecting animals? - How is climate change affecting our food?We ve teamed up with our scientists to assemble a comprehensive guide to answer all your critical climate change questions.Click the link in our bio to check out our guide and stay informed.  : Shiloh Garcia/TNC Photo Contest 2023 (shiloh_fotisto),you ve got questions about the climate crisis and we ve got answers should we call it climate change global warming or the climate crisis is climate change caused by humans what are the biggest ways climate change is altering our planet how is climate change affecting animals how is climate change affecting our foodwe ve teamed up with our scientists to assemble a comprehensive guide to answer all your critical climate change questionsclick the link in our bio to check out our guide and stay informed shiloh garciatnc photo contest 2023 shiloh_fotisto
Posts_nature_org_18_Apr_2024_17_Apr_2025_7883_CLEANED_180.jpeg,Trees are some of our greatest allies in addressing climate change from old-growth giants to newly sprouting groves mangroves and rainforests to mountain evergreens. Protecting these forests and the many species that depend on them is essential to maintaining a livable climate.,trees are some of our greatest allies in addressing climate change from oldgrowth giants to newly sprouting groves mangroves and rainforests to mountain evergreens protecting these forests and the many species that depend on them is essential to maintaining a livable climate
Posts_nature_org_18_Apr_2024_17_Apr_2025_7883_CLEANED_181.jpeg,You ve gone birding with binoculars on a lovely hike many times and now you re ready for something bigger. Your next birding fix if you will. If an adventure is what you seek then you re in luck. Welcome to the strange magic of pelagic birding. Follow science writer Justine Hausheer as she embarks on a 12-hour day of boating with 16 complete strangers to get a glimpse of some rare birds that can only be seen far out at sea. Do you have what it takes? Check out the link in bio to learn about this adventure and find a pelagic birding trip near you! : 1. Justine E. Hausheer2. Jake Wilton/TNC Photo Contest 20223. Todd Burrows,you ve gone birding with binoculars on a lovely hike many times and now you re ready for something bigger your next birding fix if you will if an adventure is what you seek then you re in luck welcome to the strange magic of pelagic birding follow science writer justine hausheer as she embarks on a 12hour day of boating with 16 complete strangers to get a glimpse of some rare birds that can only be seen far out at sea do you have what it takes check out the link in bio to learn about this adventure and find a pelagic birding trip near you 1 justine e hausheer2 jake wiltontnc photo contest 20223 todd burrows
Posts_nature_org_18_Apr_2024_17_Apr_2025_7883_CLEANED_182.jpeg,Forest Spawn Talk about putting on a show! Male Tennessee dace develop bright colors  including yellow fins and a red belly   in the early spring to attract mates. Forests in the Appalachian Mountains filter water to downstream rivers providing healthy habitat for these fish and their offspring. Conservationists are working to make these forests more adaptable and thus more resilient in the face of climate change.___   David Herasimtschuk/Freshwaters Illustrated,forest spawn talk about putting on a show male tennessee dace develop bright colors including yellow fins and a red belly in the early spring to attract mates forests in the appalachian mountains filter water to downstream rivers providing healthy habitat for these fish and their offspring conservationists are working to make these forests more adaptable and thus more resilient in the face of climate change___ david herasimtschukfreshwaters illustrated
Posts_nature_org_18_Apr_2024_17_Apr_2025_7883_CLEANED_183.jpeg,The Great Bear Sea is a vast medley of marine habitats such as dense kelp forests lively estuaries and large coral beds. These habitats form one of the most productive cold-water ecosystems in the world drawing together endangered whales sea lions halibut crabs bears and a sub-species of wolves that have adapted to swimming long distances.In celebration of International Day of the World s Indigenous Peoples we re highlighting a historic initiative to protect and improve the management of more than 10 million hectares (25 million acres) of these marine habitats. The Great Bear Sea Project Finance for Permanence (PFP) is focused on just that: permanence. It establishes stable long-term funding for First Nation-led stewardship bolstering efforts such as Indigenous Guardian programs to restore fisheries safeguard habitats protect cultural resources and provide food security. We are proud to support Indigenous-led conservation co-governance and sustainable economic development in the Great Bear Rainforest and Sea.If you want to learn more about this initiative and other Indigenous-led conservation click the link in our bio. : Jon McCormack,the great bear sea is a vast medley of marine habitats such as dense kelp forests lively estuaries and large coral beds these habitats form one of the most productive coldwater ecosystems in the world drawing together endangered whales sea lions halibut crabs bears and a subspecies of wolves that have adapted to swimming long distancesin celebration of international day of the world s indigenous peoples we re highlighting a historic initiative to protect and improve the management of more than 10 million hectares 25 million acres of these marine habitats the great bear sea project finance for permanence pfp is focused on just that permanence it establishes stable longterm funding for first nationled stewardship bolstering efforts such as indigenous guardian programs to restore fisheries safeguard habitats protect cultural resources and provide food security we are proud to support indigenousled conservation cogovernance and sustainable economic development in the great bear rainforest and seaif you want to learn more about this initiative and other indigenousled conservation click the link in our bio jon mccormack
Posts_nature_org_18_Apr_2024_17_Apr_2025_7883_CLEANED_184.jpeg,Did you know an adult pangolin weighing just 6.6 pounds can consume over 0.66 pounds of termites in a single meal? They d probably host insane mukbangs if they could but they re too busy saving forests. One pangolin can protect a forested area as large as 31 football fields (41 acres) from termite destruction! We love a hungry hero.  Get to know these guardians of the forest with the link in our bio! 1. Suzi Ezsterhas/ Wild Wonders China 2. Xiao Shibai/Wild Wonders China3. Suzi Ezsterhas/ Wild Wonders China,did you know an adult pangolin weighing just 66 pounds can consume over 066 pounds of termites in a single meal they d probably host insane mukbangs if they could but they re too busy saving forests one pangolin can protect a forested area as large as 31 football fields 41 acres from termite destruction we love a hungry hero get to know these guardians of the forest with the link in our bio 1 suzi ezsterhas wild wonders china 2 xiao shibaiwild wonders china3 suzi ezsterhas wild wonders china
Posts_nature_org_18_Apr_2024_17_Apr_2025_7883_CLEANED_185.jpeg,Huge news for Bristol Bay Alaska! U.S. Rep. Mary Peltola has introduced the Bristol Bay Protection Act to permanently protect the Pebble Mine area from large-scale mining. Were thrilled to see this important first step in reaching a goal we share with most people in the Bristol Bay region and across Alaska.  Click the link in our bio to add your name and urge your elected leaders in Congress to vote for permanent protections for Bristol Bay.  : 1-3. Brian Adams4. Bridget Besaw,huge news for bristol bay alaska us rep mary peltola has introduced the bristol bay protection act to permanently protect the pebble mine area from largescale mining were thrilled to see this important first step in reaching a goal we share with most people in the bristol bay region and across alaska click the link in our bio to add your name and urge your elected leaders in congress to vote for permanent protections for bristol bay 13 brian adams4 bridget besaw
Posts_nature_org_18_Apr_2024_17_Apr_2025_7883_CLEANED_186.jpeg,Wild HarvestSummer is a season of abundance especially when it comes to wild berries from the big four strawberries blueberries blackberries and raspberries to lesser-known fruits like huckleberries thimbleberries and cloudberries. Here s how to get the most from your forages:  Monitor what s in season for your area and go early to scout locations. Checkpublic land along coastal areas in and at the edges of forests in urban greenpatches and along sunsoaked field borders.  Some national parks and TNC preserves like Kennebunk Plains Preserve in Maine allow berry picking but you may need a permit. Be aware of and abide by local laws.  Keep in mind forager tips and etiquette: Wear long sleeves only eat what you know harvest healthy looking plants and respectthe local wildlife.  Never pick a patch bare bears and birds are hungry too so sprinkle seeds as you go to spread bounty for the future.    Lindsey Liles   Shutterstock,wild harvestsummer is a season of abundance especially when it comes to wild berries from the big four strawberries blueberries blackberries and raspberries to lesserknown fruits like huckleberries thimbleberries and cloudberries here s how to get the most from your forages monitor what s in season for your area and go early to scout locations checkpublic land along coastal areas in and at the edges of forests in urban greenpatches and along sunsoaked field borders some national parks and tnc preserves like kennebunk plains preserve in maine allow berry picking but you may need a permit be aware of and abide by local laws keep in mind forager tips and etiquette wear long sleeves only eat what you know harvest healthy looking plants and respectthe local wildlife never pick a patch bare bears and birds are hungry too so sprinkle seeds as you go to spread bounty for the future lindsey liles shutterstock
Posts_nature_org_18_Apr_2024_17_Apr_2025_7883_CLEANED_187.jpeg,As climate change and land degradation create extreme weather events a Mongolian herder family faces a challenging future and the loss of their traditional lifestyle.,as climate change and land degradation create extreme weather events a mongolian herder family faces a challenging future and the loss of their traditional lifestyle
Posts_nature_org_18_Apr_2024_17_Apr_2025_7883_CLEANED_188.jpeg,A glimpse into co_nature  s San Miguel River s South Fork Preserve This preserve has an accessible boardwalk and is home to one of the best-known examples of the globally rare narrowleaf cottonwood-Colorado blue spruce/black twinberry plant community!,a glimpse into co_nature s san miguel river s south fork preserve this preserve has an accessible boardwalk and is home to one of the bestknown examples of the globally rare narrowleaf cottonwoodcolorado blue spruceblack twinberry plant community
Posts_nature_org_18_Apr_2024_17_Apr_2025_7883_CLEANED_190.jpeg,Calling all nature lovers!   Join TNC and partners as we take on the City Nature Challenge from April 26 29. How do you participate? Head outside! Explore local parks gardens and green spaces sign up for a bioblitz or visit a TNC nature preserve you can even participate from your own backyard. Then download the iNaturalist app to snap photos of the plants animals insects and other organisms you see and upload these observations to your city s iNaturalist project.Together we ll contribute to global wildlife research and celebrate the wonders of nature around the world. Find an event or project near you with the link in our bio! : 1. Justin Parker/TNC Photo Contest 20222. Tyler Holloway3. Kenny Braun4. Tyler Holloway5. Howard B. Cheek/TNC Photo Contest 2010,calling all nature lovers join tnc and partners as we take on the city nature challenge from april 26 29 how do you participate head outside explore local parks gardens and green spaces sign up for a bioblitz or visit a tnc nature preserve you can even participate from your own backyard then download the inaturalist app to snap photos of the plants animals insects and other organisms you see and upload these observations to your city s inaturalist projecttogether we ll contribute to global wildlife research and celebrate the wonders of nature around the world find an event or project near you with the link in our bio 1 justin parkertnc photo contest 20222 tyler holloway3 kenny braun4 tyler holloway5 howard b cheektnc photo contest 2010
Posts_nature_org_18_Apr_2024_17_Apr_2025_7883_CLEANED_191.jpeg,Each bird has a special role in their ecosystem and a unique tool for survival. Which beak would you want?,each bird has a special role in their ecosystem and a unique tool for survival which beak would you want
Posts_nature_org_18_Apr_2024_17_Apr_2025_7883_CLEANED_192.jpeg,All in a day s work.  Follow Gabriela TNC s Editorial & Content Coordinator on a day in the field as she works on her insidenatgeo project  The Underwater World of Mangroves.  Her project captures how the Florida Key s underwater mangrove ecosystem is adapting to a rapidly changing climate : gabtejeda,all in a day s work follow gabriela tnc s editorial content coordinator on a day in the field as she works on her insidenatgeo project the underwater world of mangroves her project captures how the florida key s underwater mangrove ecosystem is adapting to a rapidly changing climate gabtejeda
Posts_nature_org_18_Apr_2024_17_Apr_2025_7883_CLEANED_193.jpeg,These magical bugs remind us of summer evenings running in the warm breeze to try to capture the twinkle of their light. Unfortunately that light is growing dimmer as a result of habitat loss and light pollution. To keep these special creatures around we can turn off unnecessary lights protect their forest habitats and take care when we catch and release them. With our help we can make sure these living stars continue to flutter in our forests.  : chasingbugs1,these magical bugs remind us of summer evenings running in the warm breeze to try to capture the twinkle of their light unfortunately that light is growing dimmer as a result of habitat loss and light pollution to keep these special creatures around we can turn off unnecessary lights protect their forest habitats and take care when we catch and release them with our help we can make sure these living stars continue to flutter in our forests chasingbugs1
Posts_nature_org_18_Apr_2024_17_Apr_2025_7883_CLEANED_194.jpeg,Cicada revival era is in full swing! And how liberating it must be to shed your past self and go outside and scream with all your friends.  By now you ve probably heard these iconic red-eyed winged creatures singing (or screaming) across the Midwest and may be wondering: why are they here? Why are there so many of them? We ve got answers. This year s cicada emergence is 200 years in the making. Two broods of cicadas are emerging at the same time since 1803: 13-year periodical cicadas and 17-year periodical cicadas. Learn about what to expect for this once-in-a-lifetime emergence with the link in our bio!  : Charles Larry,cicada revival era is in full swing and how liberating it must be to shed your past self and go outside and scream with all your friends by now you ve probably heard these iconic redeyed winged creatures singing or screaming across the midwest and may be wondering why are they here why are there so many of them we ve got answers this year s cicada emergence is 200 years in the making two broods of cicadas are emerging at the same time since 1803 13year periodical cicadas and 17year periodical cicadas learn about what to expect for this onceinalifetime emergence with the link in our bio charles larry
Posts_nature_org_18_Apr_2024_17_Apr_2025_7883_CLEANED_195.jpeg,So long March! Were cha-cha sliding into April like a Verreauxs Sifaka. This endangered lemur native to Madagascar is known for its graceful sideways leap   with arms held out to the side for balance   when it moves along the forest floor. Tell us in the comments what spring activities you are jumping in to! ___   Nick Garbutt/NPL/Minden Pictures,so long march were chacha sliding into april like a verreauxs sifaka this endangered lemur native to madagascar is known for its graceful sideways leap with arms held out to the side for balance when it moves along the forest floor tell us in the comments what spring activities you are jumping in to ___ nick garbuttnplminden pictures
Posts_nature_org_18_Apr_2024_17_Apr_2025_7883_CLEANED_196.jpeg,Is somebody going to match their freak?? Hard to say. There are many strange species that lurk in the waters. Here are just a few of our favorites: Weighing up to 8800 lbs elephant seals are fighters who will defend their territories at all costs. The results can be loud bloody battles.  The cookie-cutter shark equipped with razor-sharp teeth chisels off chunks of flesh leaving craters on their prey. From other seals to whales these sharks don t let their small size stop them from snacking.   Sea cucumbers are vital ecosystem engineers who crawl across the seafloor vacuuming up sand and pooping it back out again. Their feeding activity helps distribute nutrients and remove excess organic matter from the water.   With their sinister grins and two sets of jaws moray eels can use their pharyngeal jaw to help ensnare prey and pull it into the eel s throat. Click the link in our bio to learn more or head to our Ocean story highlight to take a quiz on these strange species!  : 1. Wade Tregaskis/Flickr2. UBiology/Wikimedia Commons3. Budak/Flickr4. National Marine Sanctuaries/Wikimedia Commons,is somebody going to match their freak hard to say there are many strange species that lurk in the waters here are just a few of our favorites weighing up to 8800 lbs elephant seals are fighters who will defend their territories at all costs the results can be loud bloody battles the cookiecutter shark equipped with razorsharp teeth chisels off chunks of flesh leaving craters on their prey from other seals to whales these sharks don t let their small size stop them from snacking sea cucumbers are vital ecosystem engineers who crawl across the seafloor vacuuming up sand and pooping it back out again their feeding activity helps distribute nutrients and remove excess organic matter from the water with their sinister grins and two sets of jaws moray eels can use their pharyngeal jaw to help ensnare prey and pull it into the eel s throat click the link in our bio to learn more or head to our ocean story highlight to take a quiz on these strange species 1 wade tregaskisflickr2 ubiologywikimedia commons3 budakflickr4 national marine sanctuarieswikimedia commons
Posts_nature_org_18_Apr_2024_17_Apr_2025_7883_CLEANED_197.jpeg,When you think of  elk country  you might picture remote mountain habitats. But elk once roamed all over North America before relentless hunting pushed them into these areas. Now elk in Tennessee are proof of dramatic conservation efforts with The Nature Conservancy playing a key role in their thriving comeback.  Learn more with the link in our bio.,when you think of elk country you might picture remote mountain habitats but elk once roamed all over north america before relentless hunting pushed them into these areas now elk in tennessee are proof of dramatic conservation efforts with the nature conservancy playing a key role in their thriving comeback learn more with the link in our bio
Posts_nature_org_18_Apr_2024_17_Apr_2025_7883_CLEANED_198.jpeg,Lasting sustainability starts with the steps you take every day. Small changes can create a chain reaction of positive effects for our planet. Here are some easy ways to celebrate the Earth in your everyday life:  Visit a nature preserve near you Take an action pledge  Volunteer with us  Attend an event to connect with fellow nature lovers Learn more with the link in our bio!  : 1. Alistair Berg2. Nina Ritchie/TNC Photo Contest 20213. Alistair Berg4. Rahmad Himawan/TNC Photo Contest 20235. R.J. Hinkle,lasting sustainability starts with the steps you take every day small changes can create a chain reaction of positive effects for our planet here are some easy ways to celebrate the earth in your everyday life visit a nature preserve near you take an action pledge volunteer with us attend an event to connect with fellow nature lovers learn more with the link in our bio 1 alistair berg2 nina ritchietnc photo contest 20213 alistair berg4 rahmad himawantnc photo contest 20235 rj hinkle
Posts_nature_org_18_Apr_2024_17_Apr_2025_7883_CLEANED_199.jpeg,Spot CheckFor years Nature Conservancy partner Panthera has been placing tracking collars on cheetahs and other big cats in Zambias Kafue National Park and the game management areas that surround it. The data is used to monitor population dynamics and prevent human wildlife conflict in community areas.In 2022 TNC teamed up with Panthera to expand their collaring efforts. Across the Kafue ecosystem TNC is working to halt poaching prevent habitat loss as well as empower communities to protect wildlife and effectively manage their lands. By keeping tabs on the health of carnivore populations conservationists can learn how the animals respond to different protection efforts across the landscape. And data suggest that they are proving successful: Recently one collared cheetah safely traveled about 700 miles over eight months.    Kirsten Weir   Wim van den Heever/NPL/Minden Pictures,spot checkfor years nature conservancy partner panthera has been placing tracking collars on cheetahs and other big cats in zambias kafue national park and the game management areas that surround it the data is used to monitor population dynamics and prevent human wildlife conflict in community areasin 2022 tnc teamed up with panthera to expand their collaring efforts across the kafue ecosystem tnc is working to halt poaching prevent habitat loss as well as empower communities to protect wildlife and effectively manage their lands by keeping tabs on the health of carnivore populations conservationists can learn how the animals respond to different protection efforts across the landscape and data suggest that they are proving successful recently one collared cheetah safely traveled about 700 miles over eight months kirsten weir wim van den heevernplminden pictures
Posts_nature_org_18_Apr_2024_17_Apr_2025_7883_CLEANED_200.jpeg,Biodiversity is critical to our futures. It needs our help and hope.,biodiversity is critical to our futures it needs our help and hope
Posts_nature_org_18_Apr_2024_17_Apr_2025_7883_CLEANED_201.jpeg,Scare-worthy species can sometimes get a bad rep but now is their time to shine,scareworthy species can sometimes get a bad rep but now is their time to shine
Posts_nature_org_18_Apr_2024_17_Apr_2025_7883_CLEANED_202.jpeg,Take a breath. Eat some food. Dance in the rain. Thank the ocean.   nature.org/ocean,take a breath eat some food dance in the rain thank the ocean natureorgocean
Posts_nature_org_18_Apr_2024_17_Apr_2025_7883_CLEANED_203.jpeg,Can you guess what you re looking at? Comment your guess below then swipe to discover a rare swimming surprise. Spoilers ahead.....Photographer Lawrence Alex Wu was diving in the Maldives when he noticed something floating in midwater. He stumbled upon something he had only ever heard about - a swimming anemone! Usually theyre rooted to the ocean floors but they can dislodge themselves to relocate in search of better feeding pastures or if they are being preyed on by starfish all in the name of survival. He followed the anemone until capturing this brilliant shot! : Lawrence Alex Wu/TNC Photo Contest 2021,can you guess what you re looking at comment your guess below then swipe to discover a rare swimming surprise spoilers aheadphotographer lawrence alex wu was diving in the maldives when he noticed something floating in midwater he stumbled upon something he had only ever heard about a swimming anemone usually theyre rooted to the ocean floors but they can dislodge themselves to relocate in search of better feeding pastures or if they are being preyed on by starfish all in the name of survival he followed the anemone until capturing this brilliant shot lawrence alex wutnc photo contest 2021
Posts_nature_org_18_Apr_2024_17_Apr_2025_7883_CLEANED_204.jpeg,Mindful scroll break to ponder with some plants,mindful scroll break to ponder with some plants
