Image Filename,Caption,Cleaned Caption
Posts_nature_org_18_Apr_2024_17_Apr_2025_7883_CLEANED_43.jpeg,The 2024 Oceania Photo Contest received nearly 2000 breathtaking entries from talented photographers across the Oceania region. Each image across every category showcased not only technical expertise but also a profound understanding of storytelling capturing moments that truly make us stop and think.Among the stunning submissions the grand prize winner is in the water category: Pot-bellied Seahorse Portrait by Daniel Sly. Here are the first prize winners in each category:People and Nature: Salmon Surfer by Duncan Macfarlane AustraliaPlants and Fungi: Beneath the Glow by Crystal Richardson New ZealandLands: Where There s Smoke by Michael S. Marting AustraliaClimate: Ice Falls by Scott Portelli AustraliaWildlife: Roar of Anger by Xiaoping Lin AustraliaClick the link in our bio to see more incredible winning photographs.,the 2024 oceania photo contest received nearly 2000 breathtaking entries from talented photographers across the oceania region each image across every category showcased not only technical expertise but also a profound understanding of storytelling capturing moments that truly make us stop and thinkamong the stunning submissions the grand prize winner is in the water category potbellied seahorse portrait by daniel sly here are the first prize winners in each categorypeople and nature salmon surfer by duncan macfarlane australiaplants and fungi beneath the glow by crystal richardson new zealandlands where there s smoke by michael s marting australiaclimate ice falls by scott portelli australiawildlife roar of anger by xiaoping lin australiaclick the link in our bio to see more incredible winning photographs
Posts_nature_org_18_Apr_2024_17_Apr_2025_7883_CLEANED_44.jpeg,Orange BlossomCalifornia poppies stretch skyward in full springtime bloom along the hillsides surrounding Riverside County s Lake Elsinore. Designated as the state flower in 1903 the sunloving poppies grow across California inhabiting grasslands dry plains coastal prairies and even dunes and the open slopes of redwood forests. Some years after consistent winter rains the poppies join other native wildflowers in a superbloom bathing the landscape in brilliant colors at preserves and parks statewide.  Has spring sprung where you live? ___   Tim Fitzharris/Minden Pictures,orange blossomcalifornia poppies stretch skyward in full springtime bloom along the hillsides surrounding riverside county s lake elsinore designated as the state flower in 1903 the sunloving poppies grow across california inhabiting grasslands dry plains coastal prairies and even dunes and the open slopes of redwood forests some years after consistent winter rains the poppies join other native wildflowers in a superbloom bathing the landscape in brilliant colors at preserves and parks statewide has spring sprung where you live ___ tim fitzharrisminden pictures
Posts_nature_org_18_Apr_2024_17_Apr_2025_7883_CLEANED_45.jpeg,Michelle didn t have a lot of exposure to nature as a child. Now she works at our North Carolina office (tnc_nc) with some of the rarest plant species on Earth and she s harnessing the power of fire to protect them. What was your experience with nature as a child? How did it change as you grew up? : Mikhaila Markham / TNC,michelle didn t have a lot of exposure to nature as a child now she works at our north carolina office tnc_nc with some of the rarest plant species on earth and she s harnessing the power of fire to protect them what was your experience with nature as a child how did it change as you grew up mikhaila markham tnc
Posts_nature_org_18_Apr_2024_17_Apr_2025_7883_CLEANED_46.jpeg,Backyard birding truly shines when snow blankets the ground and flocks of wintering species arrive for sunflower seeds and suet. That s why weve curated a collection of stories to enhance your winter birding experience. Whether youre looking to identify common species at your feeder spot a rare winter bird or contribute to conservation efforts youll find it all in one place. Check out the link in our bio to see for yourself! : 1. Jocelyn Praud /TNC Photo Contest 20192. Cindy Kassab /TNC Photo Contest 20193. Mark Archibald/TNC Photo Contest 20214. TNC5. Oliver Starks,backyard birding truly shines when snow blankets the ground and flocks of wintering species arrive for sunflower seeds and suet that s why weve curated a collection of stories to enhance your winter birding experience whether youre looking to identify common species at your feeder spot a rare winter bird or contribute to conservation efforts youll find it all in one place check out the link in our bio to see for yourself 1 jocelyn praud tnc photo contest 20192 cindy kassab tnc photo contest 20193 mark archibaldtnc photo contest 20214 tnc5 oliver starks
Posts_nature_org_18_Apr_2024_17_Apr_2025_7883_CLEANED_47.jpeg,Leaf your worries behind. At least for 60 minutes.     : Rahmad Himawan/TNC Photo Contest 2023 rahmadhimawan_photography,leaf your worries behind at least for 60 minutes rahmad himawantnc photo contest 2023 rahmadhimawan_photography
Posts_nature_org_18_Apr_2024_17_Apr_2025_7883_CLEANED_48.jpeg,Wishing a Happy National Bird Day to all who celebrate!  1. Nick Dale/TNC Photo Contest 2021 [surprised secretary bird]2. Brian Magnier/TNC Photo Contest 2019 [snowy egret]3. Fl via Fernanda Ribeiro/TNC Photo Contest 2021 [toucan]4. Loren Merrill/TNC Photo Contest 2022 [snowy owl in flight]5. Cedric Favero/TNC Photo Contest 2019 [penguin party]6. Amy A. Hallman [bald eagle in flight]7. Jenifer Selwa/TNC Photo Contest 2023 [cozy common loons]8. Fung suk yee/TNC Photo Contest 2023 [lilac breasted roller]9. Jian Zheng/TNC Photo Contest 2021 [common tern chicks]10. Jason Jablonski/TNC Photo Contest 2018 [yellow rumped warbler reflection],wishing a happy national bird day to all who celebrate 1 nick daletnc photo contest 2021 surprised secretary bird2 brian magniertnc photo contest 2019 snowy egret3 fl via fernanda ribeirotnc photo contest 2021 toucan4 loren merrilltnc photo contest 2022 snowy owl in flight5 cedric faverotnc photo contest 2019 penguin party6 amy a hallman bald eagle in flight7 jenifer selwatnc photo contest 2023 cozy common loons8 fung suk yeetnc photo contest 2023 lilac breasted roller9 jian zhengtnc photo contest 2021 common tern chicks10 jason jablonskitnc photo contest 2018 yellow rumped warbler reflection
Posts_nature_org_18_Apr_2024_17_Apr_2025_7883_CLEANED_49.jpeg,From the depths of our oceans to the heights of ancient forests our planet is a vibrant tapestry of life. Each ecosystem from bustling coral reefs to lush grasslands plays a crucial role. Let s celebrate the incredible variety of life on Earth!  : 1. Lisa Skelton/TNC Photo Contest 2019 (lisaskeltonphotography)2. Jordan McLeland/TNC Photo Contest 20233. Chandel Draine/TNC Photo Contest 20194. Andrew Hunter /TNC Photo Contest 20195. Jon McCormack6. Francois Wolfaardt/TNC Photo Contest 20197. Nick Hall8. Jason Curtius /TNC Photo Contest 20199. Andrea Kappler/TNC Photo Contest 201610. Karine Aigner,from the depths of our oceans to the heights of ancient forests our planet is a vibrant tapestry of life each ecosystem from bustling coral reefs to lush grasslands plays a crucial role let s celebrate the incredible variety of life on earth 1 lisa skeltontnc photo contest 2019 lisaskeltonphotography2 jordan mclelandtnc photo contest 20233 chandel drainetnc photo contest 20194 andrew hunter tnc photo contest 20195 jon mccormack6 francois wolfaardttnc photo contest 20197 nick hall8 jason curtius tnc photo contest 20199 andrea kapplertnc photo contest 201610 karine aigner
Posts_nature_org_18_Apr_2024_17_Apr_2025_7883_CLEANED_50.jpeg,Longer and brighter days ahead (soon enough it won t get dark at 5pm)   Setting good intentions (because we all need a fresh start)   Rebirth and renewal (like a phoenix rising... or just us after a long nap)Happy Winter Solstice to all who celebrate!  [Image description: Snowfall in Taganay National Park Russia]  : Dmitriy Kochergin/TNC Photo Contest 2021 (kochergin.photographer),longer and brighter days ahead soon enough it won t get dark at 5pm setting good intentions because we all need a fresh start rebirth and renewal like a phoenix rising or just us after a long naphappy winter solstice to all who celebrate image description snowfall in taganay national park russia dmitriy kochergintnc photo contest 2021 kocherginphotographer
Posts_nature_org_18_Apr_2024_17_Apr_2025_7883_CLEANED_51.jpeg,Not a cell phone in sight. Just three homies living in the moment. : Giuseppe Bonali /TNC Photo Contest 2019,not a cell phone in sight just three homies living in the moment giuseppe bonali tnc photo contest 2019
Posts_nature_org_18_Apr_2024_17_Apr_2025_7883_CLEANED_52.jpeg,Lions Tigers and Bears   oh my! Every year more scientists warn that the world stands on the edge of a major biodiversity crash brought on by a mix of climate change and habitat loss. But large-scale biodiversity loss is not inevitable argues David Banks (muddyriverbanks) TNC s chief conservation officer if we can quickly mobilize global efforts to protect 30% of lands and waters around the world by 2030.   Let s celebrate   and save   the tapestry of life on this Earth. Tap the link in our bio to read the feature story in the latest issue of Nature Conservancy magazine.  :Monarch butterflies: jaimerojoLion cubs: michaelnicknicholsReef manta ray: Fred Bavendam/Minden Pictures Andean condors: Nick Garbutt/Nature Picture LibraryElkhorn coral: Shane Gross/NPL/Minden Pictures Pygmy rabbit: moheim,lions tigers and bears oh my every year more scientists warn that the world stands on the edge of a major biodiversity crash brought on by a mix of climate change and habitat loss but largescale biodiversity loss is not inevitable argues david banks muddyriverbanks tnc s chief conservation officer if we can quickly mobilize global efforts to protect 30 of lands and waters around the world by 2030 let s celebrate and save the tapestry of life on this earth tap the link in our bio to read the feature story in the latest issue of nature conservancy magazine monarch butterflies jaimerojolion cubs michaelnicknicholsreef manta ray fred bavendamminden pictures andean condors nick garbuttnature picture libraryelkhorn coral shane grossnplminden pictures pygmy rabbit moheim
Posts_nature_org_18_Apr_2024_17_Apr_2025_7883_CLEANED_53.jpeg,unbothered. moisturized. happy. in my lane. focused. flourishing.  : Kevin Wells/TNC Photo Contest 2019,unbothered moisturized happy in my lane focused flourishing kevin wellstnc photo contest 2019
Posts_nature_org_18_Apr_2024_17_Apr_2025_7883_CLEANED_54.jpeg,Regardless of your proximity to the coast your life is intricately connected to the ocean. Swipe to learn more about the ocean s influence on your daily life   and why we must protect it.  Check the link in our bio to diver deeper into our ocean conservation work.  : 1. Ian Shive 2. Giovani Cordioli TNC Photo Contest 2019 3. Jennifer Adler 4. Giovanni Allievi TNC Photo Contest 2023 5. Jamie Landers TNC Photo Contest 2021 6. Annette Ruzicka 7. George Steinmetz 8. 2018 fokke baarssen/Shutterstock 9. Jason Houston 10. Carla Santana Torres TNC Photo Contest 2019,regardless of your proximity to the coast your life is intricately connected to the ocean swipe to learn more about the ocean s influence on your daily life and why we must protect it check the link in our bio to diver deeper into our ocean conservation work 1 ian shive 2 giovani cordioli tnc photo contest 2019 3 jennifer adler 4 giovanni allievi tnc photo contest 2023 5 jamie landers tnc photo contest 2021 6 annette ruzicka 7 george steinmetz 8 2018 fokke baarssenshutterstock 9 jason houston 10 carla santana torres tnc photo contest 2019
Posts_nature_org_18_Apr_2024_17_Apr_2025_7883_CLEANED_55.jpeg,Where does a river begin? Part of the headwaters of Michigans longest river the Grand start on land protected by The Nature Conservancy.  At Grand River Fen Preserve youll find rare oak savannas bog bluegrass and native butterflies. The surrounding forest filters water trickling into the river which then flows into Lake Michigan. Keeping these forests and surrounding habitats healthy keeps these waters clean. tncmichigan All photos:   Jason Whalen,where does a river begin part of the headwaters of michigans longest river the grand start on land protected by the nature conservancy at grand river fen preserve youll find rare oak savannas bog bluegrass and native butterflies the surrounding forest filters water trickling into the river which then flows into lake michigan keeping these forests and surrounding habitats healthy keeps these waters clean tncmichigan all photos jason whalen
Posts_nature_org_18_Apr_2024_17_Apr_2025_7883_CLEANED_56.jpeg,Africas biodiversity is unmatched with unique life forms that evolved on the continent. Some species are endemic while others have diversified into a multitude of forms each playing a crucial role in their ecosystems. Here are just a few examples of the amazing animals in Africa:African Bush Elephant: These giants roam the savannas and deserts of sub-Saharan Africa and can live up to 70 years- longer than any other mammal except humans.Lemur: Native to Madagascar lemurs are vital to the islands ecosystem aiding in plant pollination and seed dispersal. Unfortunately nearly all lemur species are endangered with about one-third critically endangered.Blue Whale: Once nearly extinct due to commercial whaling blue whales now have a population of 5000-15000. Recently theyve been spotted around the Seychelles a former whaling hotspot thanks to increased marine protection efforts.These fascinating creatures are just a glimpse of Africas rich wildlife. Discover more by reading the full story linked in our bio! : 1. Esteban Frey/TNC Photo Contest 2023 (stebanfrey)2.     / TNC Photo Contest 20193. Fernando OFarrill/TNC Photo Contest 2022,africas biodiversity is unmatched with unique life forms that evolved on the continent some species are endemic while others have diversified into a multitude of forms each playing a crucial role in their ecosystems here are just a few examples of the amazing animals in africaafrican bush elephant these giants roam the savannas and deserts of subsaharan africa and can live up to 70 years longer than any other mammal except humanslemur native to madagascar lemurs are vital to the islands ecosystem aiding in plant pollination and seed dispersal unfortunately nearly all lemur species are endangered with about onethird critically endangeredblue whale once nearly extinct due to commercial whaling blue whales now have a population of 500015000 recently theyve been spotted around the seychelles a former whaling hotspot thanks to increased marine protection effortsthese fascinating creatures are just a glimpse of africas rich wildlife discover more by reading the full story linked in our bio 1 esteban freytnc photo contest 2023 stebanfrey2 tnc photo contest 20193 fernando ofarrilltnc photo contest 2022
Posts_nature_org_18_Apr_2024_17_Apr_2025_7883_CLEANED_57.jpeg,Its not often professional photographers find something theyve never captured on camera before. That was the case for Michael George who photographed these glowing rocks on the shores of Lake Superior on a trip to cover a newly conserved landscape on Michigans Upper Peninsula. Laced with a mineral that glows under ultraviolet light the syenite rocks look normal in daylight making each ones glow a surprise. See more of Georges photography of the rocks and their newly conserved Michigan landscape at the link in our bio.   michaelgeorge,its not often professional photographers find something theyve never captured on camera before that was the case for michael george who photographed these glowing rocks on the shores of lake superior on a trip to cover a newly conserved landscape on michigans upper peninsula laced with a mineral that glows under ultraviolet light the syenite rocks look normal in daylight making each ones glow a surprise see more of georges photography of the rocks and their newly conserved michigan landscape at the link in our bio michaelgeorge
Posts_nature_org_18_Apr_2024_17_Apr_2025_7883_CLEANED_58.jpeg,Unbe-leaf-able.   Happy first day of fall from the Northern Hemisphere! These colorful leaves are found on lands TNC helps protect. Explore our map of preserves to find some beautiful views near you. Link in bio!  :1. Vickie Bunnell Preserve New Hampshire: Darrell Bodnar2. Nags Head Woods Preserve North Carolina: Ben Herndon 3. Ramsey Canyon Preserve Arizona: Sandy & Betsy Kunzer 4. Bad Branch State Nature Preserve Kentucky: Devan King/TNC,unbeleafable happy first day of fall from the northern hemisphere these colorful leaves are found on lands tnc helps protect explore our map of preserves to find some beautiful views near you link in bio 1 vickie bunnell preserve new hampshire darrell bodnar2 nags head woods preserve north carolina ben herndon 3 ramsey canyon preserve arizona sandy betsy kunzer 4 bad branch state nature preserve kentucky devan kingtnc
Posts_nature_org_18_Apr_2024_17_Apr_2025_7883_CLEANED_59.jpeg,These aren t the usual flying suspects!  1. Donna Feledichuk/TNC Photo Contest 2023 donnafeledichukphotographer 2.  Jodie Lowe/TNC Photo Contest 2023 jodie_lowe88 3. Vikas Bhatia/TNC Photo Contest 2023 vikaswildlife 4. Estebane Rezkallah/TNC Photo Contest 2023 panchovilaaa 5. Vikrant Deshpande/TNC Photo Contest 2023 vik.d_wildlife 6. David Garcia Malo/TNC Photo Contest 2023 david.g.malo,these aren t the usual flying suspects 1 donna feledichuktnc photo contest 2023 donnafeledichukphotographer 2 jodie lowetnc photo contest 2023 jodie_lowe88 3 vikas bhatiatnc photo contest 2023 vikaswildlife 4 estebane rezkallahtnc photo contest 2023 panchovilaaa 5 vikrant deshpandetnc photo contest 2023 vikd_wildlife 6 david garcia malotnc photo contest 2023 davidgmalo
Posts_nature_org_18_Apr_2024_17_Apr_2025_7883_CLEANED_60.jpeg,Florida panther friend or foe? If youre a farmer dealing with feral pigs panthers are an unlikely ally.Invasive hogs are best managed naturally by their predators but with only around 200 panthers left in Florida due to rapid development and road expansion their numbers are dwindling. The U.S. Farm Bill was a win-win for farmer George Winslow helping him place a conservation easement on his citrus farm. This not only protects his land from future development but also creates a wildlife corridor linking panther breeding grounds and habitats.Florida panthers rely on this network of protected lands to hunt and breed using these areas as safe pathways and sources of food and water. This partnership between landowners governments and nature symbolizes the collaboration needed to protect our lands and waters. :1. Mark Conlin courtesy of Tallahassee Natural History Museum2-5. Brian Tietz Photography Inc.,florida panther friend or foe if youre a farmer dealing with feral pigs panthers are an unlikely allyinvasive hogs are best managed naturally by their predators but with only around 200 panthers left in florida due to rapid development and road expansion their numbers are dwindling the us farm bill was a winwin for farmer george winslow helping him place a conservation easement on his citrus farm this not only protects his land from future development but also creates a wildlife corridor linking panther breeding grounds and habitatsflorida panthers rely on this network of protected lands to hunt and breed using these areas as safe pathways and sources of food and water this partnership between landowners governments and nature symbolizes the collaboration needed to protect our lands and waters 1 mark conlin courtesy of tallahassee natural history museum25 brian tietz photography inc
Posts_nature_org_18_Apr_2024_17_Apr_2025_7883_CLEANED_61.jpeg,Underneath the blue surface of our oceans lies a complex and beautiful world of life and color. That s why we re thrilled to be teaming up with tiffanyandco on the  Love For Our Oceans  initiative to help conserve oceans around the world for all those who rely on them. For each T Smile by Tiffany cord bracelet sold in participating locations either USD 100 or 200 depending on the piece selected will be given to TNC to support its ocean conservation efforts and goal of conserving 4 billion hectares of ocean by 2030.Click the link in our bio to learn more!  : 1. Tory Chase2. Jordan Robins /TNC Photo Contest 20193. Scott Portelli/TNC Photo Contest 20214. Y.M. Michael FUNG/TNC Photo Contest 20185. Zach Stadler/TNC Photo Contest 2018,underneath the blue surface of our oceans lies a complex and beautiful world of life and color that s why we re thrilled to be teaming up with tiffanyandco on the love for our oceans initiative to help conserve oceans around the world for all those who rely on them for each t smile by tiffany cord bracelet sold in participating locations either usd 100 or 200 depending on the piece selected will be given to tnc to support its ocean conservation efforts and goal of conserving 4 billion hectares of ocean by 2030click the link in our bio to learn more 1 tory chase2 jordan robins tnc photo contest 20193 scott portellitnc photo contest 20214 ym michael fungtnc photo contest 20185 zach stadlertnc photo contest 2018
Posts_nature_org_18_Apr_2024_17_Apr_2025_7883_CLEANED_62.jpeg,Caught on camera trap! Our planet is home to so many beautiful species. The Nature Conservancys nature preserves and reserves host a variety of them. Spot them from a camera trap or see for yourself in person.   : Tiger India: Mayuresh Hendre/TNC Photo Contest 2022 (mayuresh_hendre_photography) Columbia Basin Pygmy Rabbit Washington: Morgan Heim Bison Oklahoma: Morgan Heim Bobcat Minnesota: Ryan Pennesi/TNC Photo Contest 2018,caught on camera trap our planet is home to so many beautiful species the nature conservancys nature preserves and reserves host a variety of them spot them from a camera trap or see for yourself in person tiger india mayuresh hendretnc photo contest 2022 mayuresh_hendre_photography columbia basin pygmy rabbit washington morgan heim bison oklahoma morgan heim bobcat minnesota ryan pennesitnc photo contest 2018
Posts_nature_org_18_Apr_2024_17_Apr_2025_7883_CLEANED_63.jpeg,When I received the news of my win I was completely stunned. I couldn t wait to share the excitement with my family. Their reactions were priceless and seeing the pride and happiness in their eyes made the moment even more special. 19-year-old student and amateur wildlife photographer Hanain Ayub (hanain1_) won a three-day trip to Loisaba Conservancy for his winning  People s Choice  image in nature_africa s regional photo contest. With support from TNC and other partners loisaba_conservancy is a sanctuary for over 250 bird species and 50 species of mammals. Hanain and his dad were impressed and inspired by Loisaba s  passion and care  for the area demonstrated by the anti-poaching units community engagement programs sustainable land management advanced monitoring systems and more. His images capture the essence of this remarkable sanctuary with its vibrant wildlife and stunning landscapes.,when i received the news of my win i was completely stunned i couldn t wait to share the excitement with my family their reactions were priceless and seeing the pride and happiness in their eyes made the moment even more special 19yearold student and amateur wildlife photographer hanain ayub hanain1_ won a threeday trip to loisaba conservancy for his winning people s choice image in nature_africa s regional photo contest with support from tnc and other partners loisaba_conservancy is a sanctuary for over 250 bird species and 50 species of mammals hanain and his dad were impressed and inspired by loisaba s passion and care for the area demonstrated by the antipoaching units community engagement programs sustainable land management advanced monitoring systems and more his images capture the essence of this remarkable sanctuary with its vibrant wildlife and stunning landscapes
Posts_nature_org_18_Apr_2024_17_Apr_2025_7883_CLEANED_64.jpeg,Sneak PeekThe bright citron body of the gold dust day gecko is designed to blend into the tropical vegetation of its native Madagascar. Though the reptile can also be found in Florida Hawai i and other Pacific islands you may have spotted one closer to home on your television screen as the British accented mascot for an insurance company. In the wild the gecko is less cheerful than its animated counterpart: Males can be aggressive and may rumble when territory is in question.    Craig Weakley/Tandem Stock,sneak peekthe bright citron body of the gold dust day gecko is designed to blend into the tropical vegetation of its native madagascar though the reptile can also be found in florida hawai i and other pacific islands you may have spotted one closer to home on your television screen as the british accented mascot for an insurance company in the wild the gecko is less cheerful than its animated counterpart males can be aggressive and may rumble when territory is in question craig weakleytandem stock
