Image Filename,Caption,Cleaned Caption
Posts_nature_org_18_Apr_2024_17_Apr_2025_7883_CLEANED_108.jpeg,Time to play spot the difference.   Believe it or not the Appalachians and Scottish Highlands were once the same mountain range   the Central Pangea Mountains. Today they re separated by the Atlantic Ocean and millions of years. Despite that they sure look similar. Guess which photos are which! TNC s stewards land in the Appalachians including the Warm Springs Mountain Preserve in Virginia. The mountain is home to the state s only substantial montane pine barren   a globally rare landscape. Did you guess correctly?   1. Scotland: Pawel Zygmunt/TNC Photo Contest 2021 2. Appalachians: Joshua Weigand/TNC Photo Contest 2021 3. Appalachians: Kent Mason 4. Scotland: Julien Serarre/TNC Photo Contest 2022 5. Appalachians: Kent Mason 6. Scotland: Ildemar Kanitz/TNC Photo Contest 2019,time to play spot the difference believe it or not the appalachians and scottish highlands were once the same mountain range the central pangea mountains today they re separated by the atlantic ocean and millions of years despite that they sure look similar guess which photos are which tnc s stewards land in the appalachians including the warm springs mountain preserve in virginia the mountain is home to the state s only substantial montane pine barren a globally rare landscape did you guess correctly 1 scotland pawel zygmunttnc photo contest 2021 2 appalachians joshua weigandtnc photo contest 2021 3 appalachians kent mason 4 scotland julien serarretnc photo contest 2022 5 appalachians kent mason 6 scotland ildemar kanitztnc photo contest 2019
Posts_nature_org_18_Apr_2024_17_Apr_2025_7883_CLEANED_109.jpeg,Makin  my way downtownWalkin  fastFaces passAnd Im poll bound.    You can help decide our future this November (and beyond)! Visit the link in our bio to learn more.  : Falkland Islands. Thomas Chadwick/TNC Photo Contest 2018,makin my way downtownwalkin fastfaces passand im poll bound you can help decide our future this november and beyond visit the link in our bio to learn more falkland islands thomas chadwicktnc photo contest 2018
Posts_nature_org_18_Apr_2024_17_Apr_2025_7883_CLEANED_110.jpeg,A sea of fireflies lighting up the Great Smokey Mountains : chasingbugs1,a sea of fireflies lighting up the great smokey mountains chasingbugs1
Posts_nature_org_18_Apr_2024_17_Apr_2025_7883_CLEANED_111.jpeg,Protect it so it exists outside of a library.,protect it so it exists outside of a library
Posts_nature_org_18_Apr_2024_17_Apr_2025_7883_CLEANED_112.jpeg,Happy National Pollinator Week!  When we talk about pollinators the usual suspects like bees butterflies and birds often steal the limelight. But did you know there are some unsung heroes in the pollination process?From industrious spiders and formidable wasps to unassuming beetles and humble flies these lesser-known pollinators play a vital role in sustaining the health and diversity of nearly every ecosystem on our planet! Click the link in our bio to learn more!  1. peppered jumping spider: chasingbugs12. snowberry clearwing moth:  redheadphotography50 3. hoverflies: chasingbugs14. paper wasp: Chris Helzer5. soldier beetle: Chris Helzer,happy national pollinator week when we talk about pollinators the usual suspects like bees butterflies and birds often steal the limelight but did you know there are some unsung heroes in the pollination processfrom industrious spiders and formidable wasps to unassuming beetles and humble flies these lesserknown pollinators play a vital role in sustaining the health and diversity of nearly every ecosystem on our planet click the link in our bio to learn more 1 peppered jumping spider chasingbugs12 snowberry clearwing moth redheadphotography50 3 hoverflies chasingbugs14 paper wasp chris helzer5 soldier beetle chris helzer
Posts_nature_org_18_Apr_2024_17_Apr_2025_7883_CLEANED_113.jpeg,Name a harder-working team than forests. (Well wait)   From filtering our air to cleaning our water they re doing the most to protect our planet. But right now forests need our help! Visit the link in our bio to learn how were working to protect these absolute icons.,name a harderworking team than forests well wait from filtering our air to cleaning our water they re doing the most to protect our planet but right now forests need our help visit the link in our bio to learn how were working to protect these absolute icons
Posts_nature_org_18_Apr_2024_17_Apr_2025_7883_CLEANED_114.jpeg,Reach for the Stars  BIG news! A landmark agreement will protect New Yorks historic Follensby Pond. In 1858 essayist and poet Ralph Waldo Emerson attended a  Philosophers  Camp  at Follensby Pond in upstate New York s Adirondack Mountains initiating discussions that sparked the modern conservation movement. Now 14600 acres including the pond and forest will be protected in perpetuity through an agreement by The Nature Conservancy and New York State. One of the conservation easements establishes a freshwater research preserve to study the pond among the most climate-resilient trout lakes in the Northeast due to its depth and the surrounding forest. It also ensures Indigenous Nations can access their ancestral lands for ceremonies and gathering.Traditional knowledge of the human-nature connection long predates the Philosophers  conversations says TNC s Adirondack Director Peg Olsen. By linking traditional ecological knowledge with Western research on climate resilience she adds  we can create a new story for Follensby going forward.   placidtimesphotography,reach for the stars big news a landmark agreement will protect new yorks historic follensby pond in 1858 essayist and poet ralph waldo emerson attended a philosophers camp at follensby pond in upstate new york s adirondack mountains initiating discussions that sparked the modern conservation movement now 14600 acres including the pond and forest will be protected in perpetuity through an agreement by the nature conservancy and new york state one of the conservation easements establishes a freshwater research preserve to study the pond among the most climateresilient trout lakes in the northeast due to its depth and the surrounding forest it also ensures indigenous nations can access their ancestral lands for ceremonies and gatheringtraditional knowledge of the humannature connection long predates the philosophers conversations says tnc s adirondack director peg olsen by linking traditional ecological knowledge with western research on climate resilience she adds we can create a new story for follensby going forward placidtimesphotography
Posts_nature_org_18_Apr_2024_17_Apr_2025_7883_CLEANED_115.jpeg,Comment below! We need some music recs,comment below we need some music recs
Posts_nature_org_18_Apr_2024_17_Apr_2025_7883_CLEANED_116.jpeg,Birds and Bees Known for its radiant plumage and aerial agility--it can snatch flying insects out of mid-air--the Asian green bee-eater is found in woodlands grasslands and wetlands throughout South Asia and the Middle East. When this skilled hunter uses its beak to snag prey it will bang the insect (it doesnt eat just bees) against its perch to dislodge a stinger before partaking. Farmers across its range have been known to set up perches to encouarge these brids to provide pest control for their fields.   What local bird would you welcome into your yard or outdoor space?    parthkansaraa,birds and bees known for its radiant plumage and aerial agilityit can snatch flying insects out of midairthe asian green beeeater is found in woodlands grasslands and wetlands throughout south asia and the middle east when this skilled hunter uses its beak to snag prey it will bang the insect it doesnt eat just bees against its perch to dislodge a stinger before partaking farmers across its range have been known to set up perches to encouarge these brids to provide pest control for their fields what local bird would you welcome into your yard or outdoor space parthkansaraa
Posts_nature_org_18_Apr_2024_17_Apr_2025_7883_CLEANED_117.jpeg,Looking for a pot of gold? Follow the rainbow and visit a place protected by TNC near you.  1. Debsconeag Lakes Wilderness Area Maine:   Josh Royte/TNC 2.  Broken Kettle Grasslands Preserve Iowa:   Chris Helzer 3. Beezley Hills Preserve Washington:   Cameron Karsten 4. Niobrara Valley Preserve Nebraska:   Chris Helzer,looking for a pot of gold follow the rainbow and visit a place protected by tnc near you 1 debsconeag lakes wilderness area maine josh roytetnc 2 broken kettle grasslands preserve iowa chris helzer 3 beezley hills preserve washington cameron karsten 4 niobrara valley preserve nebraska chris helzer
Posts_nature_org_18_Apr_2024_17_Apr_2025_7883_CLEANED_118.jpeg,Bringing some fun guys to your feed!  : 1. Mohammed Salman/TNC Photo Contest 20232. Barna Konyves/TNC Photo Contest 20233. Stephanie Wachnuk/TNC Photo Contest 2023 (groundedfocusphotos )4. Patrick Krohn/TNC Photo Contest 2023 (oneeyeddogstudios) 5. Himadri Bhuyan/TNC Photo Contest 2023,bringing some fun guys to your feed 1 mohammed salmantnc photo contest 20232 barna konyvestnc photo contest 20233 stephanie wachnuktnc photo contest 2023 groundedfocusphotos 4 patrick krohntnc photo contest 2023 oneeyeddogstudios 5 himadri bhuyantnc photo contest 2023
Posts_nature_org_18_Apr_2024_17_Apr_2025_7883_CLEANED_119.jpeg,TIP OFFA  shiver  of blacktip reef sharks laze in an Indian Ocean lagoon.Starting in the late 1900s countries around the world began prohibiting shark  finning  the practice of catching sharks slicing off their fins and dumping their (often still living) bodies back in the water. The fins were dried and sold to make soup. Despite a tenfold increase in protective regulations since 2000 a global analysis of shark mortality from fishing finds that these efforts have not been enough to curb the exploitation of sharks. The unsustainable fishing of sharks is a global problem of staggering proportions  says Darcy Bradley a lead ocean scientist for The Nature Conservancy in California. She co-authored the study published in Science which finds shark mortality increased from 76 million to 80 million sharks per year between 2012 and 2019 with more than 30% of these catches involving species threatened with extinction.  Most regulations were designed to prevent shark finning specifically not shark fi shing so they failed to reduce mortality overall  says Bradley.But there is some positive news: The study shows that in countries with shark sanctuaries like the Bahamas and the Maldives shark-fi shing mortality is relatively low likely allowing shark populations to recover and thrive.    thomaspeschak,tip offa shiver of blacktip reef sharks laze in an indian ocean lagoonstarting in the late 1900s countries around the world began prohibiting shark finning the practice of catching sharks slicing off their fins and dumping their often still living bodies back in the water the fins were dried and sold to make soup despite a tenfold increase in protective regulations since 2000 a global analysis of shark mortality from fishing finds that these efforts have not been enough to curb the exploitation of sharks the unsustainable fishing of sharks is a global problem of staggering proportions says darcy bradley a lead ocean scientist for the nature conservancy in california she coauthored the study published in science which finds shark mortality increased from 76 million to 80 million sharks per year between 2012 and 2019 with more than 30 of these catches involving species threatened with extinction most regulations were designed to prevent shark finning specifically not shark fi shing so they failed to reduce mortality overall says bradleybut there is some positive news the study shows that in countries with shark sanctuaries like the bahamas and the maldives sharkfi shing mortality is relatively low likely allowing shark populations to recover and thrive thomaspeschak
Posts_nature_org_18_Apr_2024_17_Apr_2025_7883_CLEANED_120.jpeg,Nature is like a hug for the soul. Share this with someone who needs a hug today.,nature is like a hug for the soul share this with someone who needs a hug today
Posts_nature_org_18_Apr_2024_17_Apr_2025_7883_CLEANED_121.jpeg,On the southern edge of Georgia alligators carnivorous plants softly draped Spanish moss and a proliferation of life and biodiversity crouch together in the largest blackwater swamp in America. Join Nature Conservancy magazine editor Eric Seeger on one of the loudest nights of his life as he and his son canoe through the swamps dark waters and examine what may be lost if a proposed mine opens on the edge of this refuge.   Tap the link in our bio to dive in.Drop a   in the comments if you would paddle through a dark swamp riddled with reptiles for views like this!   davidwalterbanks,on the southern edge of georgia alligators carnivorous plants softly draped spanish moss and a proliferation of life and biodiversity crouch together in the largest blackwater swamp in america join nature conservancy magazine editor eric seeger on one of the loudest nights of his life as he and his son canoe through the swamps dark waters and examine what may be lost if a proposed mine opens on the edge of this refuge tap the link in our bio to dive indrop a in the comments if you would paddle through a dark swamp riddled with reptiles for views like this davidwalterbanks
Posts_nature_org_18_Apr_2024_17_Apr_2025_7883_CLEANED_122.jpeg,High Stakes on the High PlainsSpanning 71 million acres across New Mexico Colorado Kansas Oklahoma and Texas an ecosystem known as the Southern High Plains is one of the world s most intact grasslands. Yet it is imperiled. Globally grasslands are the world s most threatened and least-protected ecosystems  says Galen Guerrero-Murphy director of the Southern High Plains Initiative for TNC. But a regional partnership known as the Southern High Plains Initiative aims to protect large connected landscapes to allow species to move and adapt to climate change while also preserving a way of life for local communities. Since 2020 the initiative has also helped conserve land by providing incentives to help ranchers and farmers invest in sustainable and regenerative practices. Those efforts are making an impact in the Southern High Plains and driving innovations that can be exported to grasslands everywhere.  These open spaces are integral to every facet of these communities  Guerrero-Murphy says.  We aren t going to limit our ambition to one polygon on the map.  slide 1:  Wolfe Repass/TNC Photo Contest 2019slide 2:  Brent Cavanaughslide 3:  Joel Jones,high stakes on the high plainsspanning 71 million acres across new mexico colorado kansas oklahoma and texas an ecosystem known as the southern high plains is one of the world s most intact grasslands yet it is imperiled globally grasslands are the world s most threatened and leastprotected ecosystems says galen guerreromurphy director of the southern high plains initiative for tnc but a regional partnership known as the southern high plains initiative aims to protect large connected landscapes to allow species to move and adapt to climate change while also preserving a way of life for local communities since 2020 the initiative has also helped conserve land by providing incentives to help ranchers and farmers invest in sustainable and regenerative practices those efforts are making an impact in the southern high plains and driving innovations that can be exported to grasslands everywhere these open spaces are integral to every facet of these communities guerreromurphy says we aren t going to limit our ambition to one polygon on the map slide 1 wolfe repasstnc photo contest 2019slide 2 brent cavanaughslide 3 joel jones
Posts_nature_org_18_Apr_2024_17_Apr_2025_7883_CLEANED_123.jpeg,Today we wish our wonderful community a joyful and reflective Thanksgiving. November is also Native American Heritage Month. We extend our deepest appreciation to Indigenous Peoples and traditional communities who have been the guardians of our planet for generations.Their wisdom and stewardship are invaluable. Thank you.  : 1. Linda Muth/TNC Photo Contest 20212. Jenny Qiu/TNC Photo Contest 20213. Andy Raupp/TNC Photo Contest 2023 (andy_raupp)4. Mark Godfrey/TNC5. Matthew Brown /TNC Photo Contest 2019,today we wish our wonderful community a joyful and reflective thanksgiving november is also native american heritage month we extend our deepest appreciation to indigenous peoples and traditional communities who have been the guardians of our planet for generationstheir wisdom and stewardship are invaluable thank you 1 linda muthtnc photo contest 20212 jenny qiutnc photo contest 20213 andy raupptnc photo contest 2023 andy_raupp4 mark godfreytnc5 matthew brown tnc photo contest 2019
Posts_nature_org_18_Apr_2024_17_Apr_2025_7883_CLEANED_124.jpeg,Me when someone says they vote.    : olimoorman,me when someone says they vote olimoorman
Posts_nature_org_18_Apr_2024_17_Apr_2025_7883_CLEANED_125.jpeg,More fun than a (blank) of what?! A group of squirrel monkeys can be referred to as a  barrel  a  tribe  a  troop  or a  cartload. Squirrel monkeys are just one of the 179 mammal species that have been recorded in the mountain range near Colombia s new Serran a de Manacac as National Park. The park which TNC assisted in creating protects 168000 acres of wetland savannas that connect the Andes Mountains with the Orinoco and Amazon rivers. The landscape also connects South America with North America through the many species of migratory birds that use this area as their temporary home. Tap the link in our bio to read the full feature story in Nature Conservancy magazines latest issue.    historiassencillas,more fun than a blank of what a group of squirrel monkeys can be referred to as a barrel a tribe a troop or a cartload squirrel monkeys are just one of the 179 mammal species that have been recorded in the mountain range near colombia s new serran a de manacac as national park the park which tnc assisted in creating protects 168000 acres of wetland savannas that connect the andes mountains with the orinoco and amazon rivers the landscape also connects south america with north america through the many species of migratory birds that use this area as their temporary home tap the link in our bio to read the full feature story in nature conservancy magazines latest issue historiassencillas
Posts_nature_org_18_Apr_2024_17_Apr_2025_7883_CLEANED_126.jpeg,Amphibians are facing immense challenges due to climate change and habitat destruction. But luckily there s hope! Communities are stepping up by building special crossings for these creatures to safely navigate highways and find spaces with optimal conditions.These faces never fail to brighten our days and with our collective efforts we can ensure they thrive for years to come.  Click the link in our bio to learn more about endangered amphibians.  : 1. Marshall Orduz /TNC Photo Contest 2019 (marshall_studios)2. Jorge Castro Urbiola/TNC Photo Contest 2023 (thesantogrial)3. Lucas Rosado Mendon a/TNC Photo Contest 2021 (rosado_lucas)4. Luis Alvarenga/TNC Photo Contest 2019 (luis_alvarenga_gallery),amphibians are facing immense challenges due to climate change and habitat destruction but luckily there s hope communities are stepping up by building special crossings for these creatures to safely navigate highways and find spaces with optimal conditionsthese faces never fail to brighten our days and with our collective efforts we can ensure they thrive for years to come click the link in our bio to learn more about endangered amphibians 1 marshall orduz tnc photo contest 2019 marshall_studios2 jorge castro urbiolatnc photo contest 2023 thesantogrial3 lucas rosado mendon atnc photo contest 2021 rosado_lucas4 luis alvarengatnc photo contest 2019 luis_alvarenga_gallery
Posts_nature_org_18_Apr_2024_17_Apr_2025_7883_CLEANED_127.jpeg,A landmark deal has just secured the protection of 32000 acres of forests on Michigans Keweenaw Peninsula! This narrow strip of land jutting out into the deep waters of Lake Superior is where kayaking fishing mountain biking and even northern lights viewing have long been a way of life. Now this land deal is giving residents a chance to protect the lands theyve enjoyed for generations.Tap the link in our bio to read the feature from Nature Conservancy magazines latest issue. : Amy Crawford : michaelgeorge,a landmark deal has just secured the protection of 32000 acres of forests on michigans keweenaw peninsula this narrow strip of land jutting out into the deep waters of lake superior is where kayaking fishing mountain biking and even northern lights viewing have long been a way of life now this land deal is giving residents a chance to protect the lands theyve enjoyed for generationstap the link in our bio to read the feature from nature conservancy magazines latest issue amy crawford michaelgeorge
Posts_nature_org_18_Apr_2024_17_Apr_2025_7883_CLEANED_128.jpeg,A historic moment for buffalo restoration! We re excited to share the launch of the Tribal Buffalo Lifeways Collaboration a partnership of the InterTribal Buffalo Council (itbc_buffalonation) Native Americans in Philanthropy (nativegiving) The Nature Conservancy and World Wildlife Fund (WWF). Together we ll create lasting change and return buffalo to Tribal lands at an unprecedented scale. Learn more with the link in our bio! : 1-2. Charles Larry3. Jason Whalen4. Hannah Floyd,a historic moment for buffalo restoration we re excited to share the launch of the tribal buffalo lifeways collaboration a partnership of the intertribal buffalo council itbc_buffalonation native americans in philanthropy nativegiving the nature conservancy and world wildlife fund wwf together we ll create lasting change and return buffalo to tribal lands at an unprecedented scale learn more with the link in our bio 12 charles larry3 jason whalen4 hannah floyd
Posts_nature_org_18_Apr_2024_17_Apr_2025_7883_CLEANED_129.jpeg,Science is our guidepost. That is why The Nature Conservancy will continue to honor the Paris Agreement goals to help protect the diversity of life on earth and stave off the worst impacts of climate change.We have years not decades to do this work. We will continue to make progress by:  Creating implementing and defending strong federal policies  Advancing smart state-level climate action policies  Partnering with businesses to help them accelerate clean energy  Investing in nature as a solutionThe U.S. can and should be a leader on climate. And TNC will do whatever we can to help the U.S. do its part. Please read our full statement with the link in our bio.  : Todd Ryburn Photography/Getty Images,science is our guidepost that is why the nature conservancy will continue to honor the paris agreement goals to help protect the diversity of life on earth and stave off the worst impacts of climate changewe have years not decades to do this work we will continue to make progress by creating implementing and defending strong federal policies advancing smart statelevel climate action policies partnering with businesses to help them accelerate clean energy investing in nature as a solutionthe us can and should be a leader on climate and tnc will do whatever we can to help the us do its part please read our full statement with the link in our bio todd ryburn photographygetty images
Posts_nature_org_18_Apr_2024_17_Apr_2025_7883_CLEANED_130.jpeg,Nature comes in all shapes and sizes.       Which one is your favorite?Circle: Zhiyu Shi/TNC Photo Contest 2021 Pine Tree stars: Kent Mason Zebra: Christine Haines/TNC Photo Contest 2019 Heart: Nicolas Job/TNC Photo Contest 2022 Long exposure stars: Vincent Otto/TNC Photo Contest 2019 Sea Stars on kelp: Liliana Calzada/TNC Photo Contest 2022 Striped marlin: Jono Allen/TNC Photo Contest 2022 Triangles: Henrique Murta/TNC Photo Contest 2019Striped lizard: Timothy Boucher/TNC,nature comes in all shapes and sizes which one is your favoritecircle zhiyu shitnc photo contest 2021 pine tree stars kent mason zebra christine hainestnc photo contest 2019 heart nicolas jobtnc photo contest 2022 long exposure stars vincent ottotnc photo contest 2019 sea stars on kelp liliana calzadatnc photo contest 2022 striped marlin jono allentnc photo contest 2022 triangles henrique murtatnc photo contest 2019striped lizard timothy bouchertnc
Posts_nature_org_18_Apr_2024_17_Apr_2025_7883_CLEANED_131.jpeg,The age-old debate is about real vs. fake Christmas trees. Which one is better? The answer might surprise you!  Consider these facts about artificial trees: * 10 million are purchased every holiday season* Nearly 90% are shipped internationally* Most end up in landfills because they cant be recycled Working forests play an important role in conservation and when theyre sustainably managed they can produce renewable resources like Christmas trees and other wood-made products. So go ahead and purchase a real tree and support local tree farmers who help maintain healthy forests for generations.  : 1. James Brooks2. Scott Copeland3. Alessandro Carboni/TNC Photo Contest 2023 (alessandro_carboni),the ageold debate is about real vs fake christmas trees which one is better the answer might surprise you consider these facts about artificial trees 10 million are purchased every holiday season nearly 90 are shipped internationally most end up in landfills because they cant be recycled working forests play an important role in conservation and when theyre sustainably managed they can produce renewable resources like christmas trees and other woodmade products so go ahead and purchase a real tree and support local tree farmers who help maintain healthy forests for generations 1 james brooks2 scott copeland3 alessandro carbonitnc photo contest 2023 alessandro_carboni
