Image Filename,Caption,Cleaned Caption
Posts_greenmatters_18_Apr_2024_17_Apr_2025_d3ce_CLEANED_276.jpeg,If your little one is a Sephora kid in the making and begging to explore the world of makeup artistry you may be on the hunt for clean makeup for kids. Unfortunately there are a number of ingredients commonly used in cosmetics that many experts do not believe are safe   especially for children who are still developing. The good news is there are quite a few brands out there making nontoxic cruelty-free and child-safe makeup. Here are seven of our favorite kid-safe clean and fairly eco-friendly kids cosmetic brands   learn more about them and their products at the link in bio.     puttisuusa  petitenpretty  kleenaturals  primandpure.co  truebloomkids  nonastieskids  purejovy  True Bloom Kids (Media Description: The headline These 7 Nontoxic Makeup Brands Are Safe for Children over a photo of children playing with True Bloom Kids makeup on the floor.),if your little one is a sephora kid in the making and begging to explore the world of makeup artistry you may be on the hunt for clean makeup for kids unfortunately there are a number of ingredients commonly used in cosmetics that many experts do not believe are safe especially for children who are still developing the good news is there are quite a few brands out there making nontoxic crueltyfree and childsafe makeup here are seven of our favorite kidsafe clean and fairly ecofriendly kids cosmetic brands learn more about them and their products at the link in bio puttisuusa petitenpretty kleenaturals primandpureco truebloomkids nonastieskids purejovy true bloom kids media description the headline these 7 nontoxic makeup brands are safe for children over a photo of children playing with true bloom kids makeup on the floor
Posts_greenmatters_18_Apr_2024_17_Apr_2025_d3ce_CLEANED_277.jpeg,Veterinarian Annie Harvilicz is being hailed for her heroic actions after opening up her home and pet hospital to over 40 dogs and cats during the Southern California wildfires. Harvilicz who runs two animal hospitals and the non-profit Animal Wellness Foundation also posted a message to Facebook offering to house fire-displaced animals. If you live in the Los Angeles area and have space or time to foster animals displaced by the wildfires we highly encourage you to contact local humane societies and shelters in need. (Media Description: A collage of animal images rescued from California wildfires on a light pink background the prominent image is of a woman holding a small dog. The copy in the top left corner reads Local Vet Saves 40 Animals During the Palisades Fire.),veterinarian annie harvilicz is being hailed for her heroic actions after opening up her home and pet hospital to over 40 dogs and cats during the southern california wildfires harvilicz who runs two animal hospitals and the nonprofit animal wellness foundation also posted a message to facebook offering to house firedisplaced animals if you live in the los angeles area and have space or time to foster animals displaced by the wildfires we highly encourage you to contact local humane societies and shelters in need media description a collage of animal images rescued from california wildfires on a light pink background the prominent image is of a woman holding a small dog the copy in the top left corner reads local vet saves 40 animals during the palisades fire
Posts_greenmatters_18_Apr_2024_17_Apr_2025_d3ce_CLEANED_278.jpeg,Catch up with upcycling designer Taya  TS  in a #GreenMinute!And read more about how she   and other creators   dress for music festivals and raves sustainably at the link in bio.   #notsofastfashionweek(Media Description: Video featuring creator Taya  TS  speaking to the camera and trying on various outfits.),catch up with upcycling designer taya ts in a #greenminuteand read more about how she and other creators dress for music festivals and raves sustainably at the link in bio #notsofastfashionweekmedia description video featuring creator taya ts speaking to the camera and trying on various outfits
Posts_greenmatters_18_Apr_2024_17_Apr_2025_d3ce_CLEANED_279.jpeg,According to a new report researchers have discovered that the exhaled breath captured by dolphins studied in the populated Sarasota Bay Florida and the far more rural waters of Barataria Bay Louisiana contained microplastics. Read the full news at the link in bio. (Media Description: The headline Study Finds Evidence of Microplastics in Dolphin Breath over an image of two dolphins at the waters surface.),according to a new report researchers have discovered that the exhaled breath captured by dolphins studied in the populated sarasota bay florida and the far more rural waters of barataria bay louisiana contained microplastics read the full news at the link in bio media description the headline study finds evidence of microplastics in dolphin breath over an image of two dolphins at the waters surface
Posts_greenmatters_18_Apr_2024_17_Apr_2025_d3ce_CLEANED_280.jpeg,JetZero blended-wing aircraft which is touted for its potential to be 50% more fuel-efficient than current commercial planes aiming to reduce aviations carbon footprint. Additionally the increasing fuel efficiency of aircraft like the Airbus A321XLR is mentioned as a factor that could open new long-distance flight routes while potentially reducing overall fuel consumption per passenger. (Media Description: A photo of a white new triangle-shaped aircraft flying over the coast. Below the image on a black background is the text JetZero and Delta team up to develop 50% more fuel-efficient aircraft.),jetzero blendedwing aircraft which is touted for its potential to be 50 more fuelefficient than current commercial planes aiming to reduce aviations carbon footprint additionally the increasing fuel efficiency of aircraft like the airbus a321xlr is mentioned as a factor that could open new longdistance flight routes while potentially reducing overall fuel consumption per passenger media description a photo of a white new triangleshaped aircraft flying over the coast below the image on a black background is the text jetzero and delta team up to develop 50 more fuelefficient aircraft
Posts_greenmatters_18_Apr_2024_17_Apr_2025_d3ce_CLEANED_281.jpeg,On March 22 Arctic sea ice reached its lowest maximum extent in recorded history at just 5.53 million square miles. This record low measured during the Arctics typical peak ice season underscores the profound impact of climate change on this rapidly warming region. The loss of ice when compared to the 1981-2010 average is an area larger than California Texas and Washington combined signaling an alarming trend. (Media Description: The headline Arctic Sea Ice Reaches Alarming New Low overalid on an image of a single iceberg floating in the ocean at sunrise.),on march 22 arctic sea ice reached its lowest maximum extent in recorded history at just 553 million square miles this record low measured during the arctics typical peak ice season underscores the profound impact of climate change on this rapidly warming region the loss of ice when compared to the 19812010 average is an area larger than california texas and washington combined signaling an alarming trend media description the headline arctic sea ice reaches alarming new low overalid on an image of a single iceberg floating in the ocean at sunrise
Posts_greenmatters_18_Apr_2024_17_Apr_2025_d3ce_CLEANED_282.jpeg,Today marks Indigenous Peoples Day a holiday that honors Native Americans   rather than Christopher Columbus who stole Indigenous land and has been celebrated for doing so for centuries. Here are a few things you can do to honor Indigenous Peoples Day today   and beyond:1  Look up whose land you re on from there you can research the tribe that used to live there and take some time to acknowledge and learn about them. Websites like www.whose.land and native-land.ca can help you get started. 2  Read a book about Native American history   there are many that focus on the relationship between Indigenous peoples and protecting the environment.3  Donate to Native American and Indigenous charities such as indigenousrising seedingsovereignty honortheearth and nativeamericanrightsfund. If you cannot afford to donate right now consider following these groups on Instagram to help diversify your news feed.  Tap the link in our bio for more resources.(Media Description: The headline  How to Honor Indigenous Peoples Day  alongside an image of a protest.),today marks indigenous peoples day a holiday that honors native americans rather than christopher columbus who stole indigenous land and has been celebrated for doing so for centuries here are a few things you can do to honor indigenous peoples day today and beyond1 look up whose land you re on from there you can research the tribe that used to live there and take some time to acknowledge and learn about them websites like and nativelandca can help you get started 2 read a book about native american history there are many that focus on the relationship between indigenous peoples and protecting the environment3 donate to native american and indigenous charities such as indigenousrising seedingsovereignty honortheearth and nativeamericanrightsfund if you cannot afford to donate right now consider following these groups on instagram to help diversify your news feed tap the link in our bio for more resourcesmedia description the headline how to honor indigenous peoples day alongside an image of a protest
Posts_greenmatters_18_Apr_2024_17_Apr_2025_d3ce_CLEANED_283.jpeg,Every March the Chicago River is dyed green in honor of St. Patricks Day. But is this safe? Even though the green Chicago River looks undeniably toxic to say the least it doesnt seem as though the dye is actually doing anything to harm the environment. According to The Independent its been dyed for years by the Chicago Plumbers Union Local 130.  Initially the dye which used to be made of fluorescein was used to test leaky pipes and it would last for a week. But environmentalists have since identified environmental issues behind using oil-based fluorescein in a natural body of water so in 1966 the plumbers union transitioned to using whats used currently: a low-impact orange powder thats made from vegetables. The mixture which they call Leprechaun Dust turns green as soon as it hits the water and lasts for 48 hours. The dye used is a food grade dye also used in medicine as the colorant for antifreeze and as a tracer dye. The Illinois EPA found that at the concentration used in the Chicago River it is completely non-toxic reads a statement from the EPA as per NiCHE Canada. An EPA toxicologist also reviewed the dye and deemed it safe for the river. Others feel differently though. NiCHE Canadas Isaac Green says it has a negative undertone. Dyeing the river continues and perpetuates the notion that we can modify rivers to suit our tastes with no regard to the consequences. Thus even if the dye itself isn t ecologically harmful the process of dying the river can sustain harmful ecological ideas Green wrote. ... the dye allows people to believe the river isn t natural therefore justifying its treatment as a sewer. What are your thoughts?  (Media Description: The headline The Chicago River Is Dyed Green Every St. Patricks Day   But Is It Environmentally Safe? above a photo of the Chicago River dyed green surrounded by skyscrapers.),every march the chicago river is dyed green in honor of st patricks day but is this safe even though the green chicago river looks undeniably toxic to say the least it doesnt seem as though the dye is actually doing anything to harm the environment according to the independent its been dyed for years by the chicago plumbers union local 130 initially the dye which used to be made of fluorescein was used to test leaky pipes and it would last for a week but environmentalists have since identified environmental issues behind using oilbased fluorescein in a natural body of water so in 1966 the plumbers union transitioned to using whats used currently a lowimpact orange powder thats made from vegetables the mixture which they call leprechaun dust turns green as soon as it hits the water and lasts for 48 hours the dye used is a food grade dye also used in medicine as the colorant for antifreeze and as a tracer dye the illinois epa found that at the concentration used in the chicago river it is completely nontoxic reads a statement from the epa as per niche canada an epa toxicologist also reviewed the dye and deemed it safe for the river others feel differently though niche canadas isaac green says it has a negative undertone dyeing the river continues and perpetuates the notion that we can modify rivers to suit our tastes with no regard to the consequences thus even if the dye itself isn t ecologically harmful the process of dying the river can sustain harmful ecological ideas green wrote the dye allows people to believe the river isn t natural therefore justifying its treatment as a sewer what are your thoughts media description the headline the chicago river is dyed green every st patricks day but is it environmentally safe above a photo of the chicago river dyed green surrounded by skyscrapers
Posts_greenmatters_18_Apr_2024_17_Apr_2025_d3ce_CLEANED_284.jpeg,Tap the link in our bio to learn more about these documentaries movies and shows all of which are recommended viewing during Black History Month.  (Media Description: A black and white silhouette image of an individual in the background and a still image from a movie on top. The headline overlaid reads  Films to Watch for Black History Month  followed by: 13th The Hate U Give Theres Something in the Water Genius: MLK/X Mossville: When Great Trees Fall Judas and the Black Messiah The 1619 Project Theyre Trying to Kill Us Summer of Soul Racist Trees.),tap the link in our bio to learn more about these documentaries movies and shows all of which are recommended viewing during black history month media description a black and white silhouette image of an individual in the background and a still image from a movie on top the headline overlaid reads films to watch for black history month followed by 13th the hate u give theres something in the water genius mlkx mossville when great trees fall judas and the black messiah the 1619 project theyre trying to kill us summer of soul racist trees
Posts_greenmatters_18_Apr_2024_17_Apr_2025_d3ce_CLEANED_285.jpeg,When it comes to the righteous outspoken moms of the environmentalism world we are absolutely failing the not saying mother for an entire minute challenge. There are a slew of mom activists working to educate the world on environmental issues and fighting to protect future generations in the face of the climate crisis. So as part of our #ItsGivingEarthDay programming we spoke with two mothers who are definitely mothering: Isabel Gonz lez Whitaker the Associate Vice President for Public Engagement at Moms Clean Air Force and Jenny Zimmer the Senior Director of Campaigns & Organizing at Mothers Out Front. Tap the link in bio to read our interviews with these fierce women who declare the importance of a mothers touch when it comes to protecting Mother Earth.  (Media Description: A collage featuring headshots of Isabel Gonz lez and Jenny Zimmer photos of groups volunteering with Moms Clean Air Force and Mothers Out Front and the text  Its Giving ... Motherquake: How These Mom-Led Climate Organizations Are Making a Difference. ),when it comes to the righteous outspoken moms of the environmentalism world we are absolutely failing the not saying mother for an entire minute challenge there are a slew of mom activists working to educate the world on environmental issues and fighting to protect future generations in the face of the climate crisis so as part of our #itsgivingearthday programming we spoke with two mothers who are definitely mothering isabel gonz lez whitaker the associate vice president for public engagement at moms clean air force and jenny zimmer the senior director of campaigns organizing at mothers out front tap the link in bio to read our interviews with these fierce women who declare the importance of a mothers touch when it comes to protecting mother earth media description a collage featuring headshots of isabel gonz lez and jenny zimmer photos of groups volunteering with moms clean air force and mothers out front and the text its giving motherquake how these momled climate organizations are making a difference
Posts_greenmatters_18_Apr_2024_17_Apr_2025_d3ce_CLEANED_286.jpeg,The Green Matters editors want to help you make the best most sustainable purchasing choices   so we have an ongoing contest series called   Green Matters Approved   to help you do just that. ICYMI we recently revealed the winners of our Green Pets contests in which we asked our audience to vote for their favorite brands in five categories across the sustainable pets space. Here were sharing the 10 winners of our Best Natural Dog Treat Brands contest. (Media Description: Graphic featuring the word winners! several times a Green Matters Approved badge and the following text:  The Best Natural Dog Treat Brands: Portland Pet Food Company Charlee Bear Lord Jameson Natural Rapport Wet Noses Newmans Own Jiminys Grandma Lucys Dog Mammas Cookie Pal.),the green matters editors want to help you make the best most sustainable purchasing choices so we have an ongoing contest series called green matters approved to help you do just that icymi we recently revealed the winners of our green pets contests in which we asked our audience to vote for their favorite brands in five categories across the sustainable pets space here were sharing the 10 winners of our best natural dog treat brands contest media description graphic featuring the word winners several times a green matters approved badge and the following text the best natural dog treat brands portland pet food company charlee bear lord jameson natural rapport wet noses newmans own jiminys grandma lucys dog mammas cookie pal
Posts_greenmatters_18_Apr_2024_17_Apr_2025_d3ce_CLEANED_287.jpeg,We spoke exclusively with Juicy Marbless co-founder Vladimir Mi kovi  to learn more about the companys new vegan Baby Ribs which feature 32 grams of protein per serving. Tap the link in bio for the full story!,we spoke exclusively with juicy marbless cofounder vladimir mi kovi to learn more about the companys new vegan baby ribs which feature 32 grams of protein per serving tap the link in bio for the full story
Posts_greenmatters_18_Apr_2024_17_Apr_2025_d3ce_CLEANED_288.jpeg,Happy 45th birthday to Jason Momoa! The actor and environmentalist often uses his voice to speak up for environmental issues   and he spoke the above quote in a video for the UN Environment Program last year in honor of World Environment Day. Vote for leaders who take action. Avoid single-use plastics. Reduce. Reuse. Recycle  he also stated in the video.  Everyone s action on plastic pollution matters. (Media Description: The quote  Use your voice and your choice to drive change  over an image of Jason Momoa on a beach.),happy 45th birthday to jason momoa the actor and environmentalist often uses his voice to speak up for environmental issues and he spoke the above quote in a video for the un environment program last year in honor of world environment day vote for leaders who take action avoid singleuse plastics reduce reuse recycle he also stated in the video everyone s action on plastic pollution matters media description the quote use your voice and your choice to drive change over an image of jason momoa on a beach
Posts_greenmatters_18_Apr_2024_17_Apr_2025_d3ce_CLEANED_289.jpeg,The Green Matters editors want to help you make the best most sustainable purchasing choices   so we have an ongoing contest series called   Green Matters Approved   to help you do just that. And youre invited to vote for your favorite.This week we launched the latest round Green Transportation & Travel which features five categories across the sustainable transportation space. Here are the nominees for the best electric skateboard brand   visit greenmatters.com or tap the link in bio to vote!  (Media Description: Graphic featuring a closeup of people riding electric skateboards and the following text:  Best Electric Skateboard Brands: Backfire Skateboards Bioboards Defiant Board Society Ecomobl Electric Ride Co. enSkate Evolve Exway Maxfind Meepo Metroboard Outdoor Eco Sports Shark Wheel Veymax. Vote for your favorite in the Green Matters Approved contest at the link in bio! ),the green matters editors want to help you make the best most sustainable purchasing choices so we have an ongoing contest series called green matters approved to help you do just that and youre invited to vote for your favoritethis week we launched the latest round green transportation travel which features five categories across the sustainable transportation space here are the nominees for the best electric skateboard brand visit greenmatterscom or tap the link in bio to vote media description graphic featuring a closeup of people riding electric skateboards and the following text best electric skateboard brands backfire skateboards bioboards defiant board society ecomobl electric ride co enskate evolve exway maxfind meepo metroboard outdoor eco sports shark wheel veymax vote for your favorite in the green matters approved contest at the link in bio
Posts_greenmatters_18_Apr_2024_17_Apr_2025_d3ce_CLEANED_291.jpeg,If you ve ever felt hopeless or deeply pessimistic about how the climate crisis is affecting the world well congrats you ve been unofficially diagnosed with climate doomism. It ll go nicely with your eco-anxiety! But the good news is there are many ways to fight these negative feelings associated with fear of the climate emergency which are often driven by the media or activists who use climate doomism as a tactic. (While this tactic can be effective some mental health professionals have observed an uptick in anxiety due to climate doomism.) The best way to fight that feeling is to get involved with climate action in whatever way speaks to you most.  On an individual level climate action can be as simple as making eco-conscious lifestyle choices. Individuals can also get involved in climate action by studying topics related to the climate or starting a career that involves advocating for the climate such as a job in climate science or in the environmental nonprofit sector. Climate action also encapsulates climate activism which refers to protesting campaigning or otherwise demonstrating to enact tangible change from leaders. For this you may choose to get involved with an environmental organization attend protests or climate strikes or reach out to government officials industry leaders and corporations demanding change. What do you do to combat climate doomism? Share your ideas in the comments! (Media Description: An image featuring a melting glacier surrounded by rocky terrain. A muddy stream flows from the melting ice highlighting the effects of climate change. The text overlay reads  The Best Way to Combat Climate Doomism? Climate Action. ),if you ve ever felt hopeless or deeply pessimistic about how the climate crisis is affecting the world well congrats you ve been unofficially diagnosed with climate doomism it ll go nicely with your ecoanxiety but the good news is there are many ways to fight these negative feelings associated with fear of the climate emergency which are often driven by the media or activists who use climate doomism as a tactic while this tactic can be effective some mental health professionals have observed an uptick in anxiety due to climate doomism the best way to fight that feeling is to get involved with climate action in whatever way speaks to you most on an individual level climate action can be as simple as making ecoconscious lifestyle choices individuals can also get involved in climate action by studying topics related to the climate or starting a career that involves advocating for the climate such as a job in climate science or in the environmental nonprofit sector climate action also encapsulates climate activism which refers to protesting campaigning or otherwise demonstrating to enact tangible change from leaders for this you may choose to get involved with an environmental organization attend protests or climate strikes or reach out to government officials industry leaders and corporations demanding change what do you do to combat climate doomism share your ideas in the comments media description an image featuring a melting glacier surrounded by rocky terrain a muddy stream flows from the melting ice highlighting the effects of climate change the text overlay reads the best way to combat climate doomism climate action
