Image Filename,Caption,Cleaned Caption
Posts_greenmatters_18_Apr_2024_17_Apr_2025_d3ce_CLEANED_186.jpeg,Instead of throwing out their banana peels some home gardeners are using them to make  banana peel water.  Just chop up your peels and let them soak in water to create a  nutrient-rich homemade fertilizer  which you can use to water your plants they say. Would you try this?  To learn more drop a   in the comments and we ll instantly DM you the full article.  (Media Description: A pile of banana peels on a white surface with the headline  Home Gardeners Are Making  Banana Peel Water  for Their Plants. ),instead of throwing out their banana peels some home gardeners are using them to make banana peel water just chop up your peels and let them soak in water to create a nutrientrich homemade fertilizer which you can use to water your plants they say would you try this to learn more drop a in the comments and we ll instantly dm you the full article media description a pile of banana peels on a white surface with the headline home gardeners are making banana peel water for their plants
Posts_greenmatters_18_Apr_2024_17_Apr_2025_d3ce_CLEANED_187.jpeg,Social media is flooded with horror stories from shoppers who went onto Depops website in search of vintage pieces only to discover that they were being sold items from fast fashion companies like Shein. Comment a   below and instantly receive the full story   plus essential tips on how to avoid falling for these scams   in your DMs!  (Media Description: The headline  Depop Sellers Accused of Scamming Shoppers by Calling Fast Fashion Pieces  Vintage  over a furry background with  depop  in red projected over and over.),social media is flooded with horror stories from shoppers who went onto depops website in search of vintage pieces only to discover that they were being sold items from fast fashion companies like shein comment a below and instantly receive the full story plus essential tips on how to avoid falling for these scams in your dms media description the headline depop sellers accused of scamming shoppers by calling fast fashion pieces vintage over a furry background with depop in red projected over and over
Posts_greenmatters_18_Apr_2024_17_Apr_2025_d3ce_CLEANED_188.jpeg,Yesterday in honor of Earth Day a group of protestors picketed outside of Sheins downtown headquarters in Los Angeles  wearing nothing but towels and bathrobes.The group hoped to raise awareness of fast fashions exploitation and demand better   and because theyd rather be naked than wear Shein!As part of our #ItsGivingEarthDay programming we spoke with protest organizer Lexy Silverstein for all the details  read the full story at the link in bio!  (Media Description: Photos show protesters wearing sheets and towels in front of Sheins LA offices.),yesterday in honor of earth day a group of protestors picketed outside of sheins downtown headquarters in los angeles wearing nothing but towels and bathrobesthe group hoped to raise awareness of fast fashions exploitation and demand better and because theyd rather be naked than wear sheinas part of our #itsgivingearthday programming we spoke with protest organizer lexy silverstein for all the details read the full story at the link in bio media description photos show protesters wearing sheets and towels in front of sheins la offices
Posts_greenmatters_18_Apr_2024_17_Apr_2025_d3ce_CLEANED_189.jpeg,For weeks French protesters had been planning a mass poop in the Seine River. The protest was set for yesterday June 23   the same day as French President Emmanuel Macron and Paris Mayor Anne Hidalgos planned swim in the famous river which was meant to prove that the river was safe for swimmers to use during the upcoming Olympic Games. But blaming rainy weather (which purportedly can increase contaminants in the already polluted river) the politicians postponed their swim yesterday   meaning protesters were forced to postpone their defecation demonstration. But will it be rescheduled?  Read the full story at the link in bio! (Media Description: The headline UPDATE: Activists Postpone Plan to Poop in Seine River After French Politicians Delay Their Swim over a photo of the Seine River with the Eiffel Tower in the background.),for weeks french protesters had been planning a mass poop in the seine river the protest was set for yesterday june 23 the same day as french president emmanuel macron and paris mayor anne hidalgos planned swim in the famous river which was meant to prove that the river was safe for swimmers to use during the upcoming olympic games but blaming rainy weather which purportedly can increase contaminants in the already polluted river the politicians postponed their swim yesterday meaning protesters were forced to postpone their defecation demonstration but will it be rescheduled read the full story at the link in bio media description the headline update activists postpone plan to poop in seine river after french politicians delay their swim over a photo of the seine river with the eiffel tower in the background
Posts_greenmatters_18_Apr_2024_17_Apr_2025_d3ce_CLEANED_190.jpeg,As part of our #ItsGivingEarthDay programming we spoke with the iconic Priyanka Naik better known as Chef Priyanka one of the internets favorite vegan chefs. Naik is well-known for two things: incorporating her Indian culture into her cooking and utilizing handy zero-waste techniques   whether that means taking carrot tops and making a pesto turning leftover rice into plant-based burgers or as seen in the above video using mango peels to make a chutney. Want to read our full interview with the iconic self-taught chef? Tap the link in bio!  (Media Description: In a video Priyanka Naik shows how to use mango peels to make chutney.),as part of our #itsgivingearthday programming we spoke with the iconic priyanka naik better known as chef priyanka one of the internets favorite vegan chefs naik is wellknown for two things incorporating her indian culture into her cooking and utilizing handy zerowaste techniques whether that means taking carrot tops and making a pesto turning leftover rice into plantbased burgers or as seen in the above video using mango peels to make a chutney want to read our full interview with the iconic selftaught chef tap the link in bio media description in a video priyanka naik shows how to use mango peels to make chutney
Posts_greenmatters_18_Apr_2024_17_Apr_2025_d3ce_CLEANED_191.jpeg,Leave a   in the comments and well DM you the story link.  (Media Description: The headline Glacier Water May Be Trendy but It Probably Contains Fecal Bacteria over a closeup of glaciers.),leave a in the comments and well dm you the story link media description the headline glacier water may be trendy but it probably contains fecal bacteria over a closeup of glaciers
Posts_greenmatters_18_Apr_2024_17_Apr_2025_d3ce_CLEANED_192.jpeg,Our editors rounded up 15 brands making baby wipes that are completely plastic-free and are instead composed of materials like cotton paper and bamboo. Tap the link in bio to see the list and vote for your favorite.   #greenmattersapproved (Media Description: The headline 90 Percent of Baby Wipes Are Made of Plastic over an image of someone pulling a wipe from a package.),our editors rounded up 15 brands making baby wipes that are completely plasticfree and are instead composed of materials like cotton paper and bamboo tap the link in bio to see the list and vote for your favorite #greenmattersapproved media description the headline 90 percent of baby wipes are made of plastic over an image of someone pulling a wipe from a package
Posts_greenmatters_18_Apr_2024_17_Apr_2025_d3ce_CLEANED_193.jpeg,The gunk that builds up on your tongue is not the sexiest topic youll read about today but it might be the most important. Even if you brush and floss diligently an unhygienic tongue can be enough to cause bad breath cavities and even gum disease. Oh and a visible white coating speaking of unsexy topics. The solution? Introduce a metal tongue scraper into your brushing routine. Check out our top recommendations for plastic-free tongue scrapers at the link in bio.  (Media Description: A person uses a metal tongue scraper with the headline  Why You Should Be Using a Tongue Scraper. ),the gunk that builds up on your tongue is not the sexiest topic youll read about today but it might be the most important even if you brush and floss diligently an unhygienic tongue can be enough to cause bad breath cavities and even gum disease oh and a visible white coating speaking of unsexy topics the solution introduce a metal tongue scraper into your brushing routine check out our top recommendations for plasticfree tongue scrapers at the link in bio media description a person uses a metal tongue scraper with the headline why you should be using a tongue scraper
Posts_greenmatters_18_Apr_2024_17_Apr_2025_d3ce_CLEANED_194.jpeg,In honor of Earth Day 2024 we present Its Giving... Earth Day: A week of programming here on Green Matters about the people and organizations who are  giving  Earth Day 24/7.Going off of the of-the-moment slang  it s giving  which originates from African American Vernacular English (AAVE) and Black and Latinx LGBTQ+ Ballroom culture #ItsGivingEarthDay aims to honor movements across the spectrum of the climate movement.All week long we ll be sharing features on all different people in the climate movement including a mycologist sustainable chefs Gen Z climate activists and leaders of different mom-led climate organizations.We hope this week of programming encourages you to consider the vastness of the scope of the climate movement and inspires you to embody the spirit of Earth Day all year round.Stay tuned for Green Matters  #ItsGivingEarthDay programming here on greenmatters and www.greenmatters.com.  (Media Description: Collage with the phrases Its Giving... Earth Day 2024 and Highlighting the people who are giving Earth Day 24/7 with images of Greta Thunberg Genesis Butler and more.),in honor of earth day 2024 we present its giving earth day a week of programming here on green matters about the people and organizations who are giving earth day 247going off of the ofthemoment slang it s giving which originates from african american vernacular english aave and black and latinx lgbtq ballroom culture #itsgivingearthday aims to honor movements across the spectrum of the climate movementall week long we ll be sharing features on all different people in the climate movement including a mycologist sustainable chefs gen z climate activists and leaders of different momled climate organizationswe hope this week of programming encourages you to consider the vastness of the scope of the climate movement and inspires you to embody the spirit of earth day all year roundstay tuned for green matters #itsgivingearthday programming here on greenmatters and media description collage with the phrases its giving earth day 2024 and highlighting the people who are giving earth day 247 with images of greta thunberg genesis butler and more
Posts_greenmatters_18_Apr_2024_17_Apr_2025_d3ce_CLEANED_195.jpeg,Do me a favor and drop your fave hummus in the comments  (Media Description: The text Happy International Hummus Day over a closeup of a bowl of hummus topped with various fruits and vegetables.),do me a favor and drop your fave hummus in the comments media description the text happy international hummus day over a closeup of a bowl of hummus topped with various fruits and vegetables
Posts_greenmatters_18_Apr_2024_17_Apr_2025_d3ce_CLEANED_196.jpeg,We want you to vote for your favorite zero-waste cosmetic company! Tap the link in bio to vote in our Green Matters Approved contest. (Media Description: Close-up of a woman with dark curly hair freckles and makeup products on her cheek with the copy What are the Best Zero-Waste Cosmetics Companies?  THR Beauty Attitude Axiology Elate Beauty Ere Perez ILIA Izzy Zero Waste Beauty Kjaer Weis MOB Beauty Pyra Beauty River Organics Root Pretty Trestique Zao Zerra & Co. Vote for your favorite at the link in bio!),we want you to vote for your favorite zerowaste cosmetic company tap the link in bio to vote in our green matters approved contest media description closeup of a woman with dark curly hair freckles and makeup products on her cheek with the copy what are the best zerowaste cosmetics companies thr beauty attitude axiology elate beauty ere perez ilia izzy zero waste beauty kjaer weis mob beauty pyra beauty river organics root pretty trestique zao zerra co vote for your favorite at the link in bio
Posts_greenmatters_18_Apr_2024_17_Apr_2025_d3ce_CLEANED_197.jpeg,The above quote is from the new book Imperfect Environmentalist: How to Reduce Waste and Create Change for a Better Planet by Sheila M. Morovati the founder of sustainability nonprofits howchangers and crayoncollection.Were sharing an exclusive excerpt from the book on greenmatters.com in honor of our #ItsGivingEarthDay programming   tap the link in bio to read it!  (Media Description: Collage with a photo of Sheila M. Morovati on the beach and her quote Don t lose hope   just take action one step at a time.),the above quote is from the new book imperfect environmentalist how to reduce waste and create change for a better planet by sheila m morovati the founder of sustainability nonprofits howchangers and crayoncollectionwere sharing an exclusive excerpt from the book on greenmatterscom in honor of our #itsgivingearthday programming tap the link in bio to read it media description collage with a photo of sheila m morovati on the beach and her quote don t lose hope just take action one step at a time
Posts_greenmatters_18_Apr_2024_17_Apr_2025_d3ce_CLEANED_198.jpeg,Tap the link in bio to vote for your favorite sustainable footwear brands in our Green Matters Approved contest!  (Media Description: A pair of tan and black boots along with the text: These Are the Best Sustainable Vegan Shoe Brands: Cariuma COG Ecoalf Enda Etiko Flamingos Life Nae Noah Thesus Outdoors Thousand Fell Veerah Vegetarian Shoes Veja Wills Vegan Store Womsh.),tap the link in bio to vote for your favorite sustainable footwear brands in our green matters approved contest media description a pair of tan and black boots along with the text these are the best sustainable vegan shoe brands cariuma cog ecoalf enda etiko flamingos life nae noah thesus outdoors thousand fell veerah vegetarian shoes veja wills vegan store womsh
Posts_greenmatters_18_Apr_2024_17_Apr_2025_d3ce_CLEANED_199.jpeg,For our new ongoing contest series  Green Matters Approved   our editors will continually round up the best brands in all different categories to help you make the best most sustainable purchasing choices. Then we ll be inviting you to vote on the winners.The first round Green Kids launched this week and features five categories across the sustainable kids space. Visit greenmatters.com or tap the link in bio to vote for your favorite organic snack brand for kids!  (Media Description: Graphic featuring the following text:  The Best Organic Snack Brands for Kids: Aloha Earths Best Emmys Organics GoMacro Lesser Evil Little Bellies MadeGood Mamma Chia Marys Gone Crackers Natierra Skout Organic Solely Sunny Fruit YumEarth Yumi. Vote for your favorite in the Green Matters Approved contest at the link in bio! ),for our new ongoing contest series green matters approved our editors will continually round up the best brands in all different categories to help you make the best most sustainable purchasing choices then we ll be inviting you to vote on the winnersthe first round green kids launched this week and features five categories across the sustainable kids space visit greenmatterscom or tap the link in bio to vote for your favorite organic snack brand for kids media description graphic featuring the following text the best organic snack brands for kids aloha earths best emmys organics gomacro lesser evil little bellies madegood mamma chia marys gone crackers natierra skout organic solely sunny fruit yumearth yumi vote for your favorite in the green matters approved contest at the link in bio
Posts_greenmatters_18_Apr_2024_17_Apr_2025_d3ce_CLEANED_200.jpeg,Our editors rounded up 15 brands making baby diapers that are more eco-friendly than the average nappy. Tap the link in bio to see the list and vote for your favorite! #greenmattersapproved (Media Description: The headline The Average Diaper Is Estimated to Take 500 Years to Decompose over an image of a baby in a pile of diapers.),our editors rounded up 15 brands making baby diapers that are more ecofriendly than the average nappy tap the link in bio to see the list and vote for your favorite #greenmattersapproved media description the headline the average diaper is estimated to take 500 years to decompose over an image of a baby in a pile of diapers
Posts_greenmatters_18_Apr_2024_17_Apr_2025_d3ce_CLEANED_201.jpeg,When it comes to buying food storage bags we of course recommend investing in reusable silicone zip-top bags such as Stasher bags rather than buying disposable Ziploc bags over and over. However for all the plastic zip-top bags that do come your way there s no need to actually treat them as single-use. Check out the above video by America s Test Kitchen which shows how easy it is to clean Ziplocs. Read our full article about using zip-top plastic bags with safety and cleaning tips at the link in bio.   testkitchen (Media Description: Sam Block is seen hand washing Ziploc bags and placing them to dry in a dish rack.),when it comes to buying food storage bags we of course recommend investing in reusable silicone ziptop bags such as stasher bags rather than buying disposable ziploc bags over and over however for all the plastic ziptop bags that do come your way there s no need to actually treat them as singleuse check out the above video by america s test kitchen which shows how easy it is to clean ziplocs read our full article about using ziptop plastic bags with safety and cleaning tips at the link in bio testkitchen media description sam block is seen hand washing ziploc bags and placing them to dry in a dish rack
Posts_greenmatters_18_Apr_2024_17_Apr_2025_d3ce_CLEANED_202.jpeg,Sure the early bird catches the worm but the one who sleeps in each morning lives longer. At least thats what a sleep study seems to be reporting after a team of cardiac specialists discovered that sleeping in on the weekends may improve heart health.  Leave a   in the comments and well DM you the full story.  (Media Description: Closeup of person on couch along with the headline Can Sleeping in Save You From Heart Disease?),sure the early bird catches the worm but the one who sleeps in each morning lives longer at least thats what a sleep study seems to be reporting after a team of cardiac specialists discovered that sleeping in on the weekends may improve heart health leave a in the comments and well dm you the full story media description closeup of person on couch along with the headline can sleeping in save you from heart disease
Posts_greenmatters_18_Apr_2024_17_Apr_2025_d3ce_CLEANED_203.jpeg,If you ve ever felt hopeless or deeply pessimistic about how the climate crisis is affecting the world well congrats you ve been unofficially diagnosed with climate doomism. It ll go nicely with your eco-anxiety! But the good news is there are many ways to fight these negative feelings associated with fear of the climate emergency which are often driven by the media or activists who use climate doomism as a tactic. (While this tactic can be effective some mental health professionals have observed an uptick in anxiety due to climate doomism.) The best way to fight that feeling is to get involved with climate action in whatever way speaks to you most.  On an individual level climate action can be as simple as making eco-conscious lifestyle choices. Individuals can also get involved in climate action by studying topics related to the climate or starting a career that involves advocating for the climate such as a job in climate science or in the environmental nonprofit sector. Climate action also encapsulates climate activism which refers to protesting campaigning or otherwise demonstrating to enact tangible change from leaders. For this you may choose to get involved with an environmental organization attend protests or climate strikes or reach out to government officials industry leaders and corporations demanding change. What do you do to combat climate doomism? Share your ideas in the comments   and maybe getting more involved in climate action will be your 2025 New Years resolution. (Media Description: An image featuring a close-up aerial shot of a melting glacier or iceberg. The text overlay reads  The Best Way to Combat Climate Doomism? Climate Action. ),if you ve ever felt hopeless or deeply pessimistic about how the climate crisis is affecting the world well congrats you ve been unofficially diagnosed with climate doomism it ll go nicely with your ecoanxiety but the good news is there are many ways to fight these negative feelings associated with fear of the climate emergency which are often driven by the media or activists who use climate doomism as a tactic while this tactic can be effective some mental health professionals have observed an uptick in anxiety due to climate doomism the best way to fight that feeling is to get involved with climate action in whatever way speaks to you most on an individual level climate action can be as simple as making ecoconscious lifestyle choices individuals can also get involved in climate action by studying topics related to the climate or starting a career that involves advocating for the climate such as a job in climate science or in the environmental nonprofit sector climate action also encapsulates climate activism which refers to protesting campaigning or otherwise demonstrating to enact tangible change from leaders for this you may choose to get involved with an environmental organization attend protests or climate strikes or reach out to government officials industry leaders and corporations demanding change what do you do to combat climate doomism share your ideas in the comments and maybe getting more involved in climate action will be your 2025 new years resolution media description an image featuring a closeup aerial shot of a melting glacier or iceberg the text overlay reads the best way to combat climate doomism climate action
