Our food starts with the soil beneath our feet. From the veggies on your plate to the grains in your bread healthy soil is where it all begins. And it s the tiniest soil engineers like dung beetles that help keep it that way. Without them our food system and ecosystems could be at risk.  Protecting life below ground is crucial for food security planetary health and human well-being.As leaders meet at the Biodiversity conference   #COP16Colombia   we call on them to #ActForOurPlanet #NaturesTechnicians,https://imgs.socialinsider.io/instagram/2024/10/wwf_17925791675969134.jpeg,0.19884,2024-10-27 07:01:00,reel,Posts_wwf_18_Apr_2024_17_Apr_2025_2c9f 2_CLEANED_48.jpeg
Asian elephants in Southeast Asia and China face many issues due to human actions and their overall populations are dramatically decreasing. Decision-makers need to take greater action to protect nature and people. Double tap if you agree,https://imgs.socialinsider.io/instagram/2024/05/wwf_17943524189808141.jpeg,0.19861,2024-05-13 13:11:00,reel,Posts_wwf_18_Apr_2024_17_Apr_2025_2c9f 2_CLEANED_49.jpeg
Turn up the sound and listen closely: the urgency is real.Countries from around the world are coming together to break records get victory and show what s possible with hard work and commitment.But these incredible teams and athletes aren t the only ones breaking records. There are other records being broken too   records we can t celebrate.  From extreme weather events to unprecedented wildfires climate records are being shattered everywhere on our planet. Incredible human effort and determination bring success in the arena. It shows that anything s possible when people put in the work. Double tap if you want greater action to protect our shared home!,https://imgs.socialinsider.io/instagram/2024/07/wwf_18035279354088189.jpeg,0.19691,2024-07-23 00:02:00,reel,Posts_wwf_18_Apr_2024_17_Apr_2025_2c9f 2_CLEANED_50.jpeg
Asian elephants in Southeast Asia and China face many issues due to human actions and their overall populations are dramatically decreasing. Share this to help spread the word!,https://imgs.socialinsider.io/blank.jpg,0.19679,2024-07-06 11:00:00,reel,Posts_wwf_18_Apr_2024_17_Apr_2025_2c9f 2_CLEANED_51.jpeg
The ocean provides us with so much   from the food we eat to the air we breathe! It s also a vital ally in stopping the #ClimateCrisis.Now more than ever we must protect our blue planet. Share this post to help turn the tide!,https://imgs.socialinsider.io/instagram/2024/09/wwf_18304087438166548.jpeg,0.19407,2024-09-19 13:00:00,CAROUSEL_ALBUM,Posts_wwf_18_Apr_2024_17_Apr_2025_2c9f 2_CLEANED_52.jpeg
To the leaders at #COP16Colombia: the world is watching!  At #COP15 in December 2022 196 countries committed to halt and reverse nature loss by 2030 through the Global Biodiversity Framework (GBF). But progress has been too slow and the challenge is bigger than ever.  We need to act much faster and at a much larger scale. With just six years left to meet global targets its time for leaders and decision makers to go from agreement to action.Share this post to call on them to #ActForOurPlanet,https://imgs.socialinsider.io/instagram/2024/10/wwf_18076714954560952.jpeg,0.19275,2024-10-20 06:02:00,reel,Posts_wwf_18_Apr_2024_17_Apr_2025_2c9f 2_CLEANED_53.jpeg
Wildlife is the hidden force that keeps our world running   but its at high risk. Average species population numbers have plummeted by 73% since 1970 putting ecosystems economies and livelihoods at risk.Yet global leaders still aren t prioritising biodiversity loss.Promises won t cut it. We need critical financial resources to halt and reverse wildlife decline.From vultures preventing disease  by disposing of carcasses efficiently to monkeys restoring forests through seed dispersal wildlife isn t just beautiful   it s essential. At #COP16 leaders must move from words to action. Our futures depend on it.  The time for action is now. For people and nature. #COP16 #WWFUntangled #NaturesTechnicians,https://imgs.socialinsider.io/instagram/2025/02/wwf_18155727085350873.jpeg,0.19184,2025-02-25 11:34:00,reel,Posts_wwf_18_Apr_2024_17_Apr_2025_2c9f 2_CLEANED_54.jpeg
It s France s most iconic river. But for decades the Seine was treated like a sewer. It was so polluted that it was functionally  dead . But now it is coming back to life thanks to a huge clean-up effort.From 3 fish species to over 30.   And waters that are almost swimmable.With the world gathering for the #ParisOlympics the Seine s restoration is a striking testament to nature s powers of recovery.Our partner Minaguli is running the entire river to showcase the Seine and call on other cities and countries to restore their rivers   for people and nature. #RunBlue #GenerationRestoration,https://imgs.socialinsider.io/instagram/2024/06/wwf_17900533067921068.jpeg,0.18594,2024-06-06 12:11:00,reel,Posts_wwf_18_Apr_2024_17_Apr_2025_2c9f 2_CLEANED_55.jpeg
Behold the first-ever photograph of the elusive New Britain Goshawk photographed during a recent WWF scoping trip to Pomio! This remarkable bird is only found on the island of New Britain in Papua New Guinea and is rarely seen.But this is just the beginning. Together with local communities and leaders WWFPacific wwfbelgium are taking bold steps to protect Papua New Guinea s incredible biodiversity through community-led conservation.  Share this to show your love for our planet s amazing nature   by tomvierus...#GoodNewsFriday,https://imgs.socialinsider.io/instagram/2024/09/wwf_17874614250098547.jpeg,0.18344,2024-09-20 13:00:00,CAROUSEL_ALBUM,Posts_wwf_18_Apr_2024_17_Apr_2025_2c9f 2_CLEANED_56.jpeg
These are the records we don t want to break.Double tap if you want to see greater action to #ChangeClimateChange!,https://imgs.socialinsider.io/instagram/2024/08/wwf_18089279461480826.jpeg,182.0,2024-08-28 13:01:00,reel,Posts_wwf_18_Apr_2024_17_Apr_2025_2c9f 2_CLEANED_57.jpeg
The deep sea is a realm of wonder and mystery.  But climate change overfishing and plastic pollution wreak havoc on our ocean. And now this mesmerising underwater world is facing another threat: #DeepSeaMining.Together we can stop this threat before it s too late. Double tap if you agree governments must stop the irreversible damage of the deep sea now! #ThinkDeeply,https://imgs.socialinsider.io/instagram/2024/07/wwf_18058881514722192.jpeg,0.18132,2024-07-16 12:37:00,reel,Posts_wwf_18_Apr_2024_17_Apr_2025_2c9f 2_CLEANED_58.jpeg
#DYK Without mangroves 15 MILLION more people would be affected by floods each year.   This is major!Restoring and protecting nature is one of the best ways we can help safeguard this one home we all share. Heres why #mangroves are an amazing example of that.,https://imgs.socialinsider.io/instagram/2025/01/wwf_18049798244512794.jpeg,0.18106,2025-01-30 10:01:00,reel,Posts_wwf_18_Apr_2024_17_Apr_2025_2c9f 2_CLEANED_59.jpeg
Mangroves are amazing climate heroes!  They re home to a dazzling array of wildlife defend coastlines from storms and help keep our climate in balance.They re some of the world s most valuable ecosystems   but also the most threatened.Climate change unsustainable coastal development and pollution are just a few reasons mangroves are disappearing.Double tap if you agree we must do more to protect our precious mangrove forests.,https://imgs.socialinsider.io/instagram/2024/09/wwf_18008297120401092.jpeg,0.17716,2024-09-12 13:00:00,CAROUSEL_ALBUM,Posts_wwf_18_Apr_2024_17_Apr_2025_2c9f 2_CLEANED_60.jpeg
True or false? There are more living organisms in a single teaspoon of soil than there are people on Earth.  Soil is a bustling ecosystem that s essential for a healthy planet.,https://imgs.socialinsider.io/instagram/2024/12/wwf_18251127703286613.jpeg,0.17436,2024-12-12 10:48:00,CAROUSEL_ALBUM,Posts_wwf_18_Apr_2024_17_Apr_2025_2c9f 2_CLEANED_61.jpeg
Indigenous Peoples   from the Colombian #Amazon to the Arctic   are vital to safeguarding nature but often excluded from decisions about their future.Its vital their rights are upheld knowledge respected and that they are supported to govern their territories of life.Their active involvement is key to achieving our global biodiversity goals and building a sustainable future for all.   #COP16Colombia #ActForOurPlanet,https://imgs.socialinsider.io/instagram/2024/10/wwf_17943903476889738.jpeg,0.17372,2024-10-23 06:00:00,CAROUSEL_ALBUM,Posts_wwf_18_Apr_2024_17_Apr_2025_2c9f 2_CLEANED_62.jpeg
We are eating microplastics every day. Welcome to Daniel s Kitchen. Today we re serving you a special plastic gimbap just for you!We are unknowingly eating microplastics through water air and everyday products. Plastics are threatening our planet. Visit our bio link to help us urge leaders to secure a treaty with globally binding rules that ban harmful plastic products. Let s end plastic pollution!danieldaekim #INC5 #COP16Colombia,https://imgs.socialinsider.io/instagram/2024/10/wwf_17984450813752781.jpeg,0.17341,2024-10-30 08:01:00,reel,Posts_wwf_18_Apr_2024_17_Apr_2025_2c9f 2_CLEANED_63.jpeg
No matter where you are in the world what happens to the Amazon rainforest will impact you.  And decades of deforestation and climate-driven degradation threaten this essential ecosystem. If it continues the vibrant Amazon could turn into dry forests and grassland   devastating nature people and the planet.This can only change if we #ActForOurPlanet now. To protect the Amazon and its irreplaceable value. #WWFUntangled #LivingPlanetReport #LPR2024,https://imgs.socialinsider.io/instagram/2024/10/wwf_18046270769310447.jpeg,0.17311,2024-10-14 09:02:00,reel,Posts_wwf_18_Apr_2024_17_Apr_2025_2c9f 2_CLEANED_64.jpeg
What happens when you mix bees and elephants?   In Zimbabwe beehives serve as natural barriers keeping elephants away from crops and protecting harvests. This ingenious solution not only conserves wildlife but also provides alternative income during droughts supporting local communities.   Double tap if you support these creative conservation efforts!,https://imgs.socialinsider.io/instagram/2024/08/wwf_17920876496868242.jpeg,0.17239,2024-08-22 16:22:00,CAROUSEL_ALBUM,Posts_wwf_18_Apr_2024_17_Apr_2025_2c9f 2_CLEANED_65.jpeg
These are the records we don t want to break. Double tap if you want to see greater action to #ChangeClimateChange!,https://imgs.socialinsider.io/instagram/2024/08/wwf_18016779791437707.jpeg,0.17043,2024-08-02 12:46:00,reel,Posts_wwf_18_Apr_2024_17_Apr_2025_2c9f 2_CLEANED_66.jpeg
Though the scale of the #ClimateCrisis can seem daunting the good news is that we can ALL take action. Whether its making small changes in your lifestyle or calling on world leaders to come together and act to protect nature we can all play a part for our planet.Double tap if you support greater #ClimateAction for people and nature!,https://imgs.socialinsider.io/instagram/2024/09/wwf_18045940624812730.jpeg,0.17005,2024-09-18 12:15:00,CAROUSEL_ALBUM,Posts_wwf_18_Apr_2024_17_Apr_2025_2c9f 2_CLEANED_67.jpeg
The Amazon is more than a rainforest it s a lifeline. But overexploitation is pushing it to the brink.We only have 5 years to halt and reverse biodiversity loss and protect ecosystems vital to the future of people and nature.Double tap to urge leaders to #ActForOurPlanet!... #COP16Colombia,https://imgs.socialinsider.io/instagram/2024/10/wwf_18045933001844698.jpeg,0.16479,2024-10-25 06:02:00,reel,Posts_wwf_18_Apr_2024_17_Apr_2025_2c9f 2_CLEANED_68.jpeg
Nature continues to amaze us!The elusive Lesula monkey the dwarf water cobra and the slender-snouted crocodile are some of the 742 species in the Congo Basin which have not been previously recorded by science  Double tap to show your love for our planets incredible biodiversity,https://imgs.socialinsider.io/instagram/2024/12/wwf_17917965872919450.jpeg,0.16245,2024-12-05 10:02:00,reel,Posts_wwf_18_Apr_2024_17_Apr_2025_2c9f 2_CLEANED_69.jpeg
Mountain gorillas are vital to our planet s health   but the climate crisis is pushing them to the brink  Climate change is increasingly exposing them to wild fires and reducing their food and water sources while habitat loss and disease threats also endanger their survival.As ecosystem guardians they help forests thrive support biodiversity and sustain local communities through eco-tourism. Their decline threatens not just wildlife but livelihoods and cultural heritage too.  Their conservation is crucial. Swipe to learn more & share to spread awareness #TheHerds,https://scontent-fra5-2.cdninstagram.com/v/t51.75761-15/489570780_18500100205043033_476144567081615172_n.jpg?stp=dst-jpg_e35_tt6&_nc_cat=109&ccb=1-7&_nc_sid=18de74&_nc_ohc=im1kN964zKUQ7kNvwENGb15&_nc_oc=AdmfsPFeUMFXzuh_FAgQz9deLwQooDrl7cl3ilS3k3og_fta375q8HJ9K0JxpD1rrmI&_nc_zt=23&_nc_ht=scontent-fra5-2.cdninstagram.com&edm=AL-3X8kEAAAA&_nc_gid=r2N_qzuPMka2qV5mvQOtow&oh=00_AfFKxxGtwu-NXMIwZThqPTFLQkSMYytOk6YlGPXxgwf17Q&oe=68072030,0.16082,2025-04-11 16:15:00,CAROUSEL_ALBUM,Posts_wwf_18_Apr_2024_17_Apr_2025_2c9f 2_CLEANED_70.jpeg
Did you know that 80% of the people displaced by climate change are women?Women and girls especially Indigenous women and women of colour are among the most vulnerable to the impacts of the #ClimateCrisis. But theyre also key agents for change. Women s contribution to nature-based solutions and climate adaptation creates a ripple effect for families and communities.Empowering women is crucial for a world where people and nature thrive. Its vital their voices be heard. They must be equally represented to drive change. ....#COP29 #ActForOurPlanet,https://imgs.socialinsider.io/instagram/2024/11/wwf_18038406710254457.jpeg,0.1607,2024-11-20 10:46:00,CAROUSEL_ALBUM,Posts_wwf_18_Apr_2024_17_Apr_2025_2c9f 2_CLEANED_71.jpeg
This is the dramatic shrinking of the Aral Sea in just a few decades.  Excessive water extraction along with other factors has pushed this once-thriving body of water to the brink. This isn t just an environmental crisis it s a human one too. Losing the Aral Sea has devastated local communities affecting livelihoods health and food security. This drastic change shows how our actions in one part of the world can impact everyone.We re taking too much from our planet and not giving enough back. It s time to change our ways and protect our shared home.,https://imgs.socialinsider.io/instagram/2025/02/wwf_17958528644894609.jpeg,0.16067,2025-02-03 11:00:00,reel,Posts_wwf_18_Apr_2024_17_Apr_2025_2c9f 2_CLEANED_72.jpeg
Severe drought is dangerous for people and nature. And they re made worse by the changes in our climate   lasting longer and longer.This is the story of what happened in Kenya during such a time. In 2022 a drought in the country threatened the lives of people their livestock and wildlife to an unprecedented degree. In fact it threatened to wipe out a generation of elephants.This crisis demands urgent climate action. Share to help spread the word  WWF_Kenya,https://imgs.socialinsider.io/instagram/2025/04/wwf_18081606397672017.jpeg,0.16003,2025-04-15 11:01:00,reel,Posts_wwf_18_Apr_2024_17_Apr_2025_2c9f 2_CLEANED_73.jpeg
Big or small wild animals are vital to the health of our planet   and to our own survival. Like parrotfish.   In marine reserves where parrot fishing is prohibited coral reefs are SIX TIMES more resilient to bleaching and other disturbances. The #NaturesTechnicians report shows just how essential biodiversity   from mammals to invertebrates   is in maintaining the resilience of ecosystems.As #COP16Colombia approaches it s crucial that leaders #ActForOurPlanet. Our future depends on it. #WWFUntangledDiscover more in our story.,https://imgs.socialinsider.io/instagram/2024/10/wwf_18034708901049547.jpeg,0.1576,2024-10-18 06:02:00,reel,Posts_wwf_18_Apr_2024_17_Apr_2025_2c9f 2_CLEANED_74.jpeg
What does it take to restore habitats for wild elephants? Kui Buri National Park Thailand once pineapple fields is being transformed into a haven for wild elephants. WWF-Thailand (wwfthailand) and local communities are creating waterholes planting grasses and replenishing food sources to support the growing elephant population and other wildlife. Their efforts are once again helping these majestic creatures thrive in their natural habitat. Double tap to show your love for #elephants!,https://imgs.socialinsider.io/instagram/2024/08/wwf_17945100923837431.jpeg,0.15722,2024-08-12 15:27:00,reel,Posts_wwf_18_Apr_2024_17_Apr_2025_2c9f 2_CLEANED_75.jpeg
It s true.  If we lose rivers lakes and wetlands we lose the water that sustains us our food and other species.Because water doesn t just come from the tap it comes from nature.   Without urgent action over half of the world s population could face severe water shortages by 2030.Healthy freshwater environments underpin societies and economies. We need to restore and protect our freshwater. Share this post if you re with us!,https://imgs.socialinsider.io/instagram/2025/01/wwf_18054467441080727.jpeg,0.15628,2025-01-28 10:01:00,reel,Posts_wwf_18_Apr_2024_17_Apr_2025_2c9f 2_CLEANED_76.jpeg
Local action = global impact   And Natalia Botero-Acosta is the perfect example. As the Director of macuaticos Natalia is making a huge impact in her community and beyond. With her work focused on the Gulf of Tribug  on Colombia s Pacific coast Natalia is collaborating closely with the local community to study and protect humpback whales. Over the years her conservation efforts have deeply engaged the community. A touching example: Neymar first got involved in the project as a boat assistant is now an active field team member helping launch drones to study whales from the sky.For the future of people and the planet #NaturesHeroes like Natalia are leading the change!,https://imgs.socialinsider.io/instagram/2025/01/wwf_18028284596564380.jpeg,0.15295,2025-01-10 10:48:00,CAROUSEL_ALBUM,Posts_wwf_18_Apr_2024_17_Apr_2025_2c9f 2_CLEANED_77.jpeg
Changing our ways can change our planet!   Zinori Bikorwomuhangi a former illegal forest harvester now collaborates with his community to turn poachers into conservationists. Together they re planting more trees than they ever cut protecting wildlife and fostering sustainable livelihoods. Share this post to spread the word: We can all make a difference for people and the planet,https://imgs.socialinsider.io/instagram/2024/08/wwf_18056839534668275.jpeg,0.15231,2024-08-24 12:00:00,CAROUSEL_ALBUM,Posts_wwf_18_Apr_2024_17_Apr_2025_2c9f 2_CLEANED_78.jpeg
River dolphins are extraordinary. They are the apex predators in some of the world s greatest river systems.  But were losing them. River dolphin populations have plummeted by 73% since the 1980s.Double tap if you want greater protection for nature and people!,https://imgs.socialinsider.io/instagram/2024/05/wwf_18014570834354629.jpeg,0.15091,2024-05-10 13:28:00,reel,Posts_wwf_18_Apr_2024_17_Apr_2025_2c9f 2_CLEANED_79.jpeg
From cheetah sprints to whale dives the 2024 summer games had us thinking natures athletes would fit right in!   These moves on the track or in the wild are pure gold.  Tell us which is your favourite #GoldMedalMove?,https://imgs.socialinsider.io/instagram/2024/08/wwf_18016731680238477.jpeg,0.15083,2024-08-13 10:40:00,reel,Posts_wwf_18_Apr_2024_17_Apr_2025_2c9f 2_CLEANED_80.jpeg
Imagine you lean back and forth on a chair swinging. You might be able to stabilise yourself for a bit. But eventually you ll fall.That s how nature s tipping points work.Melting ice sheets coral reef die-off disrupted ocean currents and thawing permafrost could lead to irreversible damage.Only if we #ActforOurPlanet now can we turn things around. Share this post to help raise awareness. #WWFUntangled #LivingPlanetReport #LPR2024,https://imgs.socialinsider.io/instagram/2024/10/wwf_17892544314016966.jpeg,0.15011,2024-10-15 10:32:00,reel,Posts_wwf_18_Apr_2024_17_Apr_2025_2c9f 2_CLEANED_81.jpeg
It s time to rise with ambition and move with speed. Urgent action is crucial to avert the gravest impacts of the climate crisis!Drop a  emoji if you support ambitious climate action for people and nature. #COP29 #ActForOurPlanet,https://imgs.socialinsider.io/instagram/2024/11/wwf_18169995529313081.jpeg,0.14879,2024-11-09 10:00:00,CAROUSEL_ALBUM,Posts_wwf_18_Apr_2024_17_Apr_2025_2c9f 2_CLEANED_82.jpeg
#DidYouKnow this about our amazing ocean?These videos aren t just of stunning ecosystems you re also looking at powerful allies in tackling the #ClimateCrisis!  Mangroves absorb and store more CO2 than other forests.  Seagrass beds are  blue carbon  sinks that trap CO2 mitigating global warming.  Coral reefs protect shorelines from storms and erosion. Let s unite and protect these climate heroes.,https://imgs.socialinsider.io/instagram/2025/04/wwf_18036769628537801.jpeg,0.1461,2025-04-01 11:58:00,reel,Posts_wwf_18_Apr_2024_17_Apr_2025_2c9f 2_CLEANED_83.jpeg
The island of Runde in Norway is home to more than 200 bird species - including Gannets Shags Puffins Razorbills Oystercatchers and many more. But their home is being overrun with plastic ghost gear - discarded at sea and collected by the birds to build their nests to raise their young. This is not the way it is supposed to be. Double tap to show your support for a strong global plastic pollution treaty to end the plastic crisis once and for all.  ...#BanIt #StopPlasticPollution #INC5,https://imgs.socialinsider.io/instagram/2024/11/wwf_17997816326535500.jpeg,0.14546,2024-11-29 11:30:00,CAROUSEL_ALBUM,Posts_wwf_18_Apr_2024_17_Apr_2025_2c9f 2_CLEANED_84.jpeg
Nature and our climate are being destroyed at a rate unprecedented in human history.  Today four billion people experience severe water scarcity for at least one month every year. And half of the world s corals have already been lost. We must act now to protect people and nature   and work together to overcome one of the greatest challenges of our time. Double tap this if you want greater climate action for our people and nature!...#WWFUntangled  #nature #climatecrisis,https://imgs.socialinsider.io/instagram/2024/09/wwf_18017020937600138.jpeg,0.14122,2024-09-03 12:02:00,reel,Posts_wwf_18_Apr_2024_17_Apr_2025_2c9f 2_CLEANED_85.jpeg
It s true.  If we lose rivers lakes and wetlands we lose the water that sustains us our food and other species.Because water doesn t just come from the tap it comes from nature.   Without urgent action half of the world s population will face severe water shortages by 2030.Healthy freshwater environments underpin societies and economies. For people and nature we need to restore and protect our freshwater. Share this post if you re with us! #SeineRiverRun #RunBlue #GenerationRestoration,https://imgs.socialinsider.io/instagram/2024/06/wwf_17986340618659006.jpeg,0.14111,2024-06-07 10:39:00,reel,Posts_wwf_18_Apr_2024_17_Apr_2025_2c9f 2_CLEANED_86.jpeg
Did you know that Nepal is home to hundreds of snow leopards?  It s not easy to see these shy elusive big cats   theyre masters of camouflage. But even though they can t always be seen their presence in their environment helps maintain the delicate balance of nature. We can t let them disappear. For people and the planet.And citizen scientists help us understand more about these animals.  ...#wildlife #snowleopards #nature,https://imgs.socialinsider.io/instagram/2024/05/wwf_18021790880235665.jpeg,0.13842,2024-05-15 13:01:00,reel,Posts_wwf_18_Apr_2024_17_Apr_2025_2c9f 2_CLEANED_87.jpeg
Believe it or not tuna poop is crucial for our ocean s health  Like how fertiliser makes plants grow tuna helps plankton grow in our ocean which produces oxygen and absorbs CO2 emissions.Double tap if you agree we must do more to restore our ocean and planet!  ..#GenerationRestoration,https://imgs.socialinsider.io/instagram/2024/08/wwf_18034836656504719.jpeg,0.13831,2024-08-17 13:01:00,reel,Posts_wwf_18_Apr_2024_17_Apr_2025_2c9f 2_CLEANED_88.jpeg
Did you know? One of the main drivers of the loss of oceanic sharks and rays is overfishing.More needs to be done to support sustainable use of our oceans and ensure nature and people live in harmony together for years to come  Double tap to show your support!,https://imgs.socialinsider.io/instagram/2024/05/wwf_17858056491125499.jpeg,136.0,2024-05-18 13:01:00,reel,Posts_wwf_18_Apr_2024_17_Apr_2025_2c9f 2_CLEANED_89.jpeg
Alongside greenpeace and breakfreefromplastic we shared the call of more than 2.9 million people around the world for a strong binding #PlasticsTreaty.On behalf of our supporters nikita_gill Hannah Kim and Jeah Han raised their voices to call on governments to make good on their promise to end plastic pollution.Now is the time to deliver. The world is watching.(Globe model designed by kimmmunna),https://imgs.socialinsider.io/instagram/2024/11/wwf_18058577611846607.jpeg,0.13214,2024-11-26 07:22:00,reel,Posts_wwf_18_Apr_2024_17_Apr_2025_2c9f 2_CLEANED_90.jpeg
When you think of tuna do you think of   or  ? Tuna help maintain the health of our ocean   and even our climate   all while feeding millions of people  We need to allow tuna populations to recover from overfishing   Fish will continue to be a part of our diets but how we catch them and how much we consume matters. If we act now we can fix this. #WWFUntangled,https://imgs.socialinsider.io/instagram/2025/03/wwf_17903418609112385.jpeg,0.1267,2025-03-29 09:01:00,reel,Posts_wwf_18_Apr_2024_17_Apr_2025_2c9f 2_CLEANED_91.jpeg
You may not know this but... Nature is our greatest ally in tackling the #ClimateCrisis. If we take care of it it will take care of us right back.  Right now we re witnessing a planetary crisis unfold. Wildfires floods droughts: it s never been clearer that we need urgent action for our planet. Nature is integral to the solution. It s time we value it properly. #COP29 #ActForOurPlanet,https://imgs.socialinsider.io/instagram/2024/11/wwf_17948398874892538.jpeg,0.12598,2024-11-17 09:02:00,reel,Posts_wwf_18_Apr_2024_17_Apr_2025_2c9f 2_CLEANED_92.jpeg
