Caption,Image Link,Eng. Rate by Followers,Date,Type,Image Filename
For decades the ocean has absorbed the impact of burning fossil fuels. But now with record-breaking marine heatwaves ecosystems are reaching their limits   and we re all #InHotWater.  From coral bleaching to more powerful storms the impacts are cascading across our blue planet. Coastal communities marine life and our future is at risk.It s time to stop burning fossil fuels and urgently transition to renewables.The ocean   and all of us   depend on it. #COP29 #ActForOurPlanet,https://imgs.socialinsider.io/instagram/2024/11/wwf_17928168356966902.jpeg,5.1499,2024-11-12 14:39:00,reel,Posts_wwf_18_Apr_2024_17_Apr_2025_2c9f 2_CLEANED_0.jpeg
The Arctic is warming almost THREE TIMES faster than the rest of the planet. A warmer Arctic accelerates global heating rise in sea levels loss of ecosystems and more. To safeguard the Arctic and our planet the amount of greenhouse gas emissions being released into the atmosphere must decrease.Double tap if you want leaders to take greater climate action! #COP29,https://imgs.socialinsider.io/instagram/2024/11/wwf_18051299974800668.jpeg,1.52203,2024-11-07 10:02:00,reel,Posts_wwf_18_Apr_2024_17_Apr_2025_2c9f 2_CLEANED_1.jpeg
Our discarded plastic doesn t disappear it lingers polluting our planet and impacting people and nature .But it s not too late to act. Together we can #StopPlasticPollution.Demand for change now. Link in bio. #inc4,https://scontent-fra5-2.cdninstagram.com/v/t51.29350-15/440756729_1138409144248247_6925541852988673026_n.jpg?stp=dst-jpg_e35_tt6&_nc_cat=107&ccb=1-7&_nc_sid=18de74&_nc_ohc=cWuTtl7VGWMQ7kNvwE-3gf5&_nc_oc=Adl8qOPXUkQvPVGyPkZLOFiT6PTj7-IqXn0B5G1_FfAQg6pVNRjC8AGD2EFN9aWmpho&_nc_zt=23&_nc_ht=scontent-fra5-2.cdninstagram.com&edm=AL-3X8kEAAAA&_nc_gid=EEipd4xxJaaLRVKZgRty7Q&oh=00_AfH1udKhtZvIFe8Zfx0cx7JD0U-P2ZfcFZKqKQUruyaflA&oe=68048676,1.45723,2024-04-29 15:44:00,CAROUSEL_ALBUM,
We are way off track to avert a climate catastrophe  This is our chance to turn things around. Double tap if you agree: Leaders need to do more to tackle the #ClimateCrisis! #COP29 #ActForOurPlanet,https://imgs.socialinsider.io/instagram/2024/11/wwf_18034831268076392.jpeg,1.36356,2024-11-08 10:00:00,IMAGE,Posts_wwf_18_Apr_2024_17_Apr_2025_2c9f 2_CLEANED_3.jpeg
Did you know? #Rainforests are home to an incredible diversity of life!However we are losing these habitats at an alarming rate We must take action to protect rainforests.Double tap to show your support,https://imgs.socialinsider.io/instagram/2024/09/wwf_18012165680356877.jpeg,1.2057,2024-09-30 18:00:00,CAROUSEL_ALBUM,Posts_wwf_18_Apr_2024_17_Apr_2025_2c9f 2_CLEANED_4.jpeg
2024 was just declared the hottest year on record. We need bold action in 2025   more renewable energy ecosystem restoration and ambitious climate goals. Our window to avoid the worst impacts is closing fast and those who ve contributed the least emissions are suffering the most. The time for talk is over. We must act now to protect our planet and the communities in the most vulnerable situations.,https://imgs.socialinsider.io/instagram/2025/01/wwf_18130656703356946.jpeg,1.20481,2025-01-11 10:00:00,CAROUSEL_ALBUM,Posts_wwf_18_Apr_2024_17_Apr_2025_2c9f 2_CLEANED_5.jpeg
POV: It s Monday morning but you re still in weekend mode...,https://imgs.socialinsider.io/instagram/2025/01/wwf_17862435102325378.jpeg,0.94555,2025-01-20 10:01:00,reel,Posts_wwf_18_Apr_2024_17_Apr_2025_2c9f 2_CLEANED_6.jpeg
Tiny-but-mighty: Monarch butterflies make one of the largest insect migrations in the world!Their journey spans an incredible 2500 miles  Throughout their migration they play a crucial role in pollination.However climate change deforestation and land conversion have hit them hard. In just 20 years we ve seen an alarming 80% population decline.We must band together to protect this essential and amazing species. Double tap if you agree,https://imgs.socialinsider.io/instagram/2024/11/wwf_18043816838509531.jpeg,0.9147,2024-11-05 13:30:00,CAROUSEL_ALBUM,Posts_wwf_18_Apr_2024_17_Apr_2025_2c9f 2_CLEANED_7.jpeg
The future of our planet is shaped by incredible individuals and communities. Because they are #NaturesHeroes.Like wwfmy Tiger Anti-Poaching Team and Sarawak Wildlife Conservation Team.Through their incredible work they have:  Achieved a 98% reduction in active snares and capturing footage of Malayan tiger cubs  Collected over a million images through camera traps and conducting orangutan nest surveys in Sarawak  Bettered survival for our endangered speciesTheir hard work has earned each team a Star Golden Hearts Award 2024   recognising their extraordinary commitment to Malaysia s wildlife.Here s to a year filled with hope resilience and continued progress in conservation. Share if you are with us!,https://imgs.socialinsider.io/instagram/2025/01/wwf_18027681266537452.jpeg,0.84216,2025-01-06 10:01:00,CAROUSEL_ALBUM,Posts_wwf_18_Apr_2024_17_Apr_2025_2c9f 2_CLEANED_8.jpeg
#BREAKING: The #IberianLynx population has grown 21% in one year reaching 2021 last year.  This remarkable growth brings the species halfway to its full recovery.This historic milestone was made possible by 21 organisations including WWFspain. Double tap to show your support  ...#wildlife #nature #environment #conservation,https://imgs.socialinsider.io/instagram/2024/06/wwf_17901511934922566.jpeg,0.77027,2024-06-20 11:41:00,CAROUSEL_ALBUM,Posts_wwf_18_Apr_2024_17_Apr_2025_2c9f 2_CLEANED_9.jpeg
The local communities of the Ile-Balkhash region are helping drive the historic return of tigers to Kazakhstan after 70 years of extinction.  Last year an ambitious project saw two Amur tigers Bodhana and Kuma making a roaring comeback to the area. From adopting sustainable farming practices to preparing for eco-tourism the communities are helping the Ile-Balkhash delta. They are restoring critical species   like the Bukhara deer and Kulan   and replanting forests. Their efforts are not just bringing back tigers   they re bringing life pride and prosperity to the region.This ambitious project   by wereldnatuurfonds the Kazakh government and UNDP   shows #NaturesHeroes are key to conservation successes.,https://imgs.socialinsider.io/instagram/2025/01/wwf_18012572489673476.jpeg,0.72133,2025-01-08 10:11:00,CAROUSEL_ALBUM,Posts_wwf_18_Apr_2024_17_Apr_2025_2c9f 2_CLEANED_10.jpeg
POV: It s Monday morning but you re still in weekend mode...,https://imgs.socialinsider.io/instagram/2024/05/wwf_17993027732622968.jpeg,0.65761,2024-05-06 14:51:00,reel,Posts_wwf_18_Apr_2024_17_Apr_2025_2c9f 2_CLEANED_11.jpeg
Stop scrolling and take a moment to witness something truly special In celebration of #WorldWildlifeDay we re excited to share never-before-seen camera trap footage of leopards and tigers in northeast China. These incredible animals are thriving thanks to years of conservation efforts focused on habitat restoration.But there s still more work to be done because when we protect tigers we protect so much more  #WorldWildlifeDay,https://imgs.socialinsider.io/instagram/2025/03/wwf_18058688798492000.jpeg,0.64003,2025-03-03 17:02:00,reel,Posts_wwf_18_Apr_2024_17_Apr_2025_2c9f 2_CLEANED_12.jpeg
Did you know? One out of every three bites of food you take depends on pollinators.These tiny-but-mighty animals are vital to our survival   maintaining our life-sustaining food systems.  Double tap to show support for the incredible life on the planet!,https://imgs.socialinsider.io/instagram/2025/02/wwf_18533627464040444.jpeg,0.62024,2025-02-07 09:59:00,reel,Posts_wwf_18_Apr_2024_17_Apr_2025_2c9f 2_CLEANED_13.jpeg
Our discarded plastic doesnt disappear it lingers polluting our planet and impacting people and nature  But it s not too late to act. Together we can#StopPlasticPollution.Demand for change now. Link in bio. #INC4,https://imgs.socialinsider.io/instagram/2024/04/wwf_18167365393306304.jpeg,0.60359,2024-04-26 14:00:00,CAROUSEL_ALBUM,Posts_wwf_18_Apr_2024_17_Apr_2025_2c9f 2_CLEANED_14.jpeg
Plastics are everywhere   in the air we breathe the food we eat and the water we drink. Governments will soon gather for the final round of negotiations on a Global Plastic Pollution Treaty. Decisions made in these negotiations will determine the future for today s children and generations to come. Failure to agree on a strong binding treaty risks turning a moment of hope into one of irreversible harm. The world is watching. Visit the link in our bio to vote YES for a strong and binding global treaty. ...#BanIt #StopPlasticPollution #INC5,https://imgs.socialinsider.io/instagram/2024/11/wwf_18016893209367776.jpeg,0.54241,2024-11-23 07:00:00,IMAGE,Posts_wwf_18_Apr_2024_17_Apr_2025_2c9f 2_CLEANED_15.jpeg
2025  We re going to keep working for a better world for people and nature.What do you wish for in the new year?comedywildlifephoto,https://imgs.socialinsider.io/instagram/2025/01/wwf_18074200780711018.jpeg,0.54057,2025-01-01 10:00:00,IMAGE,Posts_wwf_18_Apr_2024_17_Apr_2025_2c9f 2_CLEANED_16.jpeg
The #ClimateCrisis is changing reality for wildlife. THE HERDS is a bold reminder that nature cant wait. Follow the journey   because extinction is forever. Join #TheHerds journey and discover how we can act for people and nature...THE HERDS   tresorsnack wise.photographer,https://imgs.socialinsider.io/instagram/2025/04/wwf_17941819493861304.jpeg,0.53107,2025-04-17 11:18:00,reel,Posts_wwf_18_Apr_2024_17_Apr_2025_2c9f 2_CLEANED_17.jpeg
Happy #weekend!   Tell us: What s your favourite thing about our planet?,https://imgs.socialinsider.io/instagram/2024/09/wwf_17863366170164354.jpeg,0.50243,2024-09-15 09:00:00,CAROUSEL_ALBUM,Posts_wwf_18_Apr_2024_17_Apr_2025_2c9f 2_CLEANED_18.jpeg
In the heart of Laos the Nam Poui National Protected Area is a haven for rare wildlife including the iconic Asian #elephant.But despite its beauty this vast forest faces hidden threats like illegal logging and rampant snaring.Through data collection and community engagement WWF-Laos and local communities are working tirelessly to safeguard these majestic creatures and restore their home.Double tap to show your support for elephants,https://imgs.socialinsider.io/instagram/2024/08/wwf_18419154634075993.jpeg,0.4349,2024-08-14 14:00:00,CAROUSEL_ALBUM,Posts_wwf_18_Apr_2024_17_Apr_2025_2c9f 2_CLEANED_19.jpeg
Marine heatwaves are breaking records as the #ClimateCrisis accelerates and sea temperatures are hitting all-time highs. Hotter water holds less oxygen making it hard for some fish to survive. Fish like tuna can migrate to cooler waters but this unexpected movement disrupts coastal communities and global seafood supply chains.  Marine heatwaves are just one way we face the consequences of a warming planet. But there s hope. By reducing fossil fuels and protecting resilient ecosystems we can #SaveOurOcean. Share this if you re with us!  ....coralreefrescueinitiative #WWFUntangled,https://imgs.socialinsider.io/instagram/2024/06/wwf_17856431013193947.jpeg,0.42457,2024-06-17 14:17:00,reel,Posts_wwf_18_Apr_2024_17_Apr_2025_2c9f 2_CLEANED_20.jpeg
Live footage of us this holiday season. Best wishes to you all! comedywildlifephoto,https://imgs.socialinsider.io/instagram/2024/12/wwf_18151093834347889.jpeg,0.39295,2024-12-24 10:00:00,IMAGE,Posts_wwf_18_Apr_2024_17_Apr_2025_2c9f 2_CLEANED_21.jpeg
The Sumatra forest is not just beautiful it s a lifeline for us all:  The forest s trees are Earth s natural air purifiers. They absorb carbon dioxide and give us the fresh clean air we need to breathe.  It helps to regulate global climate patterns.  It s woven into the cultural fabric of the region. It s not just trees it s stories traditions and a connection to the land that sustains us.  It s a treasure trove of unique species. Preserving it ensures the delicate balance of our ecosystems supporting countless plant and animal species.  It s crucial for maintaining water cycles ensuring a steady and clean water supplyLet s stand together to protect the Sumatra forest   because when we care for nature we re safeguarding our well-being. Double tap if you agree!,https://imgs.socialinsider.io/instagram/2024/07/wwf_18102657292416110.jpeg,0.38742,2024-07-02 12:21:00,CAROUSEL_ALBUM,Posts_wwf_18_Apr_2024_17_Apr_2025_2c9f 2_CLEANED_22.jpeg
You can find it on the highest peaks and in the deepest seas. In your home. In your food. And yes even in your body  Plastic. It s everywhere   and it s getting out of hand. If we keep going at this rate plastic pollution could triple by 2040.  The global plastic treaty is our one chance to #StopPlasticPollution. Tap the link in our bio to demand for change. #INC4 #EarthDay,https://imgs.socialinsider.io/instagram/2024/04/wwf_18123915181351004.jpeg,0.38027,2024-04-22 18:02:00,reel,Posts_wwf_18_Apr_2024_17_Apr_2025_2c9f 2_CLEANED_23.jpeg
Did you know? There are over 60000 known species of trees in the world.  And more are being identified to science every year!,https://imgs.socialinsider.io/instagram/2024/10/wwf_18046220032989821.jpeg,0.37055,2024-10-05 12:00:00,CAROUSEL_ALBUM,Posts_wwf_18_Apr_2024_17_Apr_2025_2c9f 2_CLEANED_24.jpeg
Severe drought is dangerous for people and nature. And they re made worse by the changes in our climate   lasting longer and longer.This is the story of what happened in Kenya during such a time. In 2022 a drought in the country threatened the lives of people their livestock and wildlife to an unprecedented degree. In fact it threatened to wipe out a generation of elephants.This crisis demands urgent climate action. Share to help spread the word  WWF_Kenya,https://imgs.socialinsider.io/instagram/2024/09/wwf_18007133477433871.jpeg,0.36711,2024-09-14 12:02:00,reel,Posts_wwf_18_Apr_2024_17_Apr_2025_2c9f 2_CLEANED_25.jpeg
THIS is shocking: In just under 20 years global plastic waste has doubled   Driven by single-use plastic products.And the people most impacted? They re the people who have done the least to contribute to the plastics crisis.We can t let this pattern continue   It s time for governments to champion a robust #GlobalPlasticsTreaty that safeguards people and the planet. We must turn single-use to #ZeroUse. Help us #StopPlasticPollution. Tap the link in our bio to take action!,https://imgs.socialinsider.io/instagram/2024/04/wwf_17980937234513047.jpeg,0.36544,2024-04-20 15:00:00,CAROUSEL_ALBUM,Posts_wwf_18_Apr_2024_17_Apr_2025_2c9f 2_CLEANED_26.jpeg
Happy #weekend!  Tell us: What s your favourite thing about our planet?,https://imgs.socialinsider.io/instagram/2025/01/wwf_17847484422376795.jpeg,0.35837,2025-01-25 10:00:00,CAROUSEL_ALBUM,Posts_wwf_18_Apr_2024_17_Apr_2025_2c9f 2_CLEANED_27.jpeg
Meet some of the #NewMekongSpecies newly recorded by science each a unique wonder of nature yet already under threat.From habitat destruction to illegal wildlife trade these dangers mean countless species might vanish before we even know they exist.  Double tap if you agree we must do more to protect our planet s amazing nature.,https://imgs.socialinsider.io/instagram/2024/12/wwf_18076625785612000.jpeg,0.34979,2024-12-18 09:59:00,CAROUSEL_ALBUM,Posts_wwf_18_Apr_2024_17_Apr_2025_2c9f 2_CLEANED_28.jpeg
Did you know? When green turtles munch on seagrass they make it grow better and more nutritious. Their grazing helps the seagrass thrive which traps sediments and protects our coastlines from erosion storms and rising sea levels.Every year thousands of sea turtles face numerous threats. But thanks to the efforts of WWF Malaysia and local communities these magnificent animals have a fighting chance. From protecting nesting sites to rescuing injured turtles every action counts. Double tap to show your support for these amazing animals and our oceans!   wwfmy,https://imgs.socialinsider.io/instagram/2025/04/wwf_18399282172100649.jpeg,0.34048,2025-04-03 10:00:00,CAROUSEL_ALBUM,Posts_wwf_18_Apr_2024_17_Apr_2025_2c9f 2_CLEANED_29.jpeg
Did you know? #CoralReefs cover only 0.1% of the area of the ocean but they support a quarter of all marine species on the planet.What s your favourite fact about our planet?,https://imgs.socialinsider.io/instagram/2024/06/wwf_18033543614508274.jpeg,0.33889,2024-06-30 10:00:00,CAROUSEL_ALBUM,Posts_wwf_18_Apr_2024_17_Apr_2025_2c9f 2_CLEANED_30.jpeg
Jaguars in Latin America are in danger.They ve lost 50% of their original range and threats like hunting and environmental changes aren t slowing down. As apex predators jaguars are vital for keeping ecosystems in balance and supporting the healthy environments people depend on.It s time to rebrand their future   not just for jaguars but for the planet we all call home. Share this post: Let s make a change.   #ConnectingTheSpots #InternationalJaguarDay,https://imgs.socialinsider.io/instagram/2024/11/wwf_17917787646002653.jpeg,0.33344,2024-11-29 10:30:00,IMAGE,Posts_wwf_18_Apr_2024_17_Apr_2025_2c9f 2_CLEANED_31.jpeg
#BREAKING! This is code red for nature: Species population numbers have plummeted by 73% on average since 1970.This is getting worse over time when it should be getting better. Vital ecosystems are on the brink of collapse. We re dangerously close to tipping points where the damage to our planet will cause irreversible impacts on all our lives.The signs are clear: we must act NOW. Not tomorrow not next year. Urgent action is needed immediately.It s time to act like our lives depend on it. Because they do.  Share this video to #ActForOurPlanet...#LPR2024 #LivingPlanetReport,https://imgs.socialinsider.io/instagram/2024/10/wwf_18089748703493698.jpeg,0.32935,2024-10-10 01:17:00,reel,Posts_wwf_18_Apr_2024_17_Apr_2025_2c9f 2_CLEANED_32.jpeg
Discover the wonders of the Congo Basin! From vibrant plants to rare wildlife 742 new species have been unveiled between 2013 and 2023 Double tap to show your love for our planet s incredible biodiversity!,https://imgs.socialinsider.io/instagram/2024/12/wwf_18017360096641888.jpeg,0.31714,2024-12-03 10:00:00,CAROUSEL_ALBUM,Posts_wwf_18_Apr_2024_17_Apr_2025_2c9f 2_CLEANED_33.jpeg
The Himalayas   one of the worlds most iconic mountain ranges   are a crucial source of freshwater for millions of people downstream. They remind us that mountains play a vital role in maintaining our planets delicate ecosystems. Lets work together to protect these majestic giants and ensure a sustainable future for all!   jamesmorganfoto,https://imgs.socialinsider.io/instagram/2025/03/wwf_18068195527880332.jpeg,0.31143,2025-03-05 16:30:00,CAROUSEL_ALBUM,Posts_wwf_18_Apr_2024_17_Apr_2025_2c9f 2_CLEANED_34.jpeg
What s your favourite #NewMekongSpecies?,https://imgs.socialinsider.io/instagram/2024/12/wwf_18119049955415007.jpeg,0.30859,2024-12-20 11:40:00,CAROUSEL_ALBUM,Posts_wwf_18_Apr_2024_17_Apr_2025_2c9f 2_CLEANED_35.jpeg
Citizen scientists help make amazing discoveries!  Thanks to their efforts new species are being recorded. The discovery of Begonia kayinensis wouldn t have been possible without the involvement of citizen scientists  says Mya Bhone Maw a PhD student documenting Myanmar s biodiversity in remote under-researched areas.  .#CitizenScience,https://imgs.socialinsider.io/instagram/2024/12/wwf_18049399913107327.jpeg,0.26822,2024-12-19 10:01:00,CAROUSEL_ALBUM,Posts_wwf_18_Apr_2024_17_Apr_2025_2c9f 2_CLEANED_36.jpeg
#Nature never ceases to amaze us.  The #AuroraBorealis is a true wonder of the world a breathtaking reminder of the beauty and power of nature.If you haven t already is seeing it in person on your bucket list?,https://imgs.socialinsider.io/instagram/2024/12/wwf_18048823504890709.jpeg,0.26766,2024-12-09 10:40:00,reel,Posts_wwf_18_Apr_2024_17_Apr_2025_2c9f 2_CLEANED_37.jpeg
You ve heard the word  biodiversity  but do you know what it means for us and the planet?   Sir David Attenborough explains why biodiversity is crucial for all life on Earth   #ShareOurPlanet,https://imgs.socialinsider.io/instagram/2025/02/wwf_18084614161599024.jpeg,0.26565,2025-02-12 10:31:00,reel,Posts_wwf_18_Apr_2024_17_Apr_2025_2c9f 2_CLEANED_38.jpeg
#DYK The Amazon and Sumatran rainforests are uniquely diverse and continents apart yet they have many things in common:- They are home to incredible creatures big and small  - They are threatened by deforestation  - They can help fight climate change  Double tap to show your support for our amazing forests,https://imgs.socialinsider.io/instagram/2025/01/wwf_18047645119973191.jpeg,0.25729,2025-01-23 10:00:00,CAROUSEL_ALBUM,Posts_wwf_18_Apr_2024_17_Apr_2025_2c9f 2_CLEANED_39.jpeg
LAWNMOWERS OF THE SEA  Did you know? When green turtles munch on seagrass they actually make the seagrass grow better and become more nutritious! Their grazing helps the seagrass thrive which in turn traps sediments and protects our coastlines from erosion storms and rising sea levels.Every year thousands of sea turtles face numerous threats. But thanks to the efforts of WWF Malaysia and local communities these magnificent creatures have a fighting chance. From protecting nesting sites to rescuing injured turtles every action counts. Let s come together to support their survival and ensure a brighter future for our oceans.  wwfmy...#SaveTheTurtles #WWF #Conservation,https://imgs.socialinsider.io/instagram/2024/07/wwf_18016179290435566.jpeg,0.2557,2024-07-15 13:56:00,CAROUSEL_ALBUM,Posts_wwf_18_Apr_2024_17_Apr_2025_2c9f 2_CLEANED_40.jpeg
A stunning pit viper with scales that look like long eyelashes   A leafless orchid found in a market  A ginger species with a root that smells like mangoThese are just some of the species in the Mekong which have not been previously recorded by science!But many of these species are already under threat of extinction.Double tap if you agree governments must better protect these rare amazing animals and their habitats.,https://imgs.socialinsider.io/instagram/2024/12/wwf_17970337649683867.jpeg,0.24776,2024-12-16 14:36:00,CAROUSEL_ALBUM,Posts_wwf_18_Apr_2024_17_Apr_2025_2c9f 2_CLEANED_41.jpeg
Today four billion people experience severe water scarcity for at least one month every year. And half of the world s corals have already been lost.This is because nature is in crisis.  Right now it s being destroyed at a rate unprecedented in human history.We must act now to protect people and nature   and work together to overcome one of the greatest challenges of our time. We need to reverse nature loss ending the decade with more nature than we started with not less.  Leaders: The time to act is NOW. Share this post to call for action!...#WWFUntangled #BiodiversityDay #nature #climatecrisis,https://imgs.socialinsider.io/instagram/2024/05/wwf_17981329577676999.jpeg,0.24726,2024-05-22 15:14:00,reel,Posts_wwf_18_Apr_2024_17_Apr_2025_2c9f 2_CLEANED_42.jpeg
What does chilli have to do with elephants?  For Mathews Chilambe and Chamunolwa Jimayi the answer is a creative solution to reduce human-elephant conflict in South Dambwa Zambia.As members of the Conservation and Tourism Society (CATS) Mathews and Chamunolwa have turned chili into a powerful tool for both conservation and community support.Through an innovative outgrower scheme CATS purchases locally grown chilli providing farmers with a steady income and a reliable market. The chili is then transformed into chilli bricks    natural deterrents that help keep elephants away from crops and villages.Their approach is all about bringing people and wildlife together ensuring a peaceful coexistence. #NaturesHeroes like Mathews and Chamunolwa are leading the way toward a future where people live in harmony with nature. wereldnatuurfonds,https://imgs.socialinsider.io/instagram/2025/01/wwf_18090331642533849.jpeg,0.23595,2025-01-15 10:00:00,CAROUSEL_ALBUM,Posts_wwf_18_Apr_2024_17_Apr_2025_2c9f 2_CLEANED_43.jpeg
Take two breaths  did you do it?  Now thank the ocean because it produces half the oxygen you breathe   all day every day!  It also absorbs heat and CO2 from the atmosphere. Really it s working round the clock to keep our climate in balance. But our ocean is in trouble. Since the 1970s populations of oceanic sharks and rays have plummeted by over 70%. It s vital we reduce the pressure from overfishing and climate change protect habitats and reduce plastic pollution  Share this post to give our ocean a voice!,https://imgs.socialinsider.io/instagram/2025/03/wwf_17925902214021970.jpeg,0.2271,2025-03-26 16:28:00,CAROUSEL_ALBUM,Posts_wwf_18_Apr_2024_17_Apr_2025_2c9f 2_CLEANED_44.jpeg
Migratory freshwater fishes are in freefall with populations crashing by 81% on average in the past 50 years due to hydropower dams habitat loss overexploitation and pollution. And increasing climate change.Why is this important? Migratory fishes are critical to the food security of 100+ million people the cultures of Indigenous Peoples & local communities and recreational fishing industries worth billions.They re also essential to the health of our rivers and countless other species.Double tap if you agree we must better protect nature and people!,https://imgs.socialinsider.io/instagram/2024/05/wwf_17881752389999279.jpeg,0.21821,2024-05-21 14:32:00,CAROUSEL_ALBUM,Posts_wwf_18_Apr_2024_17_Apr_2025_2c9f 2_CLEANED_45.jpeg
#DYK without mangroves 15M more people would be affected by floods each year?   Mangroves connect rivers oceans and coasts protecting us from storms and erosion. Safeguarding them helps our entire ecosystem. Show love for these natural superheroes!   #WorldOceansDay,https://imgs.socialinsider.io/instagram/2024/06/wwf_17861705712157013.jpeg,0.21654,2024-06-08 04:01:00,reel,Posts_wwf_18_Apr_2024_17_Apr_2025_2c9f 2_CLEANED_46.jpeg
Fossil fuels fuel #ClimateChange. It s time to change that.  Not tomorrow not in a year   actions must start now!World leaders must urgently #ActForOurPlanet. #COP29,https://imgs.socialinsider.io/instagram/2024/11/wwf_18286248220214839.jpeg,0.20879,2024-11-15 09:24:00,reel,Posts_wwf_18_Apr_2024_17_Apr_2025_2c9f 2_CLEANED_47.jpeg
