Psst.   Not 100% sure about what everything means at #COP29   the upcoming UN conference on climate change?You re not alone. We ve broken down common terms you ll hear this year The more you know the more you can #ActForOurPlanet.,https://imgs.socialinsider.io/instagram/2024/11/wwf_18025539764403800.jpeg,0.12571,2024-11-10 10:00:00,CAROUSEL_ALBUM,Posts_wwf_18_Apr_2024_17_Apr_2025_2c9f 2_CLEANED_93.jpeg
Did you know that Nepal is home to hundreds of snow leopards?  It s not easy to see these shy elusive big cats   theyre masters of camouflage. But even though they can t always be seen their presence in their environment helps maintain the delicate balance of nature. We can t let them disappear. For people and the planet.And citizen scientists help us understand more about these animals.,https://imgs.socialinsider.io/instagram/2024/07/wwf_18295211857166114.jpeg,0.12439,2024-07-10 13:02:00,reel,Posts_wwf_18_Apr_2024_17_Apr_2025_2c9f 2_CLEANED_94.jpeg
Why does protecting tigers matter to us all? Landscapes with wild tigers are healthy and vibrant ecosystems which are critically important in a climate-changing world. Double tap to show your   for tigers!...#tigerfinance #investintigers #tigers,https://imgs.socialinsider.io/instagram/2024/04/wwf_17861744793130019.jpeg,0.1242,2024-04-19 15:35:00,reel,Posts_wwf_18_Apr_2024_17_Apr_2025_2c9f 2_CLEANED_95.jpeg
On the island of Chilo    along Chile s southern coast   women are working to advance their rights and sustainable fishing.For generations women s roles in fishing communities have been overlooked. But leaders like Carola Barr a are changing the story. She s pushing for gender equity organising training for female leaders and ensuring women have a voice in fisheries management.Other female leaders are taking action too as a coalition. They are empowering their community championing equity in the male-dominated fishing industry and protecting ancestral fishing grounds all while mentoring the next generation and preserving traditions.This movement   supported by WWFChile   shows #NaturesHeroes are the key to sustainable development and conservation.,https://imgs.socialinsider.io/instagram/2025/01/wwf_18053861858051705.jpeg,0.12337,2025-01-18 10:00:00,CAROUSEL_ALBUM,Posts_wwf_18_Apr_2024_17_Apr_2025_2c9f 2_CLEANED_96.jpeg
Unlike migratory species corals stay put making them uniquely vulnerable to marine heatwaves. More heat or one big storm could wipe them out. The impacts are global. When we lose corals many coastal communities lose an important source of food and livelihoods.Let s cut fossil fuels and protect ecosystems to #SaveOurOcean. Double tap if you re with us!   coralreefrescueinitiative,https://imgs.socialinsider.io/instagram/2024/06/wwf_17924526698804459.jpeg,0.12155,2024-06-19 10:31:00,reel,Posts_wwf_18_Apr_2024_17_Apr_2025_2c9f 2_CLEANED_97.jpeg
We need URGENT action to address the #ClimateCrisis.But what can we do?  Safeguarding nature is a crucial step towards safeguarding our shared home  Double tap if you want more climate action! #COP29 #ActForOurPlanet,https://imgs.socialinsider.io/instagram/2024/11/wwf_18059656807861765.jpeg,0.12125,2024-11-19 10:00:00,reel,Posts_wwf_18_Apr_2024_17_Apr_2025_2c9f 2_CLEANED_98.jpeg
The Motagua River   once a lifeline for people and wildlife in Guatemala and Honduras   is now drowning in plastic pollution.  We need a strong binding global treaty to stop harmful plastic products and chemicals.  Visit the link in our bio to vote YES for a strong global plastic pollution treaty. Let s save our rivers and protect our planet.   ..#BanIt #SaveOurRivers #StopPlasticPollution #UNGA,https://imgs.socialinsider.io/instagram/2024/09/wwf_17988924053561745.jpeg,0.12068,2024-09-24 12:00:00,CAROUSEL_ALBUM,Posts_wwf_18_Apr_2024_17_Apr_2025_2c9f 2_CLEANED_99.jpeg
By combining their local culture and ancestral knowledge with formal protection local communities in Kavewa Fiji are working together to build climate and community resilience to protect their Cakaulevu.  Cakaulevu also known as Fiji s Great Sea Reef is the third-longest continuous barrier reef system in the world.  Its health is directly linked to the #IndigenousPeoples across Fiji who rely on its resources for their livelihood well-being and culture. It also contributes to global climate resilience and food supply chains across the world.  Their inspiring efforts to protect this irreplaceable seascape are already reaping benefits. Double tap to show your support!,https://imgs.socialinsider.io/instagram/2024/08/wwf_18044173129927135.jpeg,0.12057,2024-08-11 11:00:00,CAROUSEL_ALBUM,Posts_wwf_18_Apr_2024_17_Apr_2025_2c9f 2_CLEANED_100.jpeg
Temperatures in the Arctic have risen almost three times faster than the global average. This is disrupting ocean ecosystems and the livelihoods of many people.Leaders: Now is the time for committed action for people and nature. Share this post to raise awareness! ..#UNGA,https://imgs.socialinsider.io/instagram/2024/09/wwf_18046373476816728.jpeg,0.12,2024-09-25 10:45:00,reel,Posts_wwf_18_Apr_2024_17_Apr_2025_2c9f 2_CLEANED_101.jpeg
Trees provide us with oxygen shelter food and so much more. Their diversity is not only fascinating but also critical for maintaining a healthy planet. Double tap to celebrate the many wonders of trees,https://imgs.socialinsider.io/instagram/2025/02/wwf_18071746117754551.jpeg,0.11992,2025-02-10 10:01:00,reel,Posts_wwf_18_Apr_2024_17_Apr_2025_2c9f 2_CLEANED_102.jpeg
We need URGENT action in the midst of global climate disasters.But what can we do? Safeguarding nature helps us combat the #ClimateCrisis  Double tap if you agree our planet needs greater climate action!,https://imgs.socialinsider.io/instagram/2024/08/wwf_17872471500168740.jpeg,0.11936,2024-08-31 12:00:00,reel,Posts_wwf_18_Apr_2024_17_Apr_2025_2c9f 2_CLEANED_103.jpeg
Amazon pink river dolphins are some of the oldest animals on Earth.  But   in just 22 years   their population numbers have dropped by 65%. Last year extreme heat and drought resulted in the deaths of over 330 Amazon pink river dolphins and tucuxis in two lakes in the State of Amazonas. This is the current  state of our planet   and we can t let it continue.We need action to put an end to biodiversity loss. It s time leaders #ActForOurPlanet people and nature. Double tap if you agree! ..#COP16Colombia,https://imgs.socialinsider.io/instagram/2024/10/wwf_17882818728149156.jpeg,0.11898,2024-10-24 06:00:00,reel,Posts_wwf_18_Apr_2024_17_Apr_2025_2c9f 2_CLEANED_104.jpeg
Tipping points are alarming. But there is a silver lining.  The world has recognised the need for change. And this awareness is a great starting point. Now we need action.Share this to help raise awareness!...#ActForOurPlanet #WWFUntangled #LivingPlanetReport #LPR2024,https://imgs.socialinsider.io/instagram/2024/10/wwf_18047648128817441.jpeg,0.1186,2024-10-16 09:31:00,reel,Posts_wwf_18_Apr_2024_17_Apr_2025_2c9f 2_CLEANED_105.jpeg
More time in nature = more happiness!  Research shows people who spend at least 2 hours a week in nature have a greater sense of well-being than those who dont.Tell us   how do you like to spend your time in nature?,https://imgs.socialinsider.io/instagram/2024/05/wwf_17989353323645185.jpeg,0.11837,2024-05-03 15:01:00,reel,Posts_wwf_18_Apr_2024_17_Apr_2025_2c9f 2_CLEANED_106.jpeg
We are on course to lose up to 90% of coral reefs by 2050. The record-breaking heat stress damaging coral across most of the #GreatBarrierReef is now officially part of a global mass bleaching event accelerating this loss. Protecting sacred Sea Country is up to all of us.,https://imgs.socialinsider.io/instagram/2024/06/wwf_17931361085890071.jpeg,0.11769,2024-06-26 13:08:00,reel,Posts_wwf_18_Apr_2024_17_Apr_2025_2c9f 2_CLEANED_107.jpeg
Single-use plastics are devastating ecosystems particularly Fiji s culturally iconic Sea Turtles. Shockingly an estimated 52% of turtles worldwide have ingested plastic mistaking it for food.  We need a strong global treaty to ban harmful plastics and protect our planet.  Visit the link in our bio to vote YES for a binding global plastic pollution treaty. Let s help put nature on a path to recovery.   ....#SaveOurTurtles #BanIt,https://imgs.socialinsider.io/instagram/2024/09/wwf_17900339517050427.jpeg,0.11693,2024-09-26 11:00:00,CAROUSEL_ALBUM,Posts_wwf_18_Apr_2024_17_Apr_2025_2c9f 2_CLEANED_108.jpeg
Every fraction of a degree counts  We need urgent action on climate finance renewables and adaptation.Double tap to urge leaders to #ActForOurPlanet at #COP29,https://scontent-fra5-2.cdninstagram.com/v/t51.29350-15/466400391_2902331479945540_2882645167361051422_n.jpg?stp=dst-jpg_e35_tt6&_nc_cat=107&ccb=1-7&_nc_sid=18de74&_nc_ohc=1PpOi3CMu6wQ7kNvwHOHMcn&_nc_oc=Adk88hvsJoEZhheOai8nLywGkxFgmyMZ7B4jzheKxs5NDRULLdQRrf2UkloXGLGCSu0&_nc_zt=23&_nc_ht=scontent-fra5-2.cdninstagram.com&edm=AL-3X8kEAAAA&_nc_gid=NBKrARu8Lrhzi-WsqOMP7g&oh=00_AfHyglixYCzMDo_Twl4JR5IdNLWz9-LVZFD3D_kij0gl_w&oe=680497ED,0.11421,2024-11-11 15:04:00,CAROUSEL_ALBUM,
Thats a wrap!  Mina has run the entire 800km length of this beautiful river in just 30 days. Her WWF-backed #SeineRiverRun proves how we can do hard things when we commit. Not long ago the Seine was declared functionally dead. Today it s being restored to health through dedicated clean-up efforts.  Protecting and restoring rivers worldwide is crucial for biodiversity clean water climate resilience community benefits and a sustainable future.  Every effort counts. Together we can make a difference.  #WWF #RiverRestoration #SaveOurRivers #Biodiversity #ClimateAction #CleanWater #Community #SustainableFuture #RunBlue,https://imgs.socialinsider.io/blank.jpg,0.11081,2024-07-05 13:14:00,CAROUSEL_ALBUM,Posts_wwf_18_Apr_2024_17_Apr_2025_2c9f 2_CLEANED_110.jpeg
Meet May Samorn a dedicated Ranger for the Royal Government of Cambodia  He works closely with our research team to protect Cambodias incredible wildlife and plays a crucial role in numerous conservation efforts such as camera trap surveys elephant research and much more.  Double tap to show your support for the unsung heroes of our planet!,https://imgs.socialinsider.io/instagram/2024/07/wwf_18035645369071069.jpeg,0.11065,2024-07-04 11:00:00,CAROUSEL_ALBUM,Posts_wwf_18_Apr_2024_17_Apr_2025_2c9f 2_CLEANED_111.jpeg
We ve been here 10000 years. We know the land. We know the animals.    Jimmy Ullikatalik Manager Taloyoak Umarulirijigut AssociationFind out how #IndigenousPeoples around the world are protecting their lands waters and #wildlife.,https://imgs.socialinsider.io/instagram/2024/05/wwf_17921347760807809.jpeg,0.11009,2024-05-16 14:01:00,reel,Posts_wwf_18_Apr_2024_17_Apr_2025_2c9f 2_CLEANED_112.jpeg
Just like a see-saw nature has a tipping point. If we continue its unprecedented destruction we risk pushing ecosystems past the point of no return. And the impact? It will affect everyone everywhere. We ve may have placed our planet on a dangerous see-saw but if we #ActForOurPlanet   NOW   we can still tip things back in our favour.Playtime is over. It s time to get to work. #WWFUntangled #LivingPlanetReport #LPR2024,https://imgs.socialinsider.io/instagram/2024/10/wwf_18041025143116288.jpeg,0.10471,2024-10-13 09:00:00,reel,Posts_wwf_18_Apr_2024_17_Apr_2025_2c9f 2_CLEANED_113.jpeg
Forests are our lifelines providing oxygen water and livelihoods.   In Zambia community-led conservation is helping safeguard forests. Local heroes conduct prescribed burns to protect these precious resources from wildfires and illegal logging.   Together they ensure our forests remain standing and thriving.  Lets support these efforts to ensure these lifelines remain standing.,https://imgs.socialinsider.io/instagram/2024/08/wwf_17983496186726998.jpeg,0.10324,2024-08-20 16:00:00,CAROUSEL_ALBUM,Posts_wwf_18_Apr_2024_17_Apr_2025_2c9f 2_CLEANED_114.jpeg
A team led by #Indigenous women from four communities in Western Province Solomon Islands   is using their expertise to implement nature-based solutions for their benefit while protecting threatened ecosystems proving that it is possible to:Preserve culture  Conserve nature  Earn income to support your family  Today 40-90% of their weekly income comes directly from selling sea grapes.  And they re only getting started! Double tap to show your support  ...#IndigenousPeoplesDay #NbS #NaturebasedSolutions,https://imgs.socialinsider.io/instagram/2024/08/wwf_18461541061026316.jpeg,0.1032,2024-08-09 12:00:00,CAROUSEL_ALBUM,Posts_wwf_18_Apr_2024_17_Apr_2025_2c9f 2_CLEANED_115.jpeg
Rapid urbanisation in Uganda is bringing a surge of plastic pollution increasing flooding and water contamination.From turning old plastic into new crafts to demanding ambitious action from their government at the global level these women are leading the fight against plastic pollution.  To help them and address this worsening crisis decision-makers must secure a strong treaty to #StopPlasticPollution....#BanIt #StopPlasticPollution #INC5,https://imgs.socialinsider.io/instagram/2024/11/wwf_17864285889268642.jpeg,0.09885,2024-11-25 16:11:00,CAROUSEL_ALBUM,Posts_wwf_18_Apr_2024_17_Apr_2025_2c9f 2_CLEANED_116.jpeg
Our food systems drive 80% of deforestation and 70% of freshwater use.  We must shift demand from high-impact products to sustainable choices. Innovative methods can make our food systems efficient and planet-friendly as well.   Lets work together for a sustainable future. Double tap to show your support! .....#WWFUntangled #food #environment,https://imgs.socialinsider.io/instagram/2024/05/wwf_17977532924562978.jpeg,0.09847,2024-05-30 14:01:00,reel,Posts_wwf_18_Apr_2024_17_Apr_2025_2c9f 2_CLEANED_117.jpeg
Coral reefs are amazing.   They support the livelihoods of 850 million people globally and are essential to 25% of all marine life   despite covering less than 1% of the ocean floor.But as temperatures rise our oceans are feeling the heat. Marine heatwaves are threatening coral reefs coastal communities and our future.Without urgent action we could lose these vibrant and important ecosystems forever threatening the well-being of people and nature.But there are solutions. By cutting fossil fuels and protecting resilient reefs we can #SaveOurOceans   if we act now. Share this post if you re with us! .coralreefrescueinitiative #WWFUntangled #WorldCoralReefDay #WorldReefDay,https://imgs.socialinsider.io/instagram/2024/06/wwf_18035348149812932.jpeg,0.09749,2024-06-01 09:32:00,reel,Posts_wwf_18_Apr_2024_17_Apr_2025_2c9f 2_CLEANED_118.jpeg
Indigenous peoples play an essential role in safeguarding #nature   but are often denied involvement in key decisions. It s vital we help uphold their rights respect their knowledge and appropriately support them to preserve their territories of life.Double tap to show your support for the stewards of our home! ..#WWFUntangled #BiodiversityDay,https://imgs.socialinsider.io/instagram/2024/05/wwf_18037334242924857.jpeg,0.09543,2024-05-28 13:01:00,reel,Posts_wwf_18_Apr_2024_17_Apr_2025_2c9f 2_CLEANED_119.jpeg
Chela Elena Umire of La Chorrera community in the Colombian Amazon combines traditional knowledge with conservation science to safeguard the Amazon and their invaluable heritage. Double tap to show your support for the people protecting our planet  .....#amazonrainforest  #amazonia #amazonas #nature #rainforest #wildlife,https://scontent-fra3-1.cdninstagram.com/v/t51.29350-15/450474978_1496004177666340_7033706225575789400_n.jpg?stp=dst-jpg_e35_tt6&_nc_cat=103&ccb=1-7&_nc_sid=18de74&_nc_ohc=xJ0d-GsmyA0Q7kNvwFk7ZbO&_nc_oc=AdmKhNHEE5_fh4mQC7Q6fmxvOQtH8HBvj1o9XfkUX46FHJMVSOpyxauB4x5vu4fZCng&_nc_zt=23&_nc_ht=scontent-fra3-1.cdninstagram.com&edm=AL-3X8kEAAAA&_nc_gid=tU97lBHTWBn1t5kUpOZVXw&oh=00_AfGBIYo_bEgXxly5qdTsbR2q8ypmhZHb1foFeZEGCdRZfQ&oe=68048A0F,0.09181,2024-07-09 17:01:00,CAROUSEL_ALBUM,
Indigenous peoples play an essential role in safeguarding #nature   but are often denied involvement in key decisions. It s vital we help uphold their rights respect their knowledge and appropriately support them to preserve their territories of life.Double tap to show your support for the stewards of our home! ..#WWFUntangled,https://imgs.socialinsider.io/instagram/2024/09/wwf_18061873210631834.jpeg,0.08966,2024-09-07 11:01:00,reel,Posts_wwf_18_Apr_2024_17_Apr_2025_2c9f 2_CLEANED_121.jpeg
The coral crisis is a #ClimateCrisis and we need urgent action to dial down marine heatwaves.   To protect our ocean we must meet the goal of limiting global warming to 1.5 C. Every fraction of a degree matters for coral reefs and marine life! Double-tap to show your love for our ocean   coralreefrescueinitiative,https://imgs.socialinsider.io/instagram/2024/06/wwf_18034182751858672.jpeg,0.08871,2024-06-22 14:01:00,reel,Posts_wwf_18_Apr_2024_17_Apr_2025_2c9f 2_CLEANED_122.jpeg
Nature unites us.  Forests provide us with food clean water and protection against natural hazards like floods.  One community in Oaxaca Mexico is uniting to restore and sustainably manage their forest and watershed - for the benefit of communities all the way along their river. Restoring the forest restores the river flow. We depend on water from this region. If our river collapses we will all collapse. The community s relationship with nature is shaped by Zapotec culture and traditions which empowers them to create sustainable livelihoods. We are different but we are united. Water unites us.  #RestorationWorks,https://imgs.socialinsider.io/instagram/2024/06/wwf_18026403904950644.jpeg,0.08463,2024-06-10 17:08:00,reel,Posts_wwf_18_Apr_2024_17_Apr_2025_2c9f 2_CLEANED_123.jpeg
How are you helping to #StopPlasticPollution?Tell us in the comments   #INC4,https://imgs.socialinsider.io/instagram/2024/04/wwf_18276673555206352.jpeg,0.08285,2024-04-24 15:11:00,reel,Posts_wwf_18_Apr_2024_17_Apr_2025_2c9f 2_CLEANED_124.jpeg
Coral reefs are amazing.   They support 850M people and 25% of marine life yet cover <1% of the ocean floor. But rising temperatures and marine heatwaves threaten reefs coastal communities and our future.There s hope: by cutting fossil fuels and protecting resilient reefs we can #SaveOurOceans. Double tap if you want greater action for our planet! ....coralreefrescueinitiative #WWFUntangled #COP29 #ActForOurPlanet,https://imgs.socialinsider.io/instagram/2024/11/wwf_17928373256861362.jpeg,81.0,2024-11-21 09:19:00,reel,Posts_wwf_18_Apr_2024_17_Apr_2025_2c9f 2_CLEANED_125.jpeg
Flying Furballs: Bettongs Take to the Skies!Seventy-three brush-tailed bettongs are on a mission impossible - but with a touch of marsupial magic!  Flown over 2000 kilometres from Western Australia to Dhilba Guuranda-Innes National Park in South Australia these tiny marsupials are the heart of an ambitious project - Marna Banggara.  Supported by dedicated teams from WWF Australia Zoos SA DEW and more this effort aims to restore locally extinct species to South Australia s Yorke Peninsula as part of the Marna Banggara project.Thanks to our partners including the Northern and Yorke Landscape Board and the Australian Government were rewriting the story of endangered species conservation!,https://imgs.socialinsider.io/instagram/2024/05/wwf_18249034222300535.jpeg,0.07577,2024-05-08 14:56:00,reel,Posts_wwf_18_Apr_2024_17_Apr_2025_2c9f 2_CLEANED_126.jpeg
Leaders face a choice about the future of our planet. To end the plastic crisis and protect future generations - or not. Key decisions on the Global Plastic Pollution Treaty will be made this week. These choices will shape the future for generations to come.Double tap to show your support for a strong treaty to protect our future. ..#BanIt #StopPlasticPollution #INC5,https://imgs.socialinsider.io/instagram/2024/11/wwf_17850518172342830.jpeg,0.0757,2024-11-24 08:02:00,reel,Posts_wwf_18_Apr_2024_17_Apr_2025_2c9f 2_CLEANED_127.jpeg
Rivers are our lifelines providing us with food water livelihoods connection and more. We need to treat them like our lives depend on them   because they do.That s why Minaguli is setting off on an extraordinary campaign today: to run the length of France s Seine River ahead of the #ParisOlympics.That s the equivalent of 20 marathons in a month from Source to Sea. And she s not doing it because she loves running. Or because she s an Olympic-level athlete.She s doing it to celebrate the work to bring the Seine back to life.And with the world gathering in Paris to highlight the need for all cities and countries to restore their rivers. For people and nature we must protect them. Double tap if you re with us!#SeineRiverRun #RunBlue #GenerationRestoration #WorldEnvironmentDay #GlobalRunningDay,https://imgs.socialinsider.io/instagram/2024/06/wwf_18032353532076559.jpeg,0.07411,2024-06-05 13:18:00,reel,Posts_wwf_18_Apr_2024_17_Apr_2025_2c9f 2_CLEANED_128.jpeg
For millions of years the Leatherback Turtle has journeyed our shared oceans. But now 1 in 2 Leatherback Turtles have ingested plastic risking their whole existence. The solution? A Global Treaty to #StopPlasticPollution. Leaders have pledged to act. This week they must deliver.Share this video if you agree leaders must act!...#BanIt  #INC5,https://imgs.socialinsider.io/instagram/2024/11/wwf_17881144608174969.jpeg,0.07388,2024-11-27 09:02:00,reel,Posts_wwf_18_Apr_2024_17_Apr_2025_2c9f 2_CLEANED_129.jpeg
Our oceans are facing unprecedented challenges.   But there s hope on the horizon! Did you know that specific types of #coral may have the potential to seed and revive struggling coral reef ecosystems? Together with partners and coastal communities we ve mapped resilient reefs in 7 countries that can help regenerate those damaged by #ClimateChange.Double tap to show your support for our incredible planet   coralreefrescueinitiative,https://imgs.socialinsider.io/instagram/2024/06/wwf_18118625992370607.jpeg,0.07282,2024-06-25 12:24:00,reel,Posts_wwf_18_Apr_2024_17_Apr_2025_2c9f 2_CLEANED_130.jpeg
Single-use plastics are devastating ecosystems particularly Fiji s culturally iconic Sea Turtles. Shockingly an estimated 52% of turtles worldwide have ingested plastic mistaking it for food.  We need a strong global treaty to ban harmful plastics and protect our planet.  Visit the link in our bio to vote YES for a binding global plastic pollution treaty. Let s help put nature on a path to recovery.   ....#SaveOurTurtles #BanIt,https://imgs.socialinsider.io/instagram/2024/09/wwf_17886744009098942.jpeg,0.07214,2024-09-26 11:15:00,CAROUSEL_ALBUM,Posts_wwf_18_Apr_2024_17_Apr_2025_2c9f 2_CLEANED_131.jpeg
Plastics are everywhere   in the air we breathe the food we eat and the water we drink. Toxic substances leach into our bodies. It s happening all around the world.The solution? A Global Treaty to #StopPlasticPollution. Share this video to urge leaders to deliver! ..#BanIt #INC5,https://imgs.socialinsider.io/instagram/2024/11/wwf_17859523368244056.jpeg,0.07056,2024-11-30 09:01:00,reel,Posts_wwf_18_Apr_2024_17_Apr_2025_2c9f 2_CLEANED_132.jpeg
Our food systems drive 80% of deforestation and 70% of freshwater use.  We must shift demand from high-impact products to sustainable choices. Innovative methods can make our food systems efficient and planet-friendly as well.   Lets work together for a sustainable future. Double tap to show your support! .....#WWFUntangled #food #environment,https://imgs.socialinsider.io/instagram/2024/09/wwf_18325907581151039.jpeg,0.06984,2024-09-09 13:02:00,reel,Posts_wwf_18_Apr_2024_17_Apr_2025_2c9f 2_CLEANED_133.jpeg
Earth is your perfect match this #ValentinesDay   Filled with all things that sustain and protect us our planet is perfect for us. #SwipeRight on Earth and show it love today and every day   because every person who cares can make a world of difference to our shared home,https://imgs.socialinsider.io/instagram/2025/02/wwf_18129785806365181.jpeg,0.06859,2025-02-14 09:01:00,reel,Posts_wwf_18_Apr_2024_17_Apr_2025_2c9f 2_CLEANED_134.jpeg
Thailand has become the FIRST country in Southeast Asia to increase its wild tiger population!  Wild tiger populations have increased from 148-189 to between 179-223 in 2024. We hope this success inspires greater action for tiger recovery. When we protect tigers we protect so much more. Double tap to show your support!..#GlobalTigerDay,https://imgs.socialinsider.io/instagram/2024/07/wwf_18063455566607329.jpeg,67.0,2024-07-29 12:03:00,reel,Posts_wwf_18_Apr_2024_17_Apr_2025_2c9f 2_CLEANED_135.jpeg
Communities around the world are tackling the plastic crisis head-on. But this is a global problem that demands a global solution. To protect our future we need a binding Global Plastic Pollution Treaty.But while negotiations have been stalling the vulnerable continue to suffer. Share this video to urge leaders to #StopPlasticPollution!...#BanIt #INC5,https://imgs.socialinsider.io/instagram/2024/11/wwf_18034123373103586.jpeg,0.06696,2024-11-28 09:02:00,reel,Posts_wwf_18_Apr_2024_17_Apr_2025_2c9f 2_CLEANED_136.jpeg
Its high time for governments to step up and make nature a top priority in every decision they make   for people and the planet.But it s not entirely up to just them. Each city business and person has a role in turning the tide on nature loss this decade.   We might not solve it overnight but together we have the power to make a difference. Double tap if you agree! ...#WWFUntangled #BiodiversityDay #climatecrisis #nature,https://imgs.socialinsider.io/instagram/2024/05/wwf_18053417854563605.jpeg,0.06583,2024-05-24 15:01:00,reel,Posts_wwf_18_Apr_2024_17_Apr_2025_2c9f 2_CLEANED_137.jpeg
